[
  {
    "title": "GS1 Healthcare - GTIN (Global Trade Item Number)",
    "content": "GS1 Benelux Healthcare Datamodel - Attribuut: GTIN (Global Trade Item Number)\n\n**Identificatie**\n- Attribuutnaam (EN): GTIN (Global Trade Item Number)\n- Business naam: GTIN (Global Trade Item Number)\n- BMS ID: 67\n\n**Definitie**\nThe GS1 Identification Key used to identify trade items. The key comprises a GS1 Company Prefix, an Item Reference and Check Digit.\n\n**Business Definitie**\nThe global number that uniquely identifies a product and its various packaging levels (e.g. item, case, pallet) physical or non-physical.\n\n**Invulinstructie**\nIndicate the GTIN (Global Trade Item Number). If the GTIN consist of less than 14 digits, fill in the value with leading zeros.\n\n**Voorbeeld**\n09054321001117\n\n**ECHO Common Data Set**\nMandatory\n\nBron: GS1 Benelux Healthcare Datamodel (ECHO)\nURL: https://www.gs1belu.org/en/documentation/healthcare-datamodel-3131",
    "source_type": "gs1_nl_datamodel",
    "sector": "Healthcare",
    "attribute_name_en": "GTIN (Global Trade Item Number)",
    "business_name": "GTIN (Global Trade Item Number)",
    "bms_id": "67",
    "url": "https://www.gs1belu.org/en/documentation/healthcare-datamodel-3131",
    "version": "3.1.31"
  },
  {
    "title": "GS1 Healthcare - Additional Trade Item Identification",
    "content": "GS1 Benelux Healthcare Datamodel - Attribuut: Additional Trade Item Identification\n\n**Identificatie**\n- Attribuutnaam (EN): Additional Trade Item Identification\n- Business naam: Additional Product Identification\n- BMS ID: 68\n\n**Definitie**\nAlternative information to identify a trade item, for instance, the item number of the supplier.\n\n**Business Definitie**\nAn identifier, other than the GTIN, which provides an additional identification for the product.\n\n**Invulinstructie**\nIndicate the corresponding value for the 'Additional item identification type code' selected.\n\nIndicate the reference number as mentioned on the label under MANUFACTURER_PART_NUMBER. If the supplier assigns an additional article number to the product, indicate it under SUPPLIER_ASSIGNED.\n\nFor Belgium the following information is additionally required:​\nIndicate the CNK value if a CNK code is assigned, under BE_FAMHP. For implants and long-term invasive medical devices, the notification number is  mandatory https://www.vas.ehealth.fgov.be/registers/sadm/web/search/public. There can be several notification numbers for the same device.\n\nThe attribute 'Additional Trade Item Identification' is used in combination with 'Additional Trade Item Identification Type Code' (BMS ID 69).\n\n**Voorbeeld**\nXXR-234\n\n**ECHO Common Data Set**\nMandatory\n\nBron: GS1 Benelux Healthcare Datamodel (ECHO)\nURL: https://www.gs1belu.org/en/documentation/healthcare-datamodel-3131",
    "source_type": "gs1_nl_datamodel",
    "sector": "Healthcare",
    "attribute_name_en": "Additional Trade Item Identification",
    "business_name": "Additional Product Identification",
    "bms_id": "68",
    "url": "https://www.gs1belu.org/en/documentation/healthcare-datamodel-3131",
    "version": "3.1.31"
  },
  {
    "title": "GS1 Healthcare - Additional Trade Item Identification Type Code",
    "content": "GS1 Benelux Healthcare Datamodel - Attribuut: Additional Trade Item Identification Type Code\n\n**Identificatie**\n- Attribuutnaam (EN): Additional Trade Item Identification Type Code\n- Business naam: Additional Product Identification Type Code\n- BMS ID: 69\n\n**Definitie**\nCode specifying an additional trade item identification type. Allowed code values are specified in GS1 code list AdditionalTradeItemIdentificationTypeCode.\n\n**Business Definitie**\nThe code indicating the type of Additional Product Identification used.\n\n**Invulinstructie**\nIndicate a code from the code list 'AdditionalTradeItemIdentificationTypeCode'.\n\nFor medical devices: the codes ‘MANUFACTURER_PART_NUMBER’ and (if applicable) ‘SUPPLIER_ASSIGNED’ are mandatory.\n\nFor Belgium the following information is additionally required:​\nIndicate 'BE_FAMHP' = the Federal Agency for Medicines and Health Products notification number, for the CNK value. Indicate \"BE_FAMHP_NN\" for the notification number. There can be several notification numbers for the same device\n\nThe attribute 'Additional Trade Item Identification Type Code' is used in combination with 'Additional Trade Item Identification' (BMS ID 68).\n\n\n**Voorbeeld**\nMANUFACTURER_PART_NUMBER\n\n**ECHO Common Data Set**\nConditionally Mandatory\n\nBron: GS1 Benelux Healthcare Datamodel (ECHO)\nURL: https://www.gs1belu.org/en/documentation/healthcare-datamodel-3131",
    "source_type": "gs1_nl_datamodel",
    "sector": "Healthcare",
    "attribute_name_en": "Additional Trade Item Identification Type Code",
    "business_name": "Additional Product Identification Type Code",
    "bms_id": "69",
    "url": "https://www.gs1belu.org/en/documentation/healthcare-datamodel-3131",
    "version": "3.1.31"
  },
  {
    "title": "GS1 Healthcare - Target Market Country Code",
    "content": "GS1 Benelux Healthcare Datamodel - Attribuut: Target Market Country Code\n\n**Identificatie**\n- Attribuutnaam (EN): Target Market Country Code\n- Business naam: Country Of Sale Code\n- BMS ID: 112\n\n**Definitie**\nThe code that identifies the target market. The target market is at country level or higher geographical definition and is where a trade-item is intended to be sold.\n\n**Business Definitie**\nThe code representing the country where the physical or non-physical product is intended to be sold.\n\n**Invulinstructie**\nIndicate a code from the code list 'CountryCode'.\n\n**Voorbeeld**\n528\n\n**ECHO Common Data Set**\nMandatory\n\nBron: GS1 Benelux Healthcare Datamodel (ECHO)\nURL: https://www.gs1belu.org/en/documentation/healthcare-datamodel-3131",
    "source_type": "gs1_nl_datamodel",
    "sector": "Healthcare",
    "attribute_name_en": "Target Market Country Code",
    "business_name": "Country Of Sale Code",
    "bms_id": "112",
    "url": "https://www.gs1belu.org/en/documentation/healthcare-datamodel-3131",
    "version": "3.1.31"
  },
  {
    "title": "GS1 Healthcare - Trade Item Unit Descriptor",
    "content": "GS1 Benelux Healthcare Datamodel - Attribuut: Trade Item Unit Descriptor\n\n**Identificatie**\n- Attribuutnaam (EN): Trade Item Unit Descriptor\n- Business naam: Packaging Level Code\n- BMS ID: 66\n\n**Definitie**\nDescribes the hierarchical level of the trade item. TradeItemUnitIndicator is mandatory. Examples: \"CASE\" , ”PALLET”.\n\n**Business Definitie**\nThe code that describes the product's packaging level.\n\n**Invulinstructie**\nIndicate the hierarchical level of the trade item (e.g. pallet, case, base unit or each etc.) using a code from the code list 'TradeItemUnitDescriptorCode'.\n\n**Voorbeeld**\nBASE_UNIT_OR_EACH\n\n\n**ECHO Common Data Set**\nMandatory\n\nBron: GS1 Benelux Healthcare Datamodel (ECHO)\nURL: https://www.gs1belu.org/en/documentation/healthcare-datamodel-3131",
    "source_type": "gs1_nl_datamodel",
    "sector": "Healthcare",
    "attribute_name_en": "Trade Item Unit Descriptor",
    "business_name": "Packaging Level Code",
    "bms_id": "66",
    "url": "https://www.gs1belu.org/en/documentation/healthcare-datamodel-3131",
    "version": "3.1.31"
  },
  {
    "title": "GS1 Healthcare - Is Trade Item A Base Unit",
    "content": "GS1 Benelux Healthcare Datamodel - Attribuut: Is Trade Item A Base Unit\n\n**Identificatie**\n- Attribuutnaam (EN): Is Trade Item A Base Unit\n- Business naam: Base Unit Indicator\n- BMS ID: 56\n\n**Definitie**\nAn indicator identifying the trade item as the base unit level of the trade item hierarchy.\n\n**Business Definitie**\nThe indicator that specifies this product does not contain another intended sellable unit.\n\n**Invulinstructie**\nIndicate whether the GTIN is the base unit level of the trade item hierarchy or not by selecting 'true' or 'false'.\n\n**Voorbeeld**\ntrue\n\n**ECHO Common Data Set**\nMandatory\n\nBron: GS1 Benelux Healthcare Datamodel (ECHO)\nURL: https://www.gs1belu.org/en/documentation/healthcare-datamodel-3131",
    "source_type": "gs1_nl_datamodel",
    "sector": "Healthcare",
    "attribute_name_en": "Is Trade Item A Base Unit",
    "business_name": "Base Unit Indicator",
    "bms_id": "56",
    "url": "https://www.gs1belu.org/en/documentation/healthcare-datamodel-3131",
    "version": "3.1.31"
  },
  {
    "title": "GS1 Healthcare - Is Trade Item An Orderable Unit",
    "content": "GS1 Benelux Healthcare Datamodel - Attribuut: Is Trade Item An Orderable Unit\n\n**Identificatie**\n- Attribuutnaam (EN): Is Trade Item An Orderable Unit\n- Business naam: Orderable Unit Indicator\n- BMS ID: 60\n\n**Definitie**\nAn indicator identifying that the information provider considers this trade item to be at a hierarchy level where they will accept orders from customers. This may be different from what the information provider identifies as a despatch unit. This may be a relationship dependent based on channel of trade or other point to point agreement.\n\n**Business Definitie**\nThe indicator that specifies the product can be ordered.\n\n**Invulinstructie**\nIndicate whether the GTIN is an orderable unit or not by selecting 'true' or 'false'.\n\n**Voorbeeld**\ntrue\n\n**ECHO Common Data Set**\nMandatory\n\nBron: GS1 Benelux Healthcare Datamodel (ECHO)\nURL: https://www.gs1belu.org/en/documentation/healthcare-datamodel-3131",
    "source_type": "gs1_nl_datamodel",
    "sector": "Healthcare",
    "attribute_name_en": "Is Trade Item An Orderable Unit",
    "business_name": "Orderable Unit Indicator",
    "bms_id": "60",
    "url": "https://www.gs1belu.org/en/documentation/healthcare-datamodel-3131",
    "version": "3.1.31"
  },
  {
    "title": "GS1 Healthcare - Is Trade Item A Despatch Unit",
    "content": "GS1 Benelux Healthcare Datamodel - Attribuut: Is Trade Item A Despatch Unit\n\n**Identificatie**\n- Attribuutnaam (EN): Is Trade Item A Despatch Unit\n- Business naam: Shipping Unit Indicator\n- BMS ID: 58\n\n**Definitie**\nAn indicator identifying that the information provider considers the trade item as a despatch (shipping) unit. This may be relationship dependent based on channel of trade or other point to point agreement.\n\n**Business Definitie**\nThe indicator identifying that the information provider considers the trade item as a shipping unit.\n\n**Invulinstructie**\nIndicate whether the GTIN is a despatch unit or not by selecting 'true' or 'false'.\n\n**Voorbeeld**\nfalse\n\n**ECHO Common Data Set**\nMandatory\n\nBron: GS1 Benelux Healthcare Datamodel (ECHO)\nURL: https://www.gs1belu.org/en/documentation/healthcare-datamodel-3131",
    "source_type": "gs1_nl_datamodel",
    "sector": "Healthcare",
    "attribute_name_en": "Is Trade Item A Despatch Unit",
    "business_name": "Shipping Unit Indicator",
    "bms_id": "58",
    "url": "https://www.gs1belu.org/en/documentation/healthcare-datamodel-3131",
    "version": "3.1.31"
  },
  {
    "title": "GS1 Healthcare - Global Product Classification: GPC Brick",
    "content": "GS1 Benelux Healthcare Datamodel - Attribuut: Global Product Classification: GPC Brick\n\n**Identificatie**\n- Attribuutnaam (EN): Global Product Classification: GPC Brick\n- Business naam: Global Product Category Code\n- BMS ID: 161\n\n**Definitie**\nCode specifying a product category according to the GS1 Global Product Classification (GPC) standard.\n\n**Business Definitie**\nThe code used to group products based on similar characteristics according to the GS1 Global Product Classification (GPC).\n\n**Invulinstructie**\nIndicate the GPC brick for Medical Devices (10005844).\n\n**Voorbeeld**\n10005844\n\n**ECHO Common Data Set**\nMandatory\n\nBron: GS1 Benelux Healthcare Datamodel (ECHO)\nURL: https://www.gs1belu.org/en/documentation/healthcare-datamodel-3131",
    "source_type": "gs1_nl_datamodel",
    "sector": "Healthcare",
    "attribute_name_en": "Global Product Classification: GPC Brick",
    "business_name": "Global Product Category Code",
    "bms_id": "161",
    "url": "https://www.gs1belu.org/en/documentation/healthcare-datamodel-3131",
    "version": "3.1.31"
  },
  {
    "title": "GS1 Healthcare - Information Provider GLN",
    "content": "GS1 Benelux Healthcare Datamodel - Attribuut: Information Provider GLN\n\n**Identificatie**\n- Attribuutnaam (EN): Information Provider GLN\n- Business naam: Data Provider GLN (Global Location Number)\n- BMS ID: 83\n\n**Definitie**\nThe Global Location Number (GLN) is a structured Identification of a physical location, legal or functional entity within an enterprise. The GLN is the primary identifier for the information provider.\n\n**Business Definitie**\nThe Global Location Number (GLN) used to uniquely identify the party providing the product information.\n\n**Invulinstructie**\nIndicate the GLN (Global Location Number) of the party providing the product information.\n\n**Voorbeeld**\n9054321000004\n\n**ECHO Common Data Set**\nMandatory\n\nBron: GS1 Benelux Healthcare Datamodel (ECHO)\nURL: https://www.gs1belu.org/en/documentation/healthcare-datamodel-3131",
    "source_type": "gs1_nl_datamodel",
    "sector": "Healthcare",
    "attribute_name_en": "Information Provider GLN",
    "business_name": "Data Provider GLN (Global Location Number)",
    "bms_id": "83",
    "url": "https://www.gs1belu.org/en/documentation/healthcare-datamodel-3131",
    "version": "3.1.31"
  },
  {
    "title": "GS1 Healthcare - Information Provider Name",
    "content": "GS1 Benelux Healthcare Datamodel - Attribuut: Information Provider Name\n\n**Identificatie**\n- Attribuutnaam (EN): Information Provider Name\n- Business naam: Data Provider Name\n- BMS ID: 85\n\n**Definitie**\nThe name of the information provider expressed in text.\n\n**Business Definitie**\nThe name of the party providing the product information.\n\n**Invulinstructie**\nIndicate the name of the party providing the product information.\n\n\n**Voorbeeld**\nMedProd GmbH\n\n**ECHO Common Data Set**\nMandatory\n\nBron: GS1 Benelux Healthcare Datamodel (ECHO)\nURL: https://www.gs1belu.org/en/documentation/healthcare-datamodel-3131",
    "source_type": "gs1_nl_datamodel",
    "sector": "Healthcare",
    "attribute_name_en": "Information Provider Name",
    "business_name": "Data Provider Name",
    "bms_id": "85",
    "url": "https://www.gs1belu.org/en/documentation/healthcare-datamodel-3131",
    "version": "3.1.31"
  },
  {
    "title": "GS1 Healthcare - Regulation Type Code",
    "content": "GS1 Benelux Healthcare Datamodel - Attribuut: Regulation Type Code\n\n**Identificatie**\n- Attribuutnaam (EN): Regulation Type Code\n- Business naam: Regulation Type Code\n- BMS ID: 3070\n\n**Definitie**\nA code that indicates that a trade item is in compliance with specific applicable government regulations.\n\n**Business Definitie**\nThe code indicating a regulation. Used in conjunction with Regulation Compliance Indicator.\n\n**Invulinstructie**\nIndicate 'CE' confirming the product has a CE mark.\n\n**Voorbeeld**\nCE\n\n**ECHO Common Data Set**\nOptional\n\nBron: GS1 Benelux Healthcare Datamodel (ECHO)\nURL: https://www.gs1belu.org/en/documentation/healthcare-datamodel-3131",
    "source_type": "gs1_nl_datamodel",
    "sector": "Healthcare",
    "attribute_name_en": "Regulation Type Code",
    "business_name": "Regulation Type Code",
    "bms_id": "3070",
    "url": "https://www.gs1belu.org/en/documentation/healthcare-datamodel-3131",
    "version": "3.1.31"
  },
  {
    "title": "GS1 Healthcare - Regulatory Act",
    "content": "GS1 Benelux Healthcare Datamodel - Attribuut: Regulatory Act\n\n**Identificatie**\n- Attribuutnaam (EN): Regulatory Act\n- Business naam: nan\n- BMS ID: 3071\n\n**Definitie**\nThe name given to the requirement assigned by the regulatory agency.\n\n**Invulinstructie**\nIndicate the current applicable legislation using one of the following codes: 'MDD', 'IVDD', 'AIMDD', 'MDR' or 'IVDR'.\n\nThe attribute 'Regulatory Act' is used in combination with 'Regulatory Agency' (BMS ID 3072).\n\n**Voorbeeld**\nMDR\n\n**ECHO Common Data Set**\nOptional\n\nBron: GS1 Benelux Healthcare Datamodel (ECHO)\nURL: https://www.gs1belu.org/en/documentation/healthcare-datamodel-3131",
    "source_type": "gs1_nl_datamodel",
    "sector": "Healthcare",
    "attribute_name_en": "Regulatory Act",
    "business_name": "nan",
    "bms_id": "3071",
    "url": "https://www.gs1belu.org/en/documentation/healthcare-datamodel-3131",
    "version": "3.1.31"
  },
  {
    "title": "GS1 Healthcare - Regulatory Agency",
    "content": "GS1 Benelux Healthcare Datamodel - Attribuut: Regulatory Agency\n\n**Identificatie**\n- Attribuutnaam (EN): Regulatory Agency\n- Business naam: nan\n- BMS ID: 3072\n\n**Definitie**\nThe required information is the name of the specific entity in charge of issuing the permit to a company.\n\n**Invulinstructie**\nIndicate 'EU' as the specific entity in charge of the regulatory act.\n\nThe attribute 'Regulatory Agency' is used in combination with 'Regulatory Act' (BMS ID 3071).\n\n**Voorbeeld**\nEU\n\n**ECHO Common Data Set**\nConditionally Mandatory\n\nBron: GS1 Benelux Healthcare Datamodel (ECHO)\nURL: https://www.gs1belu.org/en/documentation/healthcare-datamodel-3131",
    "source_type": "gs1_nl_datamodel",
    "sector": "Healthcare",
    "attribute_name_en": "Regulatory Agency",
    "business_name": "nan",
    "bms_id": "3072",
    "url": "https://www.gs1belu.org/en/documentation/healthcare-datamodel-3131",
    "version": "3.1.31"
  },
  {
    "title": "GS1 Healthcare - Trade Item Trade Channel Code",
    "content": "GS1 Benelux Healthcare Datamodel - Attribuut: Trade Item Trade Channel Code\n\n**Identificatie**\n- Attribuutnaam (EN): Trade Item Trade Channel Code\n- Business naam: nan\n- BMS ID: 65\n\n**Definitie**\nA grouping of entities by common business model concentration used to define the distribution or marketing segmentation of products, customers and geographic areas into common groups that are supplied, serviced and measured in similar ways.\n\n**Invulinstructie**\nIndicate the code 'HEALTHCARE' to indicate that the data is published to healthcare providers (e.g. hospitals, private clinics) and medical device registries.\n\n**Voorbeeld**\nHEALTHCARE\n\n**ECHO Common Data Set**\nOptional\n\nBron: GS1 Benelux Healthcare Datamodel (ECHO)\nURL: https://www.gs1belu.org/en/documentation/healthcare-datamodel-3131",
    "source_type": "gs1_nl_datamodel",
    "sector": "Healthcare",
    "attribute_name_en": "Trade Item Trade Channel Code",
    "business_name": "nan",
    "bms_id": "65",
    "url": "https://www.gs1belu.org/en/documentation/healthcare-datamodel-3131",
    "version": "3.1.31"
  },
  {
    "title": "GS1 Healthcare - Effective Date Time",
    "content": "GS1 Benelux Healthcare Datamodel - Attribuut: Effective Date Time\n\n**Identificatie**\n- Attribuutnaam (EN): Effective Date Time\n- Business naam: Product Information Effective Date/Time\n- BMS ID: 144\n\n**Definitie**\nThe date on which the information contents of the master data version are valid. Valid = correct or true. This effective date can be used for initial trade item offering, or to mark a change in the information related to an existing trade item. This date would mark when these changes take effect.\n\n**Business Definitie**\nThe date/time when the product information becomes effective.\n\n**Invulinstructie**\nIndicate the date from which the information content of the master data version becomes valid.\n\nThis attribute is mandatory with every change, in order to be able to distinguish between different data versions. The date entered may not be in the past, unless you send a correction.\n \n\n\n**Voorbeeld**\n01.05.2025T00:00:00\n\n**ECHO Common Data Set**\nMandatory\n\nBron: GS1 Benelux Healthcare Datamodel (ECHO)\nURL: https://www.gs1belu.org/en/documentation/healthcare-datamodel-3131",
    "source_type": "gs1_nl_datamodel",
    "sector": "Healthcare",
    "attribute_name_en": "Effective Date Time",
    "business_name": "Product Information Effective Date/Time",
    "bms_id": "144",
    "url": "https://www.gs1belu.org/en/documentation/healthcare-datamodel-3131",
    "version": "3.1.31"
  },
  {
    "title": "GS1 Healthcare - Start Availability Date Time",
    "content": "GS1 Benelux Healthcare Datamodel - Attribuut: Start Availability Date Time\n\n**Identificatie**\n- Attribuutnaam (EN): Start Availability Date Time\n- Business naam: First Ship Date/Time\n- BMS ID: 1025\n\n**Definitie**\nThe date from which the trade item becomes available from the supplier, including seasonal or temporary trade item and services.\n\n**Business Definitie**\nThe date/time the product is first available to ship from the seller or the service is available.\n\n**Invulinstructie**\nIndicate the date from which the GTIN becomes available (to be ordered) from the supplier.\n\n\n**Voorbeeld**\n01.07.2025T00:00:00\n\n**ECHO Common Data Set**\nMandatory\n\nBron: GS1 Benelux Healthcare Datamodel (ECHO)\nURL: https://www.gs1belu.org/en/documentation/healthcare-datamodel-3131",
    "source_type": "gs1_nl_datamodel",
    "sector": "Healthcare",
    "attribute_name_en": "Start Availability Date Time",
    "business_name": "First Ship Date/Time",
    "bms_id": "1025",
    "url": "https://www.gs1belu.org/en/documentation/healthcare-datamodel-3131",
    "version": "3.1.31"
  },
  {
    "title": "GS1 Healthcare - End Availability Date/Time",
    "content": "GS1 Benelux Healthcare Datamodel - Attribuut: End Availability Date/Time\n\n**Identificatie**\n- Attribuutnaam (EN): End Availability Date/Time\n- Business naam: End Availability Date/Time\n- BMS ID: 1002\n\n**Definitie**\nThe date from which the trade item is no longer available from the information provider, including seasonal or temporary trade item and services.\n\n**Business Definitie**\nThe date/time when the product is no longer available for order from the seller.\n\n**Invulinstructie**\nIndicate (if applicable) the date from which the GTIN is no longer available (to be ordered) from the supplier. \n\nThe indicated date value may not be before the 'Start Availability Date Time' (BMS ID 1025).\n\n**Voorbeeld**\n31.12.2026T00:00:00\n\n**ECHO Common Data Set**\nOptional\n\nBron: GS1 Benelux Healthcare Datamodel (ECHO)\nURL: https://www.gs1belu.org/en/documentation/healthcare-datamodel-3131",
    "source_type": "gs1_nl_datamodel",
    "sector": "Healthcare",
    "attribute_name_en": "End Availability Date/Time",
    "business_name": "End Availability Date/Time",
    "bms_id": "1002",
    "url": "https://www.gs1belu.org/en/documentation/healthcare-datamodel-3131",
    "version": "3.1.31"
  },
  {
    "title": "GS1 Healthcare - Discontinued Date Time",
    "content": "GS1 Benelux Healthcare Datamodel - Attribuut: Discontinued Date Time\n\n**Identificatie**\n- Attribuutnaam (EN): Discontinued Date Time\n- Business naam: nan\n- BMS ID: 143\n\n**Definitie**\nCommunicates the date on which the trade item is no longer to be manufactured. Allows the reuse of the GTIN after 48 months with the explicit exception of Apparel, being 30 months and the implicit exception for specialty products (e.g., steel beams).\n\n**Invulinstructie**\nIndicate (if applicable) the date from which the GTIN is no longer to be manufactured. This attribute is mandatory for GTINs which have reached their end of lifetime and will not be on the market anymore.\n\nNote: before depublishing the GTIN, it is important to indicate the 'Discontinued Date Time'.\n\n**Voorbeeld**\n31.10.2026T00:00:00\n\n**ECHO Common Data Set**\nOptional\n\nBron: GS1 Benelux Healthcare Datamodel (ECHO)\nURL: https://www.gs1belu.org/en/documentation/healthcare-datamodel-3131",
    "source_type": "gs1_nl_datamodel",
    "sector": "Healthcare",
    "attribute_name_en": "Discontinued Date Time",
    "business_name": "nan",
    "bms_id": "143",
    "url": "https://www.gs1belu.org/en/documentation/healthcare-datamodel-3131",
    "version": "3.1.31"
  },
  {
    "title": "GS1 Healthcare - Last Change Date Time",
    "content": "GS1 Benelux Healthcare Datamodel - Attribuut: Last Change Date Time\n\n**Identificatie**\n- Attribuutnaam (EN): Last Change Date Time\n- Business naam: nan\n- BMS ID: 145\n\n**Definitie**\nIndicates the point in time where the last modification on a Trade Item was made.\n\n**Invulinstructie**\nIndicates the point in time where the last modification on the GTIN was made. This date is automatically set by the system/data pool.\n\n\n**Voorbeeld**\n15.04.2025T00:00:00\n\n**ECHO Common Data Set**\nMandatory\n\nBron: GS1 Benelux Healthcare Datamodel (ECHO)\nURL: https://www.gs1belu.org/en/documentation/healthcare-datamodel-3131",
    "source_type": "gs1_nl_datamodel",
    "sector": "Healthcare",
    "attribute_name_en": "Last Change Date Time",
    "business_name": "nan",
    "bms_id": "145",
    "url": "https://www.gs1belu.org/en/documentation/healthcare-datamodel-3131",
    "version": "3.1.31"
  },
  {
    "title": "GS1 Healthcare - Contact Type Code",
    "content": "GS1 Benelux Healthcare Datamodel - Attribuut: Contact Type Code\n\n**Identificatie**\n- Attribuutnaam (EN): Contact Type Code\n- Business naam: Contact Type Code\n- BMS ID: 127\n\n**Definitie**\nThe general category of the contact party for a trade item for example Purchasing.\n\n**Business Definitie**\nThe code specifying the type of contact for a product.\n\n**Invulinstructie**\nAttribute used by Switzerland only.\nIndicate for CH-REP: Code 'EAR' (= Authorized representative actor for the data base on medical devices defined in Additional party identification type).\nThe 'Contact Type Code' must be indicated when the number of the CH-Rep is indicated in 'Additional Party Identification' (BMS ID 129) and 'Additional Party Identification Code' (BMS ID 130).\n\n**Voorbeeld**\nEAR\n\n**ECHO Common Data Set**\nConditionally Mandatory\n\nBron: GS1 Benelux Healthcare Datamodel (ECHO)\nURL: https://www.gs1belu.org/en/documentation/healthcare-datamodel-3131",
    "source_type": "gs1_nl_datamodel",
    "sector": "Healthcare",
    "attribute_name_en": "Contact Type Code",
    "business_name": "Contact Type Code",
    "bms_id": "127",
    "url": "https://www.gs1belu.org/en/documentation/healthcare-datamodel-3131",
    "version": "3.1.31"
  },
  {
    "title": "GS1 Healthcare - Contact Name",
    "content": "GS1 Benelux Healthcare Datamodel - Attribuut: Contact Name\n\n**Identificatie**\n- Attribuutnaam (EN): Contact Name\n- Business naam: nan\n- BMS ID: 126\n\n**Definitie**\nThe name of the company or person associated with the contact type. For example, in case of a contact type of CONSUMER_SUPPORT, this could be the company name as expressed on the trade item packaging or label.\n\n**Invulinstructie**\nAttribute used by Switzerland only.\nIndicate the name of the Swiss authorised representative (CH-REP). The name of the CH-REP can only be indicated in addition to the number of the CH-REP indicated in 'Additional Party Identification' (BMS ID 129) and 'Additional Party Identification Code' (BMS ID 130).\n\n\n**Voorbeeld**\nMedProd GmbH\n\n**ECHO Common Data Set**\nOptional\n\nBron: GS1 Benelux Healthcare Datamodel (ECHO)\nURL: https://www.gs1belu.org/en/documentation/healthcare-datamodel-3131",
    "source_type": "gs1_nl_datamodel",
    "sector": "Healthcare",
    "attribute_name_en": "Contact Name",
    "business_name": "nan",
    "bms_id": "126",
    "url": "https://www.gs1belu.org/en/documentation/healthcare-datamodel-3131",
    "version": "3.1.31"
  },
  {
    "title": "GS1 Healthcare - Contact Address",
    "content": "GS1 Benelux Healthcare Datamodel - Attribuut: Contact Address\n\n**Identificatie**\n- Attribuutnaam (EN): Contact Address\n- Business naam: nan\n- BMS ID: 123\n\n**Definitie**\nThe address associated with the contact type. For example, in case of a contact type of CONSUMER_SUPPORT, this could be the full company address as expressed on the trade item packaging or label.\n\n**Invulinstructie**\nAttribute used by Switzerland only.\nIndicate Address of the Swiss authorised representative (CH-REP). The address of the CH-Rep can only be indicated in addition to the Name of the CH-Rep indicated for 'Contact Name' (BMS 126).\n\n**Voorbeeld**\nHauptstrasse 5, CH-3000 Bern\n\n**ECHO Common Data Set**\nConditionally Mandatory\n\nBron: GS1 Benelux Healthcare Datamodel (ECHO)\nURL: https://www.gs1belu.org/en/documentation/healthcare-datamodel-3131",
    "source_type": "gs1_nl_datamodel",
    "sector": "Healthcare",
    "attribute_name_en": "Contact Address",
    "business_name": "nan",
    "bms_id": "123",
    "url": "https://www.gs1belu.org/en/documentation/healthcare-datamodel-3131",
    "version": "3.1.31"
  },
  {
    "title": "GS1 Healthcare - Brand Owner GLN (Global Location Number)",
    "content": "GS1 Benelux Healthcare Datamodel - Attribuut: Brand Owner GLN (Global Location Number)\n\n**Identificatie**\n- Attribuutnaam (EN): Brand Owner GLN (Global Location Number)\n- Business naam: Brand Owner GLN (Global Location Number)\n- BMS ID: 75\n\n**Definitie**\nUnique location number identifying the brand owner. \n\n**Business Definitie**\nThe Global Location Number (GLN) that uniquely identifies the Brand Owner of the product.\n\n**Invulinstructie**\nIndicate the GLN (Global Location number) of the brand owner of the product.\n\nThe attribute 'Brand Owner GLN (Global Location Number)' is used in combination with 'Brand Owner Name' (BMS ID 77).\n\n**Voorbeeld**\n9054321001117\n\n**ECHO Common Data Set**\nConditionally Mandatory\n\nBron: GS1 Benelux Healthcare Datamodel (ECHO)\nURL: https://www.gs1belu.org/en/documentation/healthcare-datamodel-3131",
    "source_type": "gs1_nl_datamodel",
    "sector": "Healthcare",
    "attribute_name_en": "Brand Owner GLN (Global Location Number)",
    "business_name": "Brand Owner GLN (Global Location Number)",
    "bms_id": "75",
    "url": "https://www.gs1belu.org/en/documentation/healthcare-datamodel-3131",
    "version": "3.1.31"
  },
  {
    "title": "GS1 Healthcare - Brand Owner Name",
    "content": "GS1 Benelux Healthcare Datamodel - Attribuut: Brand Owner Name\n\n**Identificatie**\n- Attribuutnaam (EN): Brand Owner Name\n- Business naam: Brand Owner Name\n- BMS ID: 77\n\n**Definitie**\nThe name of the brand owner expressed in text.\n\n**Business Definitie**\nThe name of the Brand Owner.\n\n**Invulinstructie**\nIndicate the name of the brand owner of the product.\n\nThe attribute 'Brand Owner Name' is used in combination with 'Brand Owner GLN (Global Location Number)' (BMS ID 75).\n\n**Voorbeeld**\nMarkMedProd GmbH\n\n**ECHO Common Data Set**\nOptional\n\nBron: GS1 Benelux Healthcare Datamodel (ECHO)\nURL: https://www.gs1belu.org/en/documentation/healthcare-datamodel-3131",
    "source_type": "gs1_nl_datamodel",
    "sector": "Healthcare",
    "attribute_name_en": "Brand Owner Name",
    "business_name": "Brand Owner Name",
    "bms_id": "77",
    "url": "https://www.gs1belu.org/en/documentation/healthcare-datamodel-3131",
    "version": "3.1.31"
  },
  {
    "title": "GS1 Healthcare - Additional Party Identification",
    "content": "GS1 Benelux Healthcare Datamodel - Attribuut: Additional Party Identification\n\n**Identificatie**\n- Attribuutnaam (EN): Additional Party Identification\n- Business naam: nan\n- BMS ID: 129\n\n**Definitie**\nData Universal Numbering System. It is a nine digit numbering system which uniquely identifies an individual business. The DUNS number is a nine-digit number issued by Dun & Bradstreet assigned to each business location in the D&B database having a unique, separate, and distinct operation for the purpose of identifying them. A DUNS number is also a way in which separate corporate entities, having no official relationship, can be branded as one by sharing one DUNS number among the affiliated companies.\n\n**Invulinstructie**\nAttribute used by Switzerland only.\nIndicate the 'Swiss Single Registration Number (CHRN)': Unique registration number assigned by Swissmedic in accordance with MedDO and IvDO. Indicate together with the Additional Party Identification Code CHRN (= Swiss Single Registration Number, Swissmedic).\n\nThe attribute 'Additional Party Identification' is used in combination with the code 'CHRN' for 'Additional Party Identification Code' (BMS ID 130).\n\n\n\n**Voorbeeld**\nCHRN-AR-20002925\n\n**ECHO Common Data Set**\nOptional\n\nBron: GS1 Benelux Healthcare Datamodel (ECHO)\nURL: https://www.gs1belu.org/en/documentation/healthcare-datamodel-3131",
    "source_type": "gs1_nl_datamodel",
    "sector": "Healthcare",
    "attribute_name_en": "Additional Party Identification",
    "business_name": "nan",
    "bms_id": "129",
    "url": "https://www.gs1belu.org/en/documentation/healthcare-datamodel-3131",
    "version": "3.1.31"
  },
  {
    "title": "GS1 Healthcare - Additional Party Identification Code",
    "content": "GS1 Benelux Healthcare Datamodel - Attribuut: Additional Party Identification Code\n\n**Identificatie**\n- Attribuutnaam (EN): Additional Party Identification Code\n- Business naam: nan\n- BMS ID: 130\n\n**Definitie**\nIdentification of a party by use of a code in addition to the Global Location Number.\n\n**Invulinstructie**\nAttribute used by Switzerland only.\nIndicate the code 'CHRN' (= Swiss Single Registration Number (CHRN) from the code list 'AdditionalPartyIdentificationTypeCode'.\n\nThe attribute 'Additional Party Identification Code' is used in combination with 'Additional Party Identification' (BMS ID 129).\n\n**Voorbeeld**\nCHRN\n\n**ECHO Common Data Set**\nConditionally Mandatory\n\nBron: GS1 Benelux Healthcare Datamodel (ECHO)\nURL: https://www.gs1belu.org/en/documentation/healthcare-datamodel-3131",
    "source_type": "gs1_nl_datamodel",
    "sector": "Healthcare",
    "attribute_name_en": "Additional Party Identification Code",
    "business_name": "nan",
    "bms_id": "130",
    "url": "https://www.gs1belu.org/en/documentation/healthcare-datamodel-3131",
    "version": "3.1.31"
  },
  {
    "title": "GS1 Healthcare - Manufacturer name",
    "content": "GS1 Benelux Healthcare Datamodel - Attribuut: Manufacturer name\n\n**Identificatie**\n- Attribuutnaam (EN): Manufacturer name\n- Business naam: Manufacturer Name\n- BMS ID: 93\n\n**Definitie**\nThe name of the party expressed in text.\n\n**Business Definitie**\nThe name of the manufacturer.\n\n**Invulinstructie**\nIndicate the name of the manufacturer of the product as it appears on the label.\n\n**Voorbeeld**\nHerProd GmbH\n\n**ECHO Common Data Set**\nOptional\n\nBron: GS1 Benelux Healthcare Datamodel (ECHO)\nURL: https://www.gs1belu.org/en/documentation/healthcare-datamodel-3131",
    "source_type": "gs1_nl_datamodel",
    "sector": "Healthcare",
    "attribute_name_en": "Manufacturer name",
    "business_name": "Manufacturer Name",
    "bms_id": "93",
    "url": "https://www.gs1belu.org/en/documentation/healthcare-datamodel-3131",
    "version": "3.1.31"
  },
  {
    "title": "GS1 Healthcare - Manufacturing GLN (Global Location Number)",
    "content": "GS1 Benelux Healthcare Datamodel - Attribuut: Manufacturing GLN (Global Location Number)\n\n**Identificatie**\n- Attribuutnaam (EN): Manufacturing GLN (Global Location Number)\n- Business naam: Manufacturing GLN (Global Location Number)\n- BMS ID: 91\n\n**Definitie**\nGLN of the trade item's manufacturer, which can be different from the item's data supplier.\n\n**Business Definitie**\nThe Global Location Number(GLN) that uniquely identifies the party who owns the manufacturing process of the product.\n\n**Invulinstructie**\nIndicate the GLN (Global Location Number) of the manufacturer of the product.\n\n**Voorbeeld**\n9054321002220\n\n**ECHO Common Data Set**\nOptional\n\nBron: GS1 Benelux Healthcare Datamodel (ECHO)\nURL: https://www.gs1belu.org/en/documentation/healthcare-datamodel-3131",
    "source_type": "gs1_nl_datamodel",
    "sector": "Healthcare",
    "attribute_name_en": "Manufacturing GLN (Global Location Number)",
    "business_name": "Manufacturing GLN (Global Location Number)",
    "bms_id": "91",
    "url": "https://www.gs1belu.org/en/documentation/healthcare-datamodel-3131",
    "version": "3.1.31"
  },
  {
    "title": "GS1 Healthcare - Additional Trade Item Classification System Code",
    "content": "GS1 Benelux Healthcare Datamodel - Attribuut: Additional Trade Item Classification System Code\n\n**Identificatie**\n- Attribuutnaam (EN): Additional Trade Item Classification System Code\n- Business naam: Additional Product Classification Type Code\n- BMS ID: 171\n\n**Definitie**\nThe Classification System for the Additional Trade Item Classification\n\n**Business Definitie**\nThe code indicating the type of Additional Product Classification Value used.\n\n**Invulinstructie**\nIndicate the risk class depending on the applicable act:\nCode 85 = EU Directive (MDD/AIMDD/IVDD) Risk class\nCode 76 = EU Regulation (MDR/IVDR) Risk class\n\nFor several countries the following information is additionally required:\nIndicate the classification system used in the target market, i.e.\nAT, CH, DE: Code 31 = ECLASS;\nBE: Code 35 = GMDN, Code 88 = European Medical Device Nomenclature (EMDN);\nDK, SE: Code 5 = UNSPSC;\nNL: Code 35 = GMDN.\n\nThe attribute 'Additional Trade Item Classification System Code' is used in combination with 'Additional Trade Item Classification Code Value' (BMS ID 173), and optionally for code '31' in combination with the 'Additional Trade Item Classification Version' (BMS ID 175).\n\n**Voorbeeld**\n76\n\n**ECHO Common Data Set**\nConditionally Mandatory\n\nBron: GS1 Benelux Healthcare Datamodel (ECHO)\nURL: https://www.gs1belu.org/en/documentation/healthcare-datamodel-3131",
    "source_type": "gs1_nl_datamodel",
    "sector": "Healthcare",
    "attribute_name_en": "Additional Trade Item Classification System Code",
    "business_name": "Additional Product Classification Type Code",
    "bms_id": "171",
    "url": "https://www.gs1belu.org/en/documentation/healthcare-datamodel-3131",
    "version": "3.1.31"
  },
  {
    "title": "GS1 Healthcare - Additional Trade Item Classification Code Value",
    "content": "GS1 Benelux Healthcare Datamodel - Attribuut: Additional Trade Item Classification Code Value\n\n**Identificatie**\n- Attribuutnaam (EN): Additional Trade Item Classification Code Value\n- Business naam: Additional Product Classification Value\n- BMS ID: 173\n\n**Definitie**\nCategory code based on alternate classification schema chosen in addition to GS1 classification\n\n**Business Definitie**\nA value, other than the Global Product Category Code, which classifies the product, based on the Additional Product Classification Type Code.\n\n**Invulinstructie**\nIndicate the category code of the trade item based on the alternate classification schema chosen in addition to GS1 classification schema.\n\nFor code '76 (EU MDR/IVDR Risk class)' indicate one of the following values:  EU_CLASS_I, EU_CLASS_IIA, EU_CLASS_IIB, EU_CLASS_III, EU_CLASS_A, EU_CLASS_B, EU_CLASS_C, EU_CLASS_D.\n\nFor code '85 (EU Directive MDD/AIMDD/IVDD risk class)' indicate one of the following values: \nEU_CLASS_I, EU_CLASS_IIA, EU_CLASS_IIB, EU_CLASS_III, IVDD_ANNEX_II_LIST_A, IVDD_ANNEX_II_LIST_B, IVDD_DEVICES_SELF_TESTING, IVDD_GENERAL.\n\nFor code '5', indicate the UNSPSC that applies to the product.\n\nFor code '31', indicate the ECLASS that applies to the medical device. Indicate the information in combination with the 'Additional trade item classification version' (BMS ID 175).\n\nFor code '35', indicate the GMDN code that applies to the medical device. The GMDN code is a number between 10000 and 90000.\n\nFor code '88', indicate the EMDN code that applies to the medical device. \n\nThe attribute 'Additional Trade Item Classification Code Value' is used in combination with 'Additional Trade Item Classification System Code' (BMS ID 171).\n\n**Voorbeeld**\nEU_CLASS_III\n\n\n**ECHO Common Data Set**\nConditionally Mandatory\n\nBron: GS1 Benelux Healthcare Datamodel (ECHO)\nURL: https://www.gs1belu.org/en/documentation/healthcare-datamodel-3131",
    "source_type": "gs1_nl_datamodel",
    "sector": "Healthcare",
    "attribute_name_en": "Additional Trade Item Classification Code Value",
    "business_name": "Additional Product Classification Value",
    "bms_id": "173",
    "url": "https://www.gs1belu.org/en/documentation/healthcare-datamodel-3131",
    "version": "3.1.31"
  },
  {
    "title": "GS1 Healthcare - Additional Trade Item Classification Version",
    "content": "GS1 Benelux Healthcare Datamodel - Attribuut: Additional Trade Item Classification Version\n\n**Identificatie**\n- Attribuutnaam (EN): Additional Trade Item Classification Version\n- Business naam: nan\n- BMS ID: 175\n\n**Definitie**\nThe identification of a release of a particular product classification.\n\n**Invulinstructie**\nFor Austria and Switzerland: \nIndicate the version for code '31' (ECLASS). The version must be 11.0 or higher. \n\nThe attribute 'Additional Trade Item Classification Version' is used in combination with 'Additional Trade Item Classification Code Value' (BMS ID 173) and 'Additional Trade Item Classification System Code' (BMS ID 171).\n\n\n\n**Voorbeeld**\n11\n\n**ECHO Common Data Set**\nConditionally Mandatory\n\nBron: GS1 Benelux Healthcare Datamodel (ECHO)\nURL: https://www.gs1belu.org/en/documentation/healthcare-datamodel-3131",
    "source_type": "gs1_nl_datamodel",
    "sector": "Healthcare",
    "attribute_name_en": "Additional Trade Item Classification Version",
    "business_name": "nan",
    "bms_id": "175",
    "url": "https://www.gs1belu.org/en/documentation/healthcare-datamodel-3131",
    "version": "3.1.31"
  },
  {
    "title": "GS1 Healthcare - Import Classification Type Code",
    "content": "GS1 Benelux Healthcare Datamodel - Attribuut: Import Classification Type Code\n\n**Identificatie**\n- Attribuutnaam (EN): Import Classification Type Code\n- Business naam: Customs Classification Type Code\n- BMS ID: 2776\n\n**Definitie**\nImports and exports of trade items typically require classification codes to determine appropriate duties and tariffs. Values include Netherlands Import Code, Harmonized Commodity Description and Coding System, Customs Tariff and INTRASTAT Code, Harmonized Tariff Schedule of the United States, INTRASTAT Combined Nomenclature, Tarif Intégré de la Communauté\n\n**Business Definitie**\nThe code that describes the customs classification system.\n\n**Invulinstructie**\nIndicate the code 'INTRASTAT' for the 8-digit INTRASTAT number, from the code list 'ImportClassificationTypeCode'.\n\nThe attribute 'Import Classification Type Code' is used in combination with 'Import Classification Value' (BMS ID 2777).\n\n\n**Voorbeeld**\nINTRASTAT\n\n**ECHO Common Data Set**\nConditionally Mandatory\n\nBron: GS1 Benelux Healthcare Datamodel (ECHO)\nURL: https://www.gs1belu.org/en/documentation/healthcare-datamodel-3131",
    "source_type": "gs1_nl_datamodel",
    "sector": "Healthcare",
    "attribute_name_en": "Import Classification Type Code",
    "business_name": "Customs Classification Type Code",
    "bms_id": "2776",
    "url": "https://www.gs1belu.org/en/documentation/healthcare-datamodel-3131",
    "version": "3.1.31"
  },
  {
    "title": "GS1 Healthcare - Import Classification Value",
    "content": "GS1 Benelux Healthcare Datamodel - Attribuut: Import Classification Value\n\n**Identificatie**\n- Attribuutnaam (EN): Import Classification Value\n- Business naam: Customs Classification Value\n- BMS ID: 2777\n\n**Definitie**\nThe value for an associated import classification type.\n\n**Business Definitie**\nThe tariff value applied to a product associated with the Customs Classification Type Code\n\n**Invulinstructie**\nIndicate the appropriate 8-digit INTRASTAT number for the product.\n\nThe attribute 'Import Classification Value' is used in combination with  'Import Classification Type Code' (BMS ID 2776).\n\n**Voorbeeld**\n90181910\n\n**ECHO Common Data Set**\nOptional\n\nBron: GS1 Benelux Healthcare Datamodel (ECHO)\nURL: https://www.gs1belu.org/en/documentation/healthcare-datamodel-3131",
    "source_type": "gs1_nl_datamodel",
    "sector": "Healthcare",
    "attribute_name_en": "Import Classification Value",
    "business_name": "Customs Classification Value",
    "bms_id": "2777",
    "url": "https://www.gs1belu.org/en/documentation/healthcare-datamodel-3131",
    "version": "3.1.31"
  },
  {
    "title": "GS1 Healthcare - Brand Name",
    "content": "GS1 Benelux Healthcare Datamodel - Attribuut: Brand Name\n\n**Identificatie**\n- Attribuutnaam (EN): Brand Name\n- Business naam: Brand Name\n- BMS ID: 3541\n\n**Definitie**\nThe recognisable name used by a brand owner to uniquely identify a line of trade item or services. This is recognizable by the consumer.\n\n**Business Definitie**\nThe name provided by the brand owner that is intended to be recognised by the consumer as represented on the product.\n\n**Invulinstructie**\nIndicate the brand name of the product. The name that is intended to be recognised by the end user as represented on the product. Used by a brand owner to uniquely identify a line of trade item or services.\n\nUse 'UNBRANDED' for items without a brand.\n\n**Voorbeeld**\nSUPERMED\n\n**ECHO Common Data Set**\nOptional\n\nBron: GS1 Benelux Healthcare Datamodel (ECHO)\nURL: https://www.gs1belu.org/en/documentation/healthcare-datamodel-3131",
    "source_type": "gs1_nl_datamodel",
    "sector": "Healthcare",
    "attribute_name_en": "Brand Name",
    "business_name": "Brand Name",
    "bms_id": "3541",
    "url": "https://www.gs1belu.org/en/documentation/healthcare-datamodel-3131",
    "version": "3.1.31"
  },
  {
    "title": "GS1 Healthcare - Additional Trade Item Description",
    "content": "GS1 Benelux Healthcare Datamodel - Attribuut: Additional Trade Item Description\n\n**Identificatie**\n- Attribuutnaam (EN): Additional Trade Item Description\n- Business naam: additionalTradeItemDescription\n\n(GDD Name)\n- BMS ID: 3504\n\n**Definitie**\nAdditional variants necessary to communicate to the\nindustry to help define the product. Multiple variants can be\nestablished for each GTIN. This is a repeatable field, e.g.\nStyle, Colour, and Fragrance.\n\n**Business Definitie**\nAdditional variants necessary to communicate to the industry to help define the product. Multiple variants can be established for each GTIN. This is a repeatable field, e.g. Style, Colour, and Fragrance.\n\n(GDD Definition)\n\n**Invulinstructie**\nIndicate the full and not abreviated product description as it appears on the packaging label. It is recommended to use brand name, function, net content and, where applicable on case level, quantity of next lower level trade item followed by detailed information on the characteristic properties of the product in the language(s) of the target market and applicable other language(s) used on the label.\n\nUse, if 'Trade Item Description' (BMS ID 3517) is not long enough to provide full description without abreviations and for detailed information on the characteristic properties of the product.\n\nApplicable languages per target market:\nBelgium / Luxembourg – Dutch, French and German. Germany – German is mandatory, English is optional, Switzerland – German, French, Italian (at least 2 of them), Ireland - English, Netherlands - Dutch and/or English, Austria - German, Sweden - Swedish\n\n\n**Voorbeeld**\nCatheter of the new generation for use in all areas of cardiac ablation.\n\n**ECHO Common Data Set**\nOptional\n\nBron: GS1 Benelux Healthcare Datamodel (ECHO)\nURL: https://www.gs1belu.org/en/documentation/healthcare-datamodel-3131",
    "source_type": "gs1_nl_datamodel",
    "sector": "Healthcare",
    "attribute_name_en": "Additional Trade Item Description",
    "business_name": "additionalTradeItemDescription\n\n(GDD Name)",
    "bms_id": "3504",
    "url": "https://www.gs1belu.org/en/documentation/healthcare-datamodel-3131",
    "version": "3.1.31"
  },
  {
    "title": "GS1 Healthcare - Trade Item Description",
    "content": "GS1 Benelux Healthcare Datamodel - Attribuut: Trade Item Description\n\n**Identificatie**\n- Attribuutnaam (EN): Trade Item Description\n- Business naam: Product Description\n- BMS ID: 3517\n\n**Definitie**\nAn understandable and useable description of a trade item using brand and other descriptors.\nThis attribute is filled with as little abbreviation as possible while keeping to a reasonable length.\nThis should be a meaningful description of the trade item with full spelling to facilitate message processing. Retailers can use this description as the base to fully understand the brand, flavour, scent etc. of the specific GTIN in order to accurately create a product description as needed for their internal systems.\nExamples:\n- GS1 Brand Base Invisible Solid Deodorant AP Stick Spring Breeze\n- GS1 Brand Laundry Detergent Liquid Compact Regular Instant Stain 1\n- GS1 Brand Hair Colour Liquid Light to Medium Blonde\n\n**Business Definitie**\nAn understandable and useable description of a product using a combination of key elements such as Brand Name, Sub-Brand (if applicable), Functional Name, Variant, and Net Content. The description should be unique and meaningful for the Retailers to manage\n\n**Invulinstructie**\nIndicate here the product description as it appears on the packaging label in the language(s) of the target market and applicable other language(s) used on the label. It is recommended to use brand name, function, net content and, where applicable on case level, quantity of next lower level trade item.\n\nApplicable languages per target market:\nBelgium / Luxembourg – Dutch, French and German. Germany – German is mandatory, English is optional, Switzerland – German, French, Italian (at least 2 of them), Ireland - English, Netherlands - Dutch and/or English, Austria - German, Sweden - Swedish\n\n**Voorbeeld**\nSuper1 Catheter 9mm\n\n**ECHO Common Data Set**\nMandatory\n\nBron: GS1 Benelux Healthcare Datamodel (ECHO)\nURL: https://www.gs1belu.org/en/documentation/healthcare-datamodel-3131",
    "source_type": "gs1_nl_datamodel",
    "sector": "Healthcare",
    "attribute_name_en": "Trade Item Description",
    "business_name": "Product Description",
    "bms_id": "3517",
    "url": "https://www.gs1belu.org/en/documentation/healthcare-datamodel-3131",
    "version": "3.1.31"
  },
  {
    "title": "GS1 Healthcare - Description Short",
    "content": "GS1 Benelux Healthcare Datamodel - Attribuut: Description Short\n\n**Identificatie**\n- Attribuutnaam (EN): Description Short\n- Business naam: Short Product Name\n- BMS ID: 3506\n\n**Definitie**\nA free form short length description of the trade item that can be used to identify the trade item at point of sale.\n\n**Business Definitie**\nThe shortened product name for the consumer product.\n\n**Invulinstructie**\nIndicate the short product name for the product at least in the language(s) of the target market.\n\nApplicable languages per target market:\nBelgium / Luxembourg – Dutch, French and German. Germany – German is mandatory, English is optional, Switzerland – German, French, Italian (at least 2 of them), Ireland - English, Netherlands - Dutch and/or English, Austria - German, Sweden - Swedish\n\n**Voorbeeld**\nSUP Cath 9mm\n\n**ECHO Common Data Set**\nOptional\n\nBron: GS1 Benelux Healthcare Datamodel (ECHO)\nURL: https://www.gs1belu.org/en/documentation/healthcare-datamodel-3131",
    "source_type": "gs1_nl_datamodel",
    "sector": "Healthcare",
    "attribute_name_en": "Description Short",
    "business_name": "Short Product Name",
    "bms_id": "3506",
    "url": "https://www.gs1belu.org/en/documentation/healthcare-datamodel-3131",
    "version": "3.1.31"
  },
  {
    "title": "GS1 Healthcare - Child Trade Item Identification",
    "content": "GS1 Benelux Healthcare Datamodel - Attribuut: Child Trade Item Identification\n\n**Identificatie**\n- Attribuutnaam (EN): Child Trade Item Identification\n- Business naam: GTIN (Global Trade Item Number) of the Contained Product\n- BMS ID: 203\n\n**Definitie**\nThe GS1 Identification Key used to identify trade items. The key comprises a GS1 Company Prefix, an Item Reference and Check Digit.\n\n**Business Definitie**\nThe GTIN that uniquely identifies the next lower level product within the packaging/item hierarchy.\n\n**Invulinstructie**\nIndicate the GTIN that uniquely identifies the next lower level product within the packaging/item hierarchy (the GTIN of the contained article).\n\n**Voorbeeld**\n09054321002114\n\n**ECHO Common Data Set**\nConditionally Mandatory\n\nBron: GS1 Benelux Healthcare Datamodel (ECHO)\nURL: https://www.gs1belu.org/en/documentation/healthcare-datamodel-3131",
    "source_type": "gs1_nl_datamodel",
    "sector": "Healthcare",
    "attribute_name_en": "Child Trade Item Identification",
    "business_name": "GTIN (Global Trade Item Number) of the Contained Product",
    "bms_id": "203",
    "url": "https://www.gs1belu.org/en/documentation/healthcare-datamodel-3131",
    "version": "3.1.31"
  },
  {
    "title": "GS1 Healthcare - Quantity Of Next Lower Level Trade Item",
    "content": "GS1 Benelux Healthcare Datamodel - Attribuut: Quantity Of Next Lower Level Trade Item\n\n**Identificatie**\n- Attribuutnaam (EN): Quantity Of Next Lower Level Trade Item\n- Business naam: Count of Each Specific Product\n- BMS ID: 202\n\n**Definitie**\nThe number of one child trade item (as identified by the association of ChildTradeItem class to TradeItemIdentification class) contained by the parent trade item. The child trade item must be in the hierarchy level immediately below the parent trade item.\n\n**Business Definitie**\nThe count of each specific product within this item.\n\n**Invulinstructie**\nIndicate for the 'Child Trade Item Identification' the total amount of products on this level of the packaging/item hierarchy. This information is usually auto populated by the data pool.\n\n**Voorbeeld**\n10\n\n**ECHO Common Data Set**\nConditionally Mandatory\n\nBron: GS1 Benelux Healthcare Datamodel (ECHO)\nURL: https://www.gs1belu.org/en/documentation/healthcare-datamodel-3131",
    "source_type": "gs1_nl_datamodel",
    "sector": "Healthcare",
    "attribute_name_en": "Quantity Of Next Lower Level Trade Item",
    "business_name": "Count of Each Specific Product",
    "bms_id": "202",
    "url": "https://www.gs1belu.org/en/documentation/healthcare-datamodel-3131",
    "version": "3.1.31"
  },
  {
    "title": "GS1 Healthcare - Quantity of Children",
    "content": "GS1 Benelux Healthcare Datamodel - Attribuut: Quantity of Children\n\n**Identificatie**\n- Attribuutnaam (EN): Quantity of Children\n- Business naam: Number of Different Products\n- BMS ID: 199\n\n**Definitie**\nValue indicates the number of unique next lower level trade items contained in a complex trade item. A complex trade item can contain at least 2 different GTINs.\n\n**Business Definitie**\nThe number of different products, each with a unique GTIN, within this item.\n\n**Invulinstructie**\nIndicate the number of different unique items (GTINs) at this particular level of the packaging/item hierarchy. \n\n\n\n**Voorbeeld**\n1\n\n**ECHO Common Data Set**\nConditionally Mandatory\n\nBron: GS1 Benelux Healthcare Datamodel (ECHO)\nURL: https://www.gs1belu.org/en/documentation/healthcare-datamodel-3131",
    "source_type": "gs1_nl_datamodel",
    "sector": "Healthcare",
    "attribute_name_en": "Quantity of Children",
    "business_name": "Number of Different Products",
    "bms_id": "199",
    "url": "https://www.gs1belu.org/en/documentation/healthcare-datamodel-3131",
    "version": "3.1.31"
  },
  {
    "title": "GS1 Healthcare - Total Quantity Of Next Lower Level Trade Item",
    "content": "GS1 Benelux Healthcare Datamodel - Attribuut: Total Quantity Of Next Lower Level Trade Item\n\n**Identificatie**\n- Attribuutnaam (EN): Total Quantity Of Next Lower Level Trade Item\n- Business naam: Total Count of All Products\n- BMS ID: 200\n\n**Definitie**\nThis represents the Total quantity of next lower level trade items that this trade item contains.\n\n**Business Definitie**\nThe total count of all products within this item.\n\n**Invulinstructie**\nIndicate the total amount of products at this particular level of the packaging/item hierarchy (total count of all products within this item). This information is usually auto populated by the data pool.\n\n\n\n**Voorbeeld**\n10\n\n**ECHO Common Data Set**\nConditionally Mandatory\n\nBron: GS1 Benelux Healthcare Datamodel (ECHO)\nURL: https://www.gs1belu.org/en/documentation/healthcare-datamodel-3131",
    "source_type": "gs1_nl_datamodel",
    "sector": "Healthcare",
    "attribute_name_en": "Total Quantity Of Next Lower Level Trade Item",
    "business_name": "Total Count of All Products",
    "bms_id": "200",
    "url": "https://www.gs1belu.org/en/documentation/healthcare-datamodel-3131",
    "version": "3.1.31"
  },
  {
    "title": "GS1 Healthcare - Referenced File Type Code",
    "content": "GS1 Benelux Healthcare Datamodel - Attribuut: Referenced File Type Code\n\n**Identificatie**\n- Attribuutnaam (EN): Referenced File Type Code\n- Business naam: Digital Asset Type Code\n- BMS ID: 2999\n\n**Definitie**\nThe type of file that is being referenced, for example Safety Data Sheet or Product Image.\n\n**Business Definitie**\nThe code identifying the type of digital asset that is being referenced.\n\n**Invulinstructie**\nIndicate this attribute with the code 'DECLARATION_OF_CONFORMITY’, 'PRODUCT_IMAGE’ and ‘PRODUCT_LABEL_IMAGE’. For all medical devices certified by a notified body ‘CERTIFICATION’ is mandatory.​\n\nFor more information about sharing product images, please see the GS1 Product Image Specification Standard | GS1: https://www.gs1.org/standards/gs1-product-image-specification-standard/current-standard. ​\n​\nFor the Netherlands the following information is additionally required:​\nThe IFU and cleaning, disinfection and sterilisation instructions are mandatory for all class III and IIb medical devices, and for all class I and IIa sterile, reusable or with measuring function medical devices. If the IFU contains the cleaning, disinfection and sterilisation instructions use the code 'IFU_INCLUDING_CLEANING_DISINFECTION_STERILISATION_INSTRUCTIONS'. If the information is available in 2 separate documents use the codes 'IFU' and 'CLEANING_DISINFECTION_STERILISATION_INSTRUCTIONS', and share both documents.​\n​\nDue to the transition from MDD/IVDD/AIMDD to MDR/IVDR, a 'self-declaration/manufacturer's declaration' must be included if the CE certification has expired or is about to expire. Use the code 'DOCUMENT' for this purpose.\n\nThe attribute 'Referenced File Type Code' is used in combination with 'Uniform Resource Identifier' (BMS ID 3000) and optionally 'File Name' (BMS ID 2955).\n\n**Voorbeeld**\nCERTIFICATION\n\n\n**ECHO Common Data Set**\nConditionally Mandatory\n\nBron: GS1 Benelux Healthcare Datamodel (ECHO)\nURL: https://www.gs1belu.org/en/documentation/healthcare-datamodel-3131",
    "source_type": "gs1_nl_datamodel",
    "sector": "Healthcare",
    "attribute_name_en": "Referenced File Type Code",
    "business_name": "Digital Asset Type Code",
    "bms_id": "2999",
    "url": "https://www.gs1belu.org/en/documentation/healthcare-datamodel-3131",
    "version": "3.1.31"
  },
  {
    "title": "GS1 Healthcare - Uniform Resource Identifier",
    "content": "GS1 Benelux Healthcare Datamodel - Attribuut: Uniform Resource Identifier\n\n**Identificatie**\n- Attribuutnaam (EN): Uniform Resource Identifier\n- Business naam: Product Image URL\n- BMS ID: 3000\n\n**Definitie**\nSimple text string that refers to a resource on the internet, URLs may refer to documents, resources, people, etc.\n\n**Business Definitie**\nThe Uniform Resource Locator (URL) for the high-resolution product image that clearly depicts the primary selling surface of the product.  Buyers should be able to use the image to authenticate the identity of the item.\n\n**Invulinstructie**\nIndicate the link (URL) related to the selected 'Referenced File Type Code' (BMS ID 2999) or if supported by your data pool create a link (URL) by uploading the asset, e.g. certificate, product image. In the case of sharing a link (URL), it should lead directly to the relevant document (without going through login and search screens).\n\nThe attribute 'Uniform Resource Identifier' is used in combination with 'Referenced File Type Code' (BMS ID 2999)  and 'File Name' (BMS ID 2955).\n\n**Voorbeeld**\nwww.medprod.com/Bild123.jpg\n\n**ECHO Common Data Set**\nOptional\n\nBron: GS1 Benelux Healthcare Datamodel (ECHO)\nURL: https://www.gs1belu.org/en/documentation/healthcare-datamodel-3131",
    "source_type": "gs1_nl_datamodel",
    "sector": "Healthcare",
    "attribute_name_en": "Uniform Resource Identifier",
    "business_name": "Product Image URL",
    "bms_id": "3000",
    "url": "https://www.gs1belu.org/en/documentation/healthcare-datamodel-3131",
    "version": "3.1.31"
  },
  {
    "title": "GS1 Healthcare - File Name",
    "content": "GS1 Benelux Healthcare Datamodel - Attribuut: File Name\n\n**Identificatie**\n- Attribuutnaam (EN): File Name\n- Business naam: Digital Asset File Name\n- BMS ID: 2995\n\n**Definitie**\nThe name of the file that contains the external information.\n\n**Business Definitie**\nThe file name of the digital asset, for images according to the GS1 Product Image Specification Standard.\n\n**Invulinstructie**\nIndicate the name of the file related to the indicated 'Uniform Resource Identifier'. If supported by your data pool, the attribute is automatically filled by means of the asset upload. \n\nThe attribute 'File Name' is used in combination with 'Referenced File Type Code' (BMS ID 2999)  and 'Uniform Resource Identifier' (BMS ID 3000).\n\n**Voorbeeld**\nSupKat1.jpg\n\n**ECHO Common Data Set**\nConditionally Optional\n\nBron: GS1 Benelux Healthcare Datamodel (ECHO)\nURL: https://www.gs1belu.org/en/documentation/healthcare-datamodel-3131",
    "source_type": "gs1_nl_datamodel",
    "sector": "Healthcare",
    "attribute_name_en": "File Name",
    "business_name": "Digital Asset File Name",
    "bms_id": "2995",
    "url": "https://www.gs1belu.org/en/documentation/healthcare-datamodel-3131",
    "version": "3.1.31"
  },
  {
    "title": "GS1 Healthcare - Certification Agency",
    "content": "GS1 Benelux Healthcare Datamodel - Attribuut: Certification Agency\n\n**Identificatie**\n- Attribuutnaam (EN): Certification Agency\n- Business naam: nan\n- BMS ID: 665\n\n**Definitie**\nName of the organization issuing the certification standard or other requirement being met.\n\n**Invulinstructie**\nIndicate the name of the organisation that issued the certification (notified body), as written in the CE certificate.\n\n\n**Voorbeeld**\nTÜV SÜD Produkt Service GmbH\n\n**ECHO Common Data Set**\nConditionally Optional\n\nBron: GS1 Benelux Healthcare Datamodel (ECHO)\nURL: https://www.gs1belu.org/en/documentation/healthcare-datamodel-3131",
    "source_type": "gs1_nl_datamodel",
    "sector": "Healthcare",
    "attribute_name_en": "Certification Agency",
    "business_name": "nan",
    "bms_id": "665",
    "url": "https://www.gs1belu.org/en/documentation/healthcare-datamodel-3131",
    "version": "3.1.31"
  },
  {
    "title": "GS1 Healthcare - Certification Value",
    "content": "GS1 Benelux Healthcare Datamodel - Attribuut: Certification Value\n\n**Identificatie**\n- Attribuutnaam (EN): Certification Value\n- Business naam: Certification Value\n- BMS ID: 685\n\n**Definitie**\nThe unique identification (ID) that provides a trade item's certification standard value, official licensing number or identification which proves that a product/process has passed the certification procedure.\n\n\n**Business Definitie**\nThe number of the certificate provided by the certification agency.\n\n**Invulinstructie**\nIndicate the number of the certificate, as written in the CE certificate. The attribute is mandatory for every CE certificate provided by a notified body.\n\n**Voorbeeld**\nG2MS 0061967 0002 Rev. 00\n\n**ECHO Common Data Set**\nOptional\n\nBron: GS1 Benelux Healthcare Datamodel (ECHO)\nURL: https://www.gs1belu.org/en/documentation/healthcare-datamodel-3131",
    "source_type": "gs1_nl_datamodel",
    "sector": "Healthcare",
    "attribute_name_en": "Certification Value",
    "business_name": "Certification Value",
    "bms_id": "685",
    "url": "https://www.gs1belu.org/en/documentation/healthcare-datamodel-3131",
    "version": "3.1.31"
  },
  {
    "title": "GS1 Healthcare - Certification Effective End Date Time",
    "content": "GS1 Benelux Healthcare Datamodel - Attribuut: Certification Effective End Date Time\n\n**Identificatie**\n- Attribuutnaam (EN): Certification Effective End Date Time\n- Business naam: nan\n- BMS ID: 682\n\n**Definitie**\nThe date and time upon which the certification is no longer effective.\n\n**Invulinstructie**\nIndicate the date from which the CE certificate will expire, as written in the CE certificate. The attribute is mandatory for every CE certificate provided by a notified body.\n\n\n\n**Voorbeeld**\n01.01.2022T00:00:00\n\n**ECHO Common Data Set**\nConditionally Optional\n\nBron: GS1 Benelux Healthcare Datamodel (ECHO)\nURL: https://www.gs1belu.org/en/documentation/healthcare-datamodel-3131",
    "source_type": "gs1_nl_datamodel",
    "sector": "Healthcare",
    "attribute_name_en": "Certification Effective End Date Time",
    "business_name": "nan",
    "bms_id": "682",
    "url": "https://www.gs1belu.org/en/documentation/healthcare-datamodel-3131",
    "version": "3.1.31"
  },
  {
    "title": "GS1 Healthcare - Additional Certification Organisation Identifier",
    "content": "GS1 Benelux Healthcare Datamodel - Attribuut: Additional Certification Organisation Identifier\n\n**Identificatie**\n- Attribuutnaam (EN): Additional Certification Organisation Identifier\n- Business naam: nan\n- BMS ID: 668\n\n**Definitie**\nAdditional identification of the organization that issued the certificate number confirming that the Trade Item has gone through certification.\n\n**Invulinstructie**\nIndicate the number of the certifying organisation/notified body, as written in the CE certificate and on the product label. The attribute is mandatory for every CE certificate provided by a notified body.\n\nThe attribute 'Additional Certification Organisation Identifier' is used in combination with the code 'EU_NOTIFIED_BODY_NUMBER' for 'Additional Party Identification Type Code' (BMS ID 669).\n\n**Voorbeeld**\n0123\n\n**ECHO Common Data Set**\nConditionally Optional\n\nBron: GS1 Benelux Healthcare Datamodel (ECHO)\nURL: https://www.gs1belu.org/en/documentation/healthcare-datamodel-3131",
    "source_type": "gs1_nl_datamodel",
    "sector": "Healthcare",
    "attribute_name_en": "Additional Certification Organisation Identifier",
    "business_name": "nan",
    "bms_id": "668",
    "url": "https://www.gs1belu.org/en/documentation/healthcare-datamodel-3131",
    "version": "3.1.31"
  },
  {
    "title": "GS1 Healthcare - Additional Certification Organisation Identifier - Additional Party Identification Type Code",
    "content": "GS1 Benelux Healthcare Datamodel - Attribuut: Additional Certification Organisation Identifier - Additional Party Identification Type Code\n\n**Identificatie**\n- Attribuutnaam (EN): Additional Certification Organisation Identifier - Additional Party Identification Type Code\n- Business naam: nan\n- BMS ID: 669\n\n**Definitie**\nIdentification of a party by use of a code in addition to the Global Location Number.\n\n**Invulinstructie**\nIndicate the code 'EU_NOTIFIED_BODY_NUMBER' from the code list 'AdditionalPartyIdentificationTypeCode'.\n\nThe attribute 'Additional Party Identification Type Code' is used in combination with 'Additional Certification Organisation Identifier' (BMS ID 668).\n\n\n\n**Voorbeeld**\nEU_NOTIFIED_BODY_NUMBER\n\n**ECHO Common Data Set**\nConditionally Mandatory\n\nBron: GS1 Benelux Healthcare Datamodel (ECHO)\nURL: https://www.gs1belu.org/en/documentation/healthcare-datamodel-3131",
    "source_type": "gs1_nl_datamodel",
    "sector": "Healthcare",
    "attribute_name_en": "Additional Certification Organisation Identifier - Additional Party Identification Type Code",
    "business_name": "nan",
    "bms_id": "669",
    "url": "https://www.gs1belu.org/en/documentation/healthcare-datamodel-3131",
    "version": "3.1.31"
  },
  {
    "title": "GS1 Healthcare - Net Content",
    "content": "GS1 Benelux Healthcare Datamodel - Attribuut: Net Content\n\n**Identificatie**\n- Attribuutnaam (EN): Net Content\n- Business naam: Net Content\n- BMS ID: 3733\n\n**Definitie**\nThe amount of the trade item contained by a package, usually as claimed on the label. For example, Water 750ml - net content = \"750 MLT\" ; 20 count pack of diapers, net content = \"20 ea.\". In case of multi-pack, indicates the net content of the total trade item. For fixed value trade items use the value claimed on the package, to avoid variable fill rate issue that arises with some trade item which are sold by volume or weight, and whose actual content may vary slightly from batch to batch. In case of variable quantity trade items, indicates the average quantity.\n\n**Business Definitie**\nThe quantity (or quantities) of the product contained in the package along with its unit of measure typically printed on the label for the country or market where the product is sold.\n\n**Invulinstructie**\nIndicate a numeric value and select a code from the code list 'MeasurementUnitCode_GDSN'.\n\n**Voorbeeld**\n1\n\n**ECHO Common Data Set**\nOptional\n\nBron: GS1 Benelux Healthcare Datamodel (ECHO)\nURL: https://www.gs1belu.org/en/documentation/healthcare-datamodel-3131",
    "source_type": "gs1_nl_datamodel",
    "sector": "Healthcare",
    "attribute_name_en": "Net Content",
    "business_name": "Net Content",
    "bms_id": "3733",
    "url": "https://www.gs1belu.org/en/documentation/healthcare-datamodel-3131",
    "version": "3.1.31"
  },
  {
    "title": "GS1 Healthcare - Packaging Type Code",
    "content": "GS1 Benelux Healthcare Datamodel - Attribuut: Packaging Type Code\n\n**Identificatie**\n- Attribuutnaam (EN): Packaging Type Code\n- Business naam: Packaging Type Code\n- BMS ID: 2186\n\n**Definitie**\nThe dominant means used to transport, store, handle or display the trade item as defined by the data source. This packaging is not used to describe any manufacturing process. Data recipients can use this data for:\n• Space Planning\n• Data Accuracy (Tolerances)\n• Supply Chain processes\n• Recycling process (In combination with packaging materials)\n• Product buying/procurement decisions\n• Tax calculations/fees/duties calculation\n\n**Business Definitie**\nThe code for the type of package or container of the product.\n\n**Invulinstructie**\nIndicate the type of packaging of the product (e.g. packed in a box or bottle etc.) using a code from the code list 'PackageTypeCode'.\n\n**Voorbeeld**\nBX\n\n**ECHO Common Data Set**\nOptional\n\nBron: GS1 Benelux Healthcare Datamodel (ECHO)\nURL: https://www.gs1belu.org/en/documentation/healthcare-datamodel-3131",
    "source_type": "gs1_nl_datamodel",
    "sector": "Healthcare",
    "attribute_name_en": "Packaging Type Code",
    "business_name": "Packaging Type Code",
    "bms_id": "2186",
    "url": "https://www.gs1belu.org/en/documentation/healthcare-datamodel-3131",
    "version": "3.1.31"
  },
  {
    "title": "GS1 Healthcare - Country of Origin Code",
    "content": "GS1 Benelux Healthcare Datamodel - Attribuut: Country of Origin Code\n\n**Identificatie**\n- Attribuutnaam (EN): Country of Origin Code\n- Business naam: Country of Origin Code\n- BMS ID: 2794\n\n**Definitie**\nThe country in which a processing or other activity has been performed for example processing, bottling, manufacturing.\n\n**Business Definitie**\nThe code used to declare where the product is produced for regulatory / custom's requirements. In the case of multiple countries, the country in which the last substantial process or operation, that is economically justified, was performed.\n\n**Invulinstructie**\nIndicate the code of the country, from the code list 'CountryCode', in which the product has been produced or manufactured as it appears on the packaging label. \n\n\n**Voorbeeld**\n756\n\n**ECHO Common Data Set**\nOptional\n\nBron: GS1 Benelux Healthcare Datamodel (ECHO)\nURL: https://www.gs1belu.org/en/documentation/healthcare-datamodel-3131",
    "source_type": "gs1_nl_datamodel",
    "sector": "Healthcare",
    "attribute_name_en": "Country of Origin Code",
    "business_name": "Country of Origin Code",
    "bms_id": "2794",
    "url": "https://www.gs1belu.org/en/documentation/healthcare-datamodel-3131",
    "version": "3.1.31"
  },
  {
    "title": "GS1 Healthcare - Ordering Lead Time",
    "content": "GS1 Benelux Healthcare Datamodel - Attribuut: Ordering Lead Time\n\n**Identificatie**\n- Attribuutnaam (EN): Ordering Lead Time\n- Business naam: nan\n- BMS ID: 1051\n\n**Definitie**\nLead time required for orders expressed in days.\n\n**Invulinstructie**\nFor Switzerland and Germany:\nIndicate the usual lead time for orders in days. Lead time is the time it typically takes from order entry to shipment.\n\n**Voorbeeld**\n14\n\n**ECHO Common Data Set**\nOptional\n\nBron: GS1 Benelux Healthcare Datamodel (ECHO)\nURL: https://www.gs1belu.org/en/documentation/healthcare-datamodel-3131",
    "source_type": "gs1_nl_datamodel",
    "sector": "Healthcare",
    "attribute_name_en": "Ordering Lead Time",
    "business_name": "nan",
    "bms_id": "1051",
    "url": "https://www.gs1belu.org/en/documentation/healthcare-datamodel-3131",
    "version": "3.1.31"
  },
  {
    "title": "GS1 Healthcare - Order Quantity Multiple",
    "content": "GS1 Benelux Healthcare Datamodel - Attribuut: Order Quantity Multiple\n\n**Identificatie**\n- Attribuutnaam (EN): Order Quantity Multiple\n- Business naam: nan\n- BMS ID: 1021\n\n**Definitie**\nThe order quantity multiples in which the trade item may be ordered. If the Order Quantity Minimum is 100, and the Order Quantity Multiple is 20, then the trade item can only be ordered in quantities which are divisible by the Order Quantity Multiple of 20.\n\n**Invulinstructie**\nFor Germany:\nIndicate the quantity in which the product can be ordered.\n\n**Voorbeeld**\n20\n\n**ECHO Common Data Set**\nOptional\n\nBron: GS1 Benelux Healthcare Datamodel (ECHO)\nURL: https://www.gs1belu.org/en/documentation/healthcare-datamodel-3131",
    "source_type": "gs1_nl_datamodel",
    "sector": "Healthcare",
    "attribute_name_en": "Order Quantity Multiple",
    "business_name": "nan",
    "bms_id": "1021",
    "url": "https://www.gs1belu.org/en/documentation/healthcare-datamodel-3131",
    "version": "3.1.31"
  },
  {
    "title": "GS1 Healthcare - Referenced Trade Item Type Code",
    "content": "GS1 Benelux Healthcare Datamodel - Attribuut: Referenced Trade Item Type Code\n\n**Identificatie**\n- Attribuutnaam (EN): Referenced Trade Item Type Code\n- Business naam: Referenced GTIN Type Code\n- BMS ID: 115\n\n**Definitie**\nA code depicting the type of trade item that is referenced for a specific purpose for example substitute, replaced by, equivalent trade items.\n\n**Business Definitie**\nThe code indicating the relationship to the referenced GTIN such as substituted or replaced.\n\n**Invulinstructie**\nIndicate if a product is replaced, substituted by or equivalent to another product.\n- If product 'A' is permanently replaced by product 'B', indicate 'REPLACED' for product 'A' and indicate 'REPLACED_BY' for product 'B'.\n- If product 'A' is temporarily replaced by product 'B', indicate 'SUBSTITUTED_BY' for product 'B'.\n- If product 'A' is equivalent to product 'B', indicate 'EQUIVALENT' for both product 'A' and 'B'.\n\nThe attribute 'Referenced Trade Item Type Code' is used in combination with 'Referenced Trade Item / gtin' (BMS ID 116).\n\n\n**Voorbeeld**\nREPLACED_BY\n\n**ECHO Common Data Set**\nConditionally Mandatory\n\nBron: GS1 Benelux Healthcare Datamodel (ECHO)\nURL: https://www.gs1belu.org/en/documentation/healthcare-datamodel-3131",
    "source_type": "gs1_nl_datamodel",
    "sector": "Healthcare",
    "attribute_name_en": "Referenced Trade Item Type Code",
    "business_name": "Referenced GTIN Type Code",
    "bms_id": "115",
    "url": "https://www.gs1belu.org/en/documentation/healthcare-datamodel-3131",
    "version": "3.1.31"
  },
  {
    "title": "GS1 Healthcare - Referenced Trade Item / gtin",
    "content": "GS1 Benelux Healthcare Datamodel - Attribuut: Referenced Trade Item / gtin\n\n**Identificatie**\n- Attribuutnaam (EN): Referenced Trade Item / gtin\n- Business naam: Referenced GTIN\n- BMS ID: 116\n\n**Definitie**\nA particular Global trade item Number, a numerical value used to uniquely identify a trade item. A trade item is any trade item (trade item or service) upon which there is a need to retrieve pre-defined information and that may be planned, priced, ordered, delivered and or invoiced at any point in any supply chain.\n\n**Business Definitie**\nThe GTIN of a product where a permanent or temporary change to the product needs to be referenced.\n\n**Invulinstructie**\nIndicate the GTIN relevant to the code indicated in 'Referenced Trade Item Type Code' (BMS ID 115).\n\n\n**Voorbeeld**\n09054321003111\n\n**ECHO Common Data Set**\nOptional\n\nBron: GS1 Benelux Healthcare Datamodel (ECHO)\nURL: https://www.gs1belu.org/en/documentation/healthcare-datamodel-3131",
    "source_type": "gs1_nl_datamodel",
    "sector": "Healthcare",
    "attribute_name_en": "Referenced Trade Item / gtin",
    "business_name": "Referenced GTIN",
    "bms_id": "116",
    "url": "https://www.gs1belu.org/en/documentation/healthcare-datamodel-3131",
    "version": "3.1.31"
  },
  {
    "title": "GS1 Healthcare - Duty Fee Tax Type Code",
    "content": "GS1 Benelux Healthcare Datamodel - Attribuut: Duty Fee Tax Type Code\n\n**Identificatie**\n- Attribuutnaam (EN): Duty Fee Tax Type Code\n- Business naam: Tax Type Code\n- BMS ID: 1152\n\n**Definitie**\nIdentification of the type of duty or tax or fee applicable to the trade item. This will vary by target market.\n\n\n**Business Definitie**\nThe code identifying a specific type of tax, levy, duty or fee associated with the type of product or service.\n\n**Invulinstructie**\nIndicate the code 'VAT' for value added tax. The information must be indicated when 'Duty Fee Tax Category Code' (BMS ID 1175) is indicated.\n\n**Voorbeeld**\nVAT\n\n**ECHO Common Data Set**\nConditionally Mandatory\n\nBron: GS1 Benelux Healthcare Datamodel (ECHO)\nURL: https://www.gs1belu.org/en/documentation/healthcare-datamodel-3131",
    "source_type": "gs1_nl_datamodel",
    "sector": "Healthcare",
    "attribute_name_en": "Duty Fee Tax Type Code",
    "business_name": "Tax Type Code",
    "bms_id": "1152",
    "url": "https://www.gs1belu.org/en/documentation/healthcare-datamodel-3131",
    "version": "3.1.31"
  },
  {
    "title": "GS1 Healthcare - Duty Fee Tax Category Code",
    "content": "GS1 Benelux Healthcare Datamodel - Attribuut: Duty Fee Tax Category Code\n\n**Identificatie**\n- Attribuutnaam (EN): Duty Fee Tax Category Code\n- Business naam: Tax Category Code\n- BMS ID: 1175\n\n**Definitie**\nDepicts the applicability of the tax rate or amount for a trade item for example zero, low or exempt.\n\n\n**Business Definitie**\nThe code representing the level of tax rate applied by a government to the product.\n\n**Invulinstructie**\nIndicate the country-specific legally binding VAT category for the product, by using one of the accepted codes for the specific country from the code list 'TaxCategoryCode'. \n\n**Voorbeeld**\nSTANDARD\n\n**ECHO Common Data Set**\nOptional\n\nBron: GS1 Benelux Healthcare Datamodel (ECHO)\nURL: https://www.gs1belu.org/en/documentation/healthcare-datamodel-3131",
    "source_type": "gs1_nl_datamodel",
    "sector": "Healthcare",
    "attribute_name_en": "Duty Fee Tax Category Code",
    "business_name": "Tax Category Code",
    "bms_id": "1175",
    "url": "https://www.gs1belu.org/en/documentation/healthcare-datamodel-3131",
    "version": "3.1.31"
  },
  {
    "title": "GS1 Healthcare - Duty Fee Tax Agency Code",
    "content": "GS1 Benelux Healthcare Datamodel - Attribuut: Duty Fee Tax Agency Code\n\n**Identificatie**\n- Attribuutnaam (EN): Duty Fee Tax Agency Code\n- Business naam: nan\n- BMS ID: 1146\n\n**Definitie**\nIdentifies the agency responsible for the tax code list.\n\n\n**Invulinstructie**\nIndicate the agency responsible for the tax code list, by using a code from the code list 'ResponsibleAgencyCode'. The information must be indicated when 'Duty Fee Tax Category Code' (BMS ID 1175) is indicated.\n\n**Voorbeeld**\n294 (Austria); 281 (Belgium), 245 (Denmark); 316 (Finland); 246 (Germany); 200 (Netherlands); 298 (Spain); 9SE (Sweden); 104 (Switzerland)\n\n**ECHO Common Data Set**\nConditionally Mandatory\n\nBron: GS1 Benelux Healthcare Datamodel (ECHO)\nURL: https://www.gs1belu.org/en/documentation/healthcare-datamodel-3131",
    "source_type": "gs1_nl_datamodel",
    "sector": "Healthcare",
    "attribute_name_en": "Duty Fee Tax Agency Code",
    "business_name": "nan",
    "bms_id": "1146",
    "url": "https://www.gs1belu.org/en/documentation/healthcare-datamodel-3131",
    "version": "3.1.31"
  },
  {
    "title": "GS1 Healthcare - Does Trade Item Contain Latex",
    "content": "GS1 Benelux Healthcare Datamodel - Attribuut: Does Trade Item Contain Latex\n\n**Identificatie**\n- Attribuutnaam (EN): Does Trade Item Contain Latex\n- Business naam: nan\n- BMS ID: 1434\n\n**Definitie**\nAn indication that the trade item has a positive natural rubber latex reference on the trade item’s labelling.\n\n**Invulinstructie**\nIndicate if the product does contain latex by selecting 'TRUE' or 'FALSE'.\n\n**Voorbeeld**\nTRUE\n\n**ECHO Common Data Set**\nOptional\n\nBron: GS1 Benelux Healthcare Datamodel (ECHO)\nURL: https://www.gs1belu.org/en/documentation/healthcare-datamodel-3131",
    "source_type": "gs1_nl_datamodel",
    "sector": "Healthcare",
    "attribute_name_en": "Does Trade Item Contain Latex",
    "business_name": "nan",
    "bms_id": "1434",
    "url": "https://www.gs1belu.org/en/documentation/healthcare-datamodel-3131",
    "version": "3.1.31"
  },
  {
    "title": "GS1 Healthcare - MRI Compatibility Code",
    "content": "GS1 Benelux Healthcare Datamodel - Attribuut: MRI Compatibility Code\n\n**Identificatie**\n- Attribuutnaam (EN): MRI Compatibility Code\n- Business naam: nan\n- BMS ID: 1581\n\n**Definitie**\nIndicates that the healthcare trade item is safe to\nuse within a Magnetic Resonance Imaging (MRI)\nsystem.\n\n**Invulinstructie**\nIndicate for implants, i.e. when isTradeItemImplantable (BMS 1580) = 'TRUE' and other devices for which MRI compatibility is relevant (e.g. infusion needles, twister), whether the medical device is safe for use in the presence of Magnetic Resonance Imaging (MRI) system.\n\nIf no mark is present on the label choose (UNSPECIFIED) - Unspecified\n\nDisclaimer: the label, the IFU and the instructions for cleaning, disinfection and sterilisation are leading. Consult these.\n\n\n\n**Voorbeeld**\nMRI_COMPATIBLE\n\n**ECHO Common Data Set**\nOptional\n\nBron: GS1 Benelux Healthcare Datamodel (ECHO)\nURL: https://www.gs1belu.org/en/documentation/healthcare-datamodel-3131",
    "source_type": "gs1_nl_datamodel",
    "sector": "Healthcare",
    "attribute_name_en": "MRI Compatibility Code",
    "business_name": "nan",
    "bms_id": "1581",
    "url": "https://www.gs1belu.org/en/documentation/healthcare-datamodel-3131",
    "version": "3.1.31"
  },
  {
    "title": "GS1 Healthcare - Initial Manufacturer Sterilisation Code",
    "content": "GS1 Benelux Healthcare Datamodel - Attribuut: Initial Manufacturer Sterilisation Code\n\n**Identificatie**\n- Attribuutnaam (EN): Initial Manufacturer Sterilisation Code\n- Business naam: nan\n- BMS ID: 1593\n\n**Definitie**\nDeclaration of sterilisation, including not sterilised, which may have been performed by the manufacturer. Sterilisation refers to any process that effectively kills or eliminates transmissible agents (such as fungi, bacteria, viruses, prions and spore forms etc.) from a surface, equipment, foods, medications, or biological culture medium. Some methods of sterilization are through the application of heat, radiation, and ethylene.\n\n**Invulinstructie**\nIndicate the type(s) of sterilisation, including not sterilised, which may have been performed by the manufacturer, by using one of the following codes from the code list 'SterilisationTypeCode': 'AUTOCLAVE', 'BETA_RADIATION', 'ETO_ETHYLENE_OXIDE', 'FORMALDEHYDE', 'GAMMA_RADIATION', 'HYDROGEN_PEROXIDE', 'OZONE', 'PLASMA', 'DRY_HEAT', 'MICROWAVE_RADIATION', 'ELECTRON_BEAM_IRRADIATION', 'UNSPECIFIED' or 'NOT_STERILISED'. If product is not sterilised, select the value 'NOT_STERILISED' from the code list.\n\nThe information is to indicate whether the product is classified as risk class 1s (sterilised). For all codes except NOT_STERILISED.\n\n**Voorbeeld**\nNOT_STERILISED\n\n**ECHO Common Data Set**\nOptional\n\nBron: GS1 Benelux Healthcare Datamodel (ECHO)\nURL: https://www.gs1belu.org/en/documentation/healthcare-datamodel-3131",
    "source_type": "gs1_nl_datamodel",
    "sector": "Healthcare",
    "attribute_name_en": "Initial Manufacturer Sterilisation Code",
    "business_name": "nan",
    "bms_id": "1593",
    "url": "https://www.gs1belu.org/en/documentation/healthcare-datamodel-3131",
    "version": "3.1.31"
  },
  {
    "title": "GS1 Healthcare - Initial Sterilisation Prior to Use Code",
    "content": "GS1 Benelux Healthcare Datamodel - Attribuut: Initial Sterilisation Prior to Use Code\n\n**Identificatie**\n- Attribuutnaam (EN): Initial Sterilisation Prior to Use Code\n- Business naam: nan\n- BMS ID: 1594\n\n**Definitie**\nThis is an indication of the type(s) of sterilisation that is required to be completed by a healthcare provider prior to initial use of the healthcare trade item. Sterilisation refers to any process that effectively kills or eliminates transmissible agents (such as fungi, bacteria, viruses, prions and spore forms etc.) from a surface, equipment, foods, medications, or biological culture medium. Some methods of sterilisation are through the application of heat, radiation, and ethylene.\n\n**Invulinstructie**\nIndicate the type(s) of sterilisation required to be completed prior to use, using a code from the code list 'SterilisationTypeCode'. If the type of sterilisation is unknown, choose Unspecified (UNSPECIFIED). If product is not to be sterilised before use, this attribute should be left empty. Code '(NOT_STERILISED) - Not sterilised' can not be used for this attribute.\n\nDisclaimer: the label, the IFU and the instructions for cleaning, disinfection and sterilisation are leading. Consult these.\n\n**Voorbeeld**\nETHANOL\n\n**ECHO Common Data Set**\nOptional\n\nBron: GS1 Benelux Healthcare Datamodel (ECHO)\nURL: https://www.gs1belu.org/en/documentation/healthcare-datamodel-3131",
    "source_type": "gs1_nl_datamodel",
    "sector": "Healthcare",
    "attribute_name_en": "Initial Sterilisation Prior to Use Code",
    "business_name": "nan",
    "bms_id": "1594",
    "url": "https://www.gs1belu.org/en/documentation/healthcare-datamodel-3131",
    "version": "3.1.31"
  },
  {
    "title": "GS1 Healthcare - Manufacturer Declared Reusability Type Code",
    "content": "GS1 Benelux Healthcare Datamodel - Attribuut: Manufacturer Declared Reusability Type Code\n\n**Identificatie**\n- Attribuutnaam (EN): Manufacturer Declared Reusability Type Code\n- Business naam: nan\n- BMS ID: 1598\n\n**Definitie**\nDetermines if the product is intended for single or multiple uses, including the number of validated cycles and the number of times a product can be used according to the manufacturer specifications. It is suggested that medical providers consult the device manufacturer’s Instruction For Use (IFU) for full reusability instructions.\n\n**Invulinstructie**\nIndicate a code from the code list 'HealthcareTradeItemReusabilityTypeCode' to determine if the product is intended for single or multiple uses.\n\n**Voorbeeld**\nSINGLE_USE\n\n**ECHO Common Data Set**\nOptional\n\nBron: GS1 Benelux Healthcare Datamodel (ECHO)\nURL: https://www.gs1belu.org/en/documentation/healthcare-datamodel-3131",
    "source_type": "gs1_nl_datamodel",
    "sector": "Healthcare",
    "attribute_name_en": "Manufacturer Declared Reusability Type Code",
    "business_name": "nan",
    "bms_id": "1598",
    "url": "https://www.gs1belu.org/en/documentation/healthcare-datamodel-3131",
    "version": "3.1.31"
  },
  {
    "title": "GS1 Healthcare - Does Trade Item Contain Human Tissue",
    "content": "GS1 Benelux Healthcare Datamodel - Attribuut: Does Trade Item Contain Human Tissue\n\n**Identificatie**\n- Attribuutnaam (EN): Does Trade Item Contain Human Tissue\n- Business naam: nan\n- BMS ID: 6089\n\n**Definitie**\nDetermines whether the trade item has, as a component or ingredient, human tissue.  The amount of tissue is not limited to a certain amount, any amount will cause a flag of TRUE. \n\n**Invulinstructie**\nIndicate whether the product contains human tissue by selecting 'TRUE' or 'FALSE'. The information must be indicated when 'Is Trade Item Implantable' (BMS ID 1580) = 'TRUE'.\n\n**Voorbeeld**\nFALSE\n\n**ECHO Common Data Set**\nOptional\n\nBron: GS1 Benelux Healthcare Datamodel (ECHO)\nURL: https://www.gs1belu.org/en/documentation/healthcare-datamodel-3131",
    "source_type": "gs1_nl_datamodel",
    "sector": "Healthcare",
    "attribute_name_en": "Does Trade Item Contain Human Tissue",
    "business_name": "nan",
    "bms_id": "6089",
    "url": "https://www.gs1belu.org/en/documentation/healthcare-datamodel-3131",
    "version": "3.1.31"
  },
  {
    "title": "GS1 Healthcare - Clinical Size Type Code",
    "content": "GS1 Benelux Healthcare Datamodel - Attribuut: Clinical Size Type Code\n\n**Identificatie**\n- Attribuutnaam (EN): Clinical Size Type Code\n- Business naam: nan\n- BMS ID: 6077\n\n**Definitie**\nThe qualifier to denote the dimensional size which is clinically relevant for the use of the trade item by the clinical user. For example \"NEEDLE_GAUGE\" for a 16 gauge needle, or \"VOLUME\" for a 200 cc syringe.\n\n**Invulinstructie**\nIndicate the clinical size type code using 'DEVICE_SIZE_TEXT_SPECIFY'.\nThe information must be indicated when 'Clinical Size Value Maximum' (BMS ID 6379) is indicated.\n\nThe attribute 'Clinical Size Type Code' is used in combination with 'Clinical Size Value Maximum' (BMS ID 6379) and 'Clinical Size Description' (BMS ID 6075).\n\n**Voorbeeld**\nDEVICE_SIZE_TEXT_SPECIFY\n\n**ECHO Common Data Set**\nConditionally Mandatory\n\nBron: GS1 Benelux Healthcare Datamodel (ECHO)\nURL: https://www.gs1belu.org/en/documentation/healthcare-datamodel-3131",
    "source_type": "gs1_nl_datamodel",
    "sector": "Healthcare",
    "attribute_name_en": "Clinical Size Type Code",
    "business_name": "nan",
    "bms_id": "6077",
    "url": "https://www.gs1belu.org/en/documentation/healthcare-datamodel-3131",
    "version": "3.1.31"
  },
  {
    "title": "GS1 Healthcare - Clinical Size Value Maximum",
    "content": "GS1 Benelux Healthcare Datamodel - Attribuut: Clinical Size Value Maximum\n\n**Identificatie**\n- Attribuutnaam (EN): Clinical Size Value Maximum\n- Business naam: nan\n- BMS ID: 6379\n\n**Definitie**\nThe maximum dimensional size which is clinically relevant for the use of the trade item by the clinical user. For example 16 gauge for a needle, or 200 cc for a syringe.\n\n**Invulinstructie**\nIndicate the magnetic field strength up to which a medical product MRI is safe, e.g. 1.5, 3.0 or 7.0 Tesla (T).\n\nThe information must be indicated when 'MRI Compatibility Code' (BMS 1581) = 'MRI_COMPATIBLE'.\n\nThe attribute 'Clinical Size Value Maximum' is used in combination with 'Clinical Size Type Code' (BMS ID 6077) and 'Clinical Size Description' (BMS ID 6075).\n\n**Voorbeeld**\n1.5 T\n\n**ECHO Common Data Set**\nOptional\n\nBron: GS1 Benelux Healthcare Datamodel (ECHO)\nURL: https://www.gs1belu.org/en/documentation/healthcare-datamodel-3131",
    "source_type": "gs1_nl_datamodel",
    "sector": "Healthcare",
    "attribute_name_en": "Clinical Size Value Maximum",
    "business_name": "nan",
    "bms_id": "6379",
    "url": "https://www.gs1belu.org/en/documentation/healthcare-datamodel-3131",
    "version": "3.1.31"
  },
  {
    "title": "GS1 Healthcare - Clinical Size Description",
    "content": "GS1 Benelux Healthcare Datamodel - Attribuut: Clinical Size Description\n\n**Identificatie**\n- Attribuutnaam (EN): Clinical Size Description\n- Business naam: nan\n- BMS ID: 6075\n\n**Definitie**\nThis is the text used to to denote the dimensional size which is clinically relevant for the use of the trade item by the clinical user.  \n\n**Invulinstructie**\nIndicate the text 'MRI_TESLA_MAXIMUM' using language code 'en' (English). The information must be indicated when 'Clinical Size Value Maximum' (BMS ID 6379) is indicated.\n\nThe attribute 'Clinical Size Description' is used in combination with 'Clinical Size Type Code' (BMS ID 6077) and 'Clinical Size Value Maximum' (BMS ID 6379).\n\n**Voorbeeld**\nMRI_TESLA_MAXIMUM\n\n**ECHO Common Data Set**\nConditionally Mandatory\n\nBron: GS1 Benelux Healthcare Datamodel (ECHO)\nURL: https://www.gs1belu.org/en/documentation/healthcare-datamodel-3131",
    "source_type": "gs1_nl_datamodel",
    "sector": "Healthcare",
    "attribute_name_en": "Clinical Size Description",
    "business_name": "nan",
    "bms_id": "6075",
    "url": "https://www.gs1belu.org/en/documentation/healthcare-datamodel-3131",
    "version": "3.1.31"
  },
  {
    "title": "GS1 Healthcare - Is Trade Item Implantable",
    "content": "GS1 Benelux Healthcare Datamodel - Attribuut: Is Trade Item Implantable\n\n**Identificatie**\n- Attribuutnaam (EN): Is Trade Item Implantable\n- Business naam: nan\n- BMS ID: 1580\n\n**Definitie**\nImplantable devices are defined as devices that are partly or totally inserted into the human body, as determined by local regulations.\n\n**Invulinstructie**\nIndicate whether the product is implantable by selecting 'TRUE' or 'FALSE'.\n\n**Voorbeeld**\nTRUE\n\n**ECHO Common Data Set**\nOptional\n\nBron: GS1 Benelux Healthcare Datamodel (ECHO)\nURL: https://www.gs1belu.org/en/documentation/healthcare-datamodel-3131",
    "source_type": "gs1_nl_datamodel",
    "sector": "Healthcare",
    "attribute_name_en": "Is Trade Item Implantable",
    "business_name": "nan",
    "bms_id": "1580",
    "url": "https://www.gs1belu.org/en/documentation/healthcare-datamodel-3131",
    "version": "3.1.31"
  },
  {
    "title": "GS1 Healthcare - Element Claim Code",
    "content": "GS1 Benelux Healthcare Datamodel - Attribuut: Element Claim Code\n\n**Identificatie**\n- Attribuutnaam (EN): Element Claim Code\n- Business naam: Element Claim Code\n- BMS ID: 7233\n\n**Definitie**\nThe type of nutrient, ingredient, vitamins and minerals that the health claim is in reference to for example fat, copper, milk, paraben, BHA.\n\n**Business Definitie**\nThe code used to reference a specific element claim about the product.\n\n**Invulinstructie**\nIndicate a code from the code list 'ClaimElementCode'. It is mandatory to state if the product contains 'PHTHALATE' or not.\n\nThe attribute 'Element Claim Code' is used in combination with 'Claim Type Code' (BMS ID 7237).\n\n**Voorbeeld**\nPHTHALATE\n\n**ECHO Common Data Set**\nConditionally Mandatory\n\nBron: GS1 Benelux Healthcare Datamodel (ECHO)\nURL: https://www.gs1belu.org/en/documentation/healthcare-datamodel-3131",
    "source_type": "gs1_nl_datamodel",
    "sector": "Healthcare",
    "attribute_name_en": "Element Claim Code",
    "business_name": "Element Claim Code",
    "bms_id": "7233",
    "url": "https://www.gs1belu.org/en/documentation/healthcare-datamodel-3131",
    "version": "3.1.31"
  },
  {
    "title": "GS1 Healthcare - Claim Type Code",
    "content": "GS1 Benelux Healthcare Datamodel - Attribuut: Claim Type Code\n\n**Identificatie**\n- Attribuutnaam (EN): Claim Type Code\n- Business naam: Claim Type Code\n- BMS ID: 7237\n\n**Definitie**\nA code depicting the degree to which a trade item contains a specific nutrient or ingredient in relation to a health claim for example FREE_FROM.\n\n\n**Business Definitie**\nThe code that states the type of claim relevant to the Element Claim Code.\n\n**Invulinstructie**\nIndicate a code from the code list 'ClaimTypeCode'. If the product contains phthalates, indicate 'CONTAINS' for the 'Claim Type Code'. If the product does not contain phthalates, indicate 'FREE_FROM'. If in doubt, indicate 'CONTAINS'.\n\nThe attribute 'Claim Type Code' is used in combination with 'Element Claim Code' (BMS ID 7233).\n\n**Voorbeeld**\nCONTAINS\n\n**ECHO Common Data Set**\nConditionally Mandatory\n\nBron: GS1 Benelux Healthcare Datamodel (ECHO)\nURL: https://www.gs1belu.org/en/documentation/healthcare-datamodel-3131",
    "source_type": "gs1_nl_datamodel",
    "sector": "Healthcare",
    "attribute_name_en": "Claim Type Code",
    "business_name": "Claim Type Code",
    "bms_id": "7237",
    "url": "https://www.gs1belu.org/en/documentation/healthcare-datamodel-3131",
    "version": "3.1.31"
  },
  {
    "title": "GS1 Healthcare - Claim Marked on Package",
    "content": "GS1 Benelux Healthcare Datamodel - Attribuut: Claim Marked on Package\n\n**Identificatie**\n- Attribuutnaam (EN): Claim Marked on Package\n- Business naam: nan\n- BMS ID: 7235\n\n**Definitie**\nIs the claim specified by Nutritional Claim Type Code in combination with Nutritional Claim Nutrient Element Code labelled on the product package. \n\n**Invulinstructie**\nIndicate whether the claim is specified/marked on the product package or not by indicating 'TRUE' or 'FALSE'.\n\nThe attribute is used in combination with 'Claim Type Code' (BMS ID 7237) to identify the type of claim applicable to the product and 'Element Claim Code' (BMS ID 7233) to identify a specific element (such as a substance/ingredient or chemical compound) to which the claim type applies.\n\n**Voorbeeld**\nFALSE\n\n**ECHO Common Data Set**\nOptional\n\nBron: GS1 Benelux Healthcare Datamodel (ECHO)\nURL: https://www.gs1belu.org/en/documentation/healthcare-datamodel-3131",
    "source_type": "gs1_nl_datamodel",
    "sector": "Healthcare",
    "attribute_name_en": "Claim Marked on Package",
    "business_name": "nan",
    "bms_id": "7235",
    "url": "https://www.gs1belu.org/en/documentation/healthcare-datamodel-3131",
    "version": "3.1.31"
  },
  {
    "title": "GS1 Healthcare - Maximum Cycles Reusable",
    "content": "GS1 Benelux Healthcare Datamodel - Attribuut: Maximum Cycles Reusable\n\n**Identificatie**\n- Attribuutnaam (EN): Maximum Cycles Reusable\n- Business naam: nan\n- BMS ID: 1599\n\n**Definitie**\nMaximum number of times this Trade Item can be reused.\n\n**Invulinstructie**\nIndicate the maximum number of times the product can be reused. The information must be indicated when 'Manufacturer Declared Reusability Type Code' (BMS ID 1598) = 'REUSABLE', 'LIMITED_REUSABLE' or 'REUSABLE_SAME_PATIENT'.\n\n**Voorbeeld**\n1\n\n**ECHO Common Data Set**\nOptional\n\nBron: GS1 Benelux Healthcare Datamodel (ECHO)\nURL: https://www.gs1belu.org/en/documentation/healthcare-datamodel-3131",
    "source_type": "gs1_nl_datamodel",
    "sector": "Healthcare",
    "attribute_name_en": "Maximum Cycles Reusable",
    "business_name": "nan",
    "bms_id": "1599",
    "url": "https://www.gs1belu.org/en/documentation/healthcare-datamodel-3131",
    "version": "3.1.31"
  },
  {
    "title": "GS1 Healthcare - Has Device Measuring Function\n",
    "content": "GS1 Benelux Healthcare Datamodel - Attribuut: Has Device Measuring Function\n\n\n**Identificatie**\n- Attribuutnaam (EN): Has Device Measuring Function\n\n- Business naam: nan\n- BMS ID: 6346\n\n**Definitie**\nIndication if the device has a function which measures any type of patient metrics.\n\n**Invulinstructie**\nIndicate whether the product has a measuring function by selecting 'true' or 'false'. The information must at least be indicated when 'Additional Trade Item Classification System Code' (BMS ID 171) = '76 (EU MDR/IVDR Risk class)' and 'Additional Trade Item Classification Code Value' (BMS ID 173) = 'EU_CLASS_I'. The information is to indicate whether the product is classified as risk class 1m (measuring function).\n\n\n\n**Voorbeeld**\ntrue\n\n**ECHO Common Data Set**\nOptional\n\nBron: GS1 Benelux Healthcare Datamodel (ECHO)\nURL: https://www.gs1belu.org/en/documentation/healthcare-datamodel-3131",
    "source_type": "gs1_nl_datamodel",
    "sector": "Healthcare",
    "attribute_name_en": "Has Device Measuring Function\n",
    "business_name": "nan",
    "bms_id": "6346",
    "url": "https://www.gs1belu.org/en/documentation/healthcare-datamodel-3131",
    "version": "3.1.31"
  },
  {
    "title": "GS1 Healthcare - Is Reusable Surgical Instrument",
    "content": "GS1 Benelux Healthcare Datamodel - Attribuut: Is Reusable Surgical Instrument\n\n**Identificatie**\n- Attribuutnaam (EN): Is Reusable Surgical Instrument\n- Business naam: nan\n- BMS ID: 6359\n\n**Definitie**\nIndication the device is a Reusable Surgical Instrument. 'Reusable surgical instrument' means an instrument intended for surgical use in cutting, drilling, sawing, scratching, scraping, clamping, retracting, clipping or similar procedures, without a connection to an active device and which is intended by the Manufacturer to be reused after appropriate procedures such as cleaning, disinfection and sterilisation have been carried out. \n\n**Invulinstructie**\nIndicate whether the surgical instrument is reusable by selecting 'true' or 'false'. The information must at least be indicated when 'Additional Trade Item Classification System Code' (BMS ID 171) = '76 (EU MDR/IVDR Risk class)' and 'Additional Trade Item Classification Code Value' (BMS ID 173) = 'EU_CLASS_I'. The information is to indicate whether the product is classified as risk class 1r (reusable instrument).\n\n\n**Voorbeeld**\nfalse\n\n**ECHO Common Data Set**\nOptional\n\nBron: GS1 Benelux Healthcare Datamodel (ECHO)\nURL: https://www.gs1belu.org/en/documentation/healthcare-datamodel-3131",
    "source_type": "gs1_nl_datamodel",
    "sector": "Healthcare",
    "attribute_name_en": "Is Reusable Surgical Instrument",
    "business_name": "nan",
    "bms_id": "6359",
    "url": "https://www.gs1belu.org/en/documentation/healthcare-datamodel-3131",
    "version": "3.1.31"
  },
  {
    "title": "GS1 Healthcare - Is Device Exempt From Implant Obligations",
    "content": "GS1 Benelux Healthcare Datamodel - Attribuut: Is Device Exempt From Implant Obligations\n\n**Identificatie**\n- Attribuutnaam (EN): Is Device Exempt From Implant Obligations\n- Business naam: nan\n- BMS ID: 6356\n\n**Definitie**\nIndication the medical device is exempted from specific obligations imposed on implantable devices by the regulation. Refer to EU MDR Article 18/3 Implant Card and Information to be supplied to the patient with an implanted device.\n\n**Invulinstructie**\nIndicate whether the device is exempted from implant obligations by selecting 'true' or 'false'. The information must be indicated when 'Is trade item implantable' (BMS ID 1580) = 'TRUE'.\n\nIf the GTIN is not an implant, this attribute shall be left empty. Please refer to the local regulation on which implants are exempted.\n\n\n\n**Voorbeeld**\ntrue\n\n**ECHO Common Data Set**\nOptional\n\nBron: GS1 Benelux Healthcare Datamodel (ECHO)\nURL: https://www.gs1belu.org/en/documentation/healthcare-datamodel-3131",
    "source_type": "gs1_nl_datamodel",
    "sector": "Healthcare",
    "attribute_name_en": "Is Device Exempt From Implant Obligations",
    "business_name": "nan",
    "bms_id": "6356",
    "url": "https://www.gs1belu.org/en/documentation/healthcare-datamodel-3131",
    "version": "3.1.31"
  },
  {
    "title": "GS1 Healthcare - Volatile Organic Compound",
    "content": "GS1 Benelux Healthcare Datamodel - Attribuut: Volatile Organic Compound\n\n**Identificatie**\n- Attribuutnaam (EN): Volatile Organic Compound\n- Business naam: nan\n- BMS ID: 3120\n\n**Definitie**\nVolatile Organic Compound is the amount of an item that is a volatile organic compound expressed as a measurement. Volatile is where the compound can evaporate or vaporize into the atmosphere.\n\n**Invulinstructie**\nFor Switzerland: \nIndicate Volatile Organic Compound in kilograms if applicable/relevant for the product.\n\n**Voorbeeld**\n20\n\n**ECHO Common Data Set**\nOptional\n\nBron: GS1 Benelux Healthcare Datamodel (ECHO)\nURL: https://www.gs1belu.org/en/documentation/healthcare-datamodel-3131",
    "source_type": "gs1_nl_datamodel",
    "sector": "Healthcare",
    "attribute_name_en": "Volatile Organic Compound",
    "business_name": "nan",
    "bms_id": "3120",
    "url": "https://www.gs1belu.org/en/documentation/healthcare-datamodel-3131",
    "version": "3.1.31"
  },
  {
    "title": "GS1 Healthcare - Cumulative Temperature Interruption Acceptable Time Span Instructions",
    "content": "GS1 Benelux Healthcare Datamodel - Attribuut: Cumulative Temperature Interruption Acceptable Time Span Instructions\n\n**Identificatie**\n- Attribuutnaam (EN): Cumulative Temperature Interruption Acceptable Time Span Instructions\n- Business naam: nan\n- BMS ID: 3816\n\n**Definitie**\nInstructions provided by the product manufacturer regarding the process, procedures, or handling instructions for trade items that has exceeded the cumulative time span of temperature interruptions.\n\n**Invulinstructie**\nIndicate the instructions regarding the process, procedures, or handling instructions for products that have exceeded the cumulative time span of temperature interruptions. \n\nThis information can only be indicated in addition to the temperature information, i.e. where the 'Temperature Qualifier Code' (BMS 3830) with the code 'STORAGE_HANDLING' and associated 'Minimum Temperature' (BMS ID 3826) and/or 'Maximum Temperature' (BMS ID 3820) have been indicated, and provides advice on how to handle a product if these temperature specifications could not be met for the product.\n\n**Voorbeeld**\nPermissible temperature deviation: ±2°C for up to 12 hours. Exceeding this limit requires quarantine and evaluation before use.\n\n**ECHO Common Data Set**\nOptional\n\nBron: GS1 Benelux Healthcare Datamodel (ECHO)\nURL: https://www.gs1belu.org/en/documentation/healthcare-datamodel-3131",
    "source_type": "gs1_nl_datamodel",
    "sector": "Healthcare",
    "attribute_name_en": "Cumulative Temperature Interruption Acceptable Time Span Instructions",
    "business_name": "nan",
    "bms_id": "3816",
    "url": "https://www.gs1belu.org/en/documentation/healthcare-datamodel-3131",
    "version": "3.1.31"
  },
  {
    "title": "GS1 Healthcare - Waste Code",
    "content": "GS1 Benelux Healthcare Datamodel - Attribuut: Waste Code\n\n**Identificatie**\n- Attribuutnaam (EN): Waste Code\n- Business naam: nan\n- BMS ID: 7176\n\n**Definitie**\nThe code that describes the type of waste created from the product. Please refer to any local regulation requirements for disposal/recyclable waste.\n\n**Invulinstructie**\nIndicate the type of waste that is created from the product as written in the Instructions For Use (IFU), by using a code from the code list 'TypeOfWasteCode'.\n\n**Voorbeeld**\nSHARP_MEDICAL_OBJECTS\n\n**ECHO Common Data Set**\nOptional\n\nBron: GS1 Benelux Healthcare Datamodel (ECHO)\nURL: https://www.gs1belu.org/en/documentation/healthcare-datamodel-3131",
    "source_type": "gs1_nl_datamodel",
    "sector": "Healthcare",
    "attribute_name_en": "Waste Code",
    "business_name": "nan",
    "bms_id": "7176",
    "url": "https://www.gs1belu.org/en/documentation/healthcare-datamodel-3131",
    "version": "3.1.31"
  },
  {
    "title": "GS1 Healthcare - Required Education or Training Type Code",
    "content": "GS1 Benelux Healthcare Datamodel - Attribuut: Required Education or Training Type Code\n\n**Identificatie**\n- Attribuutnaam (EN): Required Education or Training Type Code\n- Business naam: nan\n- BMS ID: 7110\n\n**Definitie**\nThe code that describes the appropriate type of education or training required to use/handle/operate the product.\n\n**Invulinstructie**\nIndicate a code from the code list 'RequiredEducationTrainingTypeCode'. The information must be indicated when the Instructions For Use (IFU) states that education or training by the user is required to use/handle/operate the product. \n\n\n**Voorbeeld**\nSAFE_USE\n\n**ECHO Common Data Set**\nOptional\n\nBron: GS1 Benelux Healthcare Datamodel (ECHO)\nURL: https://www.gs1belu.org/en/documentation/healthcare-datamodel-3131",
    "source_type": "gs1_nl_datamodel",
    "sector": "Healthcare",
    "attribute_name_en": "Required Education or Training Type Code",
    "business_name": "nan",
    "bms_id": "7110",
    "url": "https://www.gs1belu.org/en/documentation/healthcare-datamodel-3131",
    "version": "3.1.31"
  },
  {
    "title": "GS1 Healthcare - Pre-cleaning Indicator",
    "content": "GS1 Benelux Healthcare Datamodel - Attribuut: Pre-cleaning Indicator\n\n**Identificatie**\n- Attribuutnaam (EN): Pre-cleaning Indicator\n- Business naam: nan\n- BMS ID: 7103\n\n**Definitie**\nThe indicator that specifies whether pre-cleaning of the product is required before cleaning and disinfection.\n\n**Invulinstructie**\nIndicate whether the product requires additional pre-cleaning (for example, immediately after use or as manual pre-cleaning at the Central Sterilisation Services Department) by selecting 'true' or 'false'. The information must be indicated when 'Manufacturer Declared Reusability Type Code' (BMS ID 1598) = 'REUSABLE', 'LIMITED_REUSABLE' or 'REUSABLE_SAME_PATIENT'.\n\nDisclaimer: the label, the IFU and the instructions for cleaning, disinfection and sterilisation are leading. Consult these.\n\n\n**Voorbeeld**\ntrue\n\n**ECHO Common Data Set**\nOptional\n\nBron: GS1 Benelux Healthcare Datamodel (ECHO)\nURL: https://www.gs1belu.org/en/documentation/healthcare-datamodel-3131",
    "source_type": "gs1_nl_datamodel",
    "sector": "Healthcare",
    "attribute_name_en": "Pre-cleaning Indicator",
    "business_name": "nan",
    "bms_id": "7103",
    "url": "https://www.gs1belu.org/en/documentation/healthcare-datamodel-3131",
    "version": "3.1.31"
  },
  {
    "title": "GS1 Healthcare - Cleaning Disinfection Process Code",
    "content": "GS1 Benelux Healthcare Datamodel - Attribuut: Cleaning Disinfection Process Code\n\n**Identificatie**\n- Attribuutnaam (EN): Cleaning Disinfection Process Code\n- Business naam: nan\n- BMS ID: 7106\n\n**Definitie**\nThe code that describes the type of process necessary to clean or disinfect the specific product.\n\n**Invulinstructie**\nIndicate the type of process necessary to (pre-)clean or disinfect the product, by using a code from the code list 'TypeOfCleaningDisinfectionProcessCode'. Indicate this attribute in combination with 'Product Cleaning Type Code' (BMS ID 7104) or 'Product Disinfection Type Code’ (BMS ID 7108).\n\nDisclaimer: the label, the IFU and the instructions for cleaning, disinfection and sterilisation are leading. Consult these. \n\n\n**Voorbeeld**\nAUTOMATED_MANUAL\n\n**ECHO Common Data Set**\nOptional\n\nBron: GS1 Benelux Healthcare Datamodel (ECHO)\nURL: https://www.gs1belu.org/en/documentation/healthcare-datamodel-3131",
    "source_type": "gs1_nl_datamodel",
    "sector": "Healthcare",
    "attribute_name_en": "Cleaning Disinfection Process Code",
    "business_name": "nan",
    "bms_id": "7106",
    "url": "https://www.gs1belu.org/en/documentation/healthcare-datamodel-3131",
    "version": "3.1.31"
  },
  {
    "title": "GS1 Healthcare - Product Cleaning Type Code",
    "content": "GS1 Benelux Healthcare Datamodel - Attribuut: Product Cleaning Type Code\n\n**Identificatie**\n- Attribuutnaam (EN): Product Cleaning Type Code\n- Business naam: nan\n- BMS ID: 7104\n\n**Definitie**\nThe code that describes the form of cleaning/detergent that can be used for the product. Example: Cleaning/detergent in accordance with ISO 15883.\n\n**Invulinstructie**\nIf (pre-)cleaning of the product is required. Then indicate this attribute by selecting the type of (pre-)cleaning/detergent, by using a code from the code list 'TypeOfCleaningCode'. Indicate this attribute in combination with 'Cleaning Disinfection Process Code’ (BMS ID 7106).\n\nDisclaimer: the label, the IFU and the instructions for cleaning, disinfection and sterilisation are leading. Consult these.\n\n**Voorbeeld**\nALKALINE_DETERGENT\n\n**ECHO Common Data Set**\nOptional\n\nBron: GS1 Benelux Healthcare Datamodel (ECHO)\nURL: https://www.gs1belu.org/en/documentation/healthcare-datamodel-3131",
    "source_type": "gs1_nl_datamodel",
    "sector": "Healthcare",
    "attribute_name_en": "Product Cleaning Type Code",
    "business_name": "nan",
    "bms_id": "7104",
    "url": "https://www.gs1belu.org/en/documentation/healthcare-datamodel-3131",
    "version": "3.1.31"
  },
  {
    "title": "GS1 Healthcare - Product Disinfection Type Code",
    "content": "GS1 Benelux Healthcare Datamodel - Attribuut: Product Disinfection Type Code\n\n**Identificatie**\n- Attribuutnaam (EN): Product Disinfection Type Code\n- Business naam: nan\n- BMS ID: 7108\n\n**Definitie**\nThe code that describes the type of disinfection that is possible for the product. Example: Disinfection type in accordance with ISO 15883.\n\n**Invulinstructie**\nIf automated disinfection is required, then also indicate this attribute by selecting the type of disinfection required after cleaning, by using a code from the code list 'TypeOfDisinfectionCode'. Indicate this attribute in combination with 'Cleaning Disinfection Process Code’ (BMS ID 7106).\n\nDisclaimer: the label, the IFU and the instructions for cleaning, disinfection and sterilisation are leading. Consult these.\n\n**Voorbeeld**\nGLUTARALDEHYDE\n\n**ECHO Common Data Set**\nOptional\n\nBron: GS1 Benelux Healthcare Datamodel (ECHO)\nURL: https://www.gs1belu.org/en/documentation/healthcare-datamodel-3131",
    "source_type": "gs1_nl_datamodel",
    "sector": "Healthcare",
    "attribute_name_en": "Product Disinfection Type Code",
    "business_name": "nan",
    "bms_id": "7108",
    "url": "https://www.gs1belu.org/en/documentation/healthcare-datamodel-3131",
    "version": "3.1.31"
  },
  {
    "title": "GS1 Healthcare - Resistance to a Surface Tension Reducing Agent Indicator",
    "content": "GS1 Benelux Healthcare Datamodel - Attribuut: Resistance to a Surface Tension Reducing Agent Indicator\n\n**Identificatie**\n- Attribuutnaam (EN): Resistance to a Surface Tension Reducing Agent Indicator\n- Business naam: nan\n- BMS ID: 7112\n\n**Definitie**\nThe indicator that specifies whether the product is resistant to a surface tension reducing agent.\n\n**Invulinstructie**\nIndicate whether the product is resistant to a surface tension reducing agent by selecting 'true' or 'false'. The information must be indicated when 'Product disinfection type code' (BMS ID 7108) = 'THERMAL_DISINFECTION'.\n\n\n\n**Voorbeeld**\nfalse\n\n**ECHO Common Data Set**\nOptional\n\nBron: GS1 Benelux Healthcare Datamodel (ECHO)\nURL: https://www.gs1belu.org/en/documentation/healthcare-datamodel-3131",
    "source_type": "gs1_nl_datamodel",
    "sector": "Healthcare",
    "attribute_name_en": "Resistance to a Surface Tension Reducing Agent Indicator",
    "business_name": "nan",
    "bms_id": "7112",
    "url": "https://www.gs1belu.org/en/documentation/healthcare-datamodel-3131",
    "version": "3.1.31"
  },
  {
    "title": "GS1 Healthcare - Minimum Process Temperature Timespan",
    "content": "GS1 Benelux Healthcare Datamodel - Attribuut: Minimum Process Temperature Timespan\n\n**Identificatie**\n- Attribuutnaam (EN): Minimum Process Temperature Timespan\n- Business naam: nan\n- BMS ID: 8599\n\n**Definitie**\nThe minimum amount of time that the product can safely be processed in relation to the provided process and temperature, defined by the manufacturer without affecting product safety or quality.\n\n**Invulinstructie**\nAlready in use in the Netherlands (available for other countries soon):\nIndicate the minimum time in which the product can be processed without affecting product safety or quality. Indicate this attriute together with the attributes 'Temperature Qualifier Code' (BMS ID 3830) (with the code 'STERILISATION'), 'Minimum Temperature' (BMS ID 3826) and 'Maximum Temperature' (BMS ID 3820). The information must be indicated when 'Initial Sterilisation Prior to Use Code' (BMS ID 1594) is 'AUTOCLAVE' or 'DRY_HEAT'.\n\nDisclaimer: the label, the IFU and the instructions for cleaning, disinfection and sterilisation are leading. Consult these.\n\n**Voorbeeld**\n3 MIN\n\n**ECHO Common Data Set**\nOptional\n\nBron: GS1 Benelux Healthcare Datamodel (ECHO)\nURL: https://www.gs1belu.org/en/documentation/healthcare-datamodel-3131",
    "source_type": "gs1_nl_datamodel",
    "sector": "Healthcare",
    "attribute_name_en": "Minimum Process Temperature Timespan",
    "business_name": "nan",
    "bms_id": "8599",
    "url": "https://www.gs1belu.org/en/documentation/healthcare-datamodel-3131",
    "version": "3.1.31"
  },
  {
    "title": "GS1 Healthcare - Maximum Process Temperature Timespan",
    "content": "GS1 Benelux Healthcare Datamodel - Attribuut: Maximum Process Temperature Timespan\n\n**Identificatie**\n- Attribuutnaam (EN): Maximum Process Temperature Timespan\n- Business naam: nan\n- BMS ID: 8602\n\n**Definitie**\nThe maximum amount of time that the product can safely be processed in relation to the provided process and temperature, defined by the manufacturer without affecting product safety or quality.\n\n**Invulinstructie**\nAlready in use in the Netherlands (available for other countries soon):\nIndicate the maximum time in which the product can be processed without affecting product safety or quality. Indicate this attribute together with the attributes 'Temperature Qualifier Code' (BMS ID 3830) (with the code 'STERILISATION'), 'Minimum Temperature' (BMS ID 3826) and 'Maximum Temperature' (3820). The information must be indicated when 'Initial Sterilisation Prior to Use Code' (BMS ID 1594) is 'AUTOCLAVE' or 'DRY_HEAT'. \n\nDisclaimer: the label, the IFU and the instructions for cleaning, disinfection and sterilisation are leading. Consult these.\n\n**Voorbeeld**\n15 MIN\n\n**ECHO Common Data Set**\nOptional\n\nBron: GS1 Benelux Healthcare Datamodel (ECHO)\nURL: https://www.gs1belu.org/en/documentation/healthcare-datamodel-3131",
    "source_type": "gs1_nl_datamodel",
    "sector": "Healthcare",
    "attribute_name_en": "Maximum Process Temperature Timespan",
    "business_name": "nan",
    "bms_id": "8602",
    "url": "https://www.gs1belu.org/en/documentation/healthcare-datamodel-3131",
    "version": "3.1.31"
  },
  {
    "title": "GS1 Healthcare - Has Batch Number",
    "content": "GS1 Benelux Healthcare Datamodel - Attribuut: Has Batch Number\n\n**Identificatie**\n- Attribuutnaam (EN): Has Batch Number\n- Business naam: Batch Number Indicator\n- BMS ID: 2306\n\n**Definitie**\nIndication whether the base trade item is batch or lot number requested by law, not batch or lot number requested by law but batch or lot number allocated, or not batch or lot number allocated. A batch or lot number is a manufacturer assigned code used to identify a trade item's trade item on batch or lot.\nDiffers from Serial Number which is a manufacturer assigned code during the trade item on cycle to identify a unique trade item.\n\n**Business Definitie**\nThe indicator specifying whether the item has a batch or lot number.\n\n**Invulinstructie**\nIt is advised to use 'UDI Production Identifier Type Code' (BMS ID 6364) as the attribute 'Has Batch Number' will be replaced by the attribute 'UDI Production Identifier Type Code' (BMS ID 6364) in the 3.1.33 GDSN release (November 2025). \n\nFor the U.S. FDA and if this attribute is still used in countries during the transition period (e.g. Belgium, Germany, Denmark, Finland, Ireland, the Netherlands), indicate whether the GTIN is batch or lot number requested by law by selecting 'true' or 'false'.\n\n\n**Voorbeeld**\nfalse\n\n**ECHO Common Data Set**\nOptional\n\nBron: GS1 Benelux Healthcare Datamodel (ECHO)\nURL: https://www.gs1belu.org/en/documentation/healthcare-datamodel-3131",
    "source_type": "gs1_nl_datamodel",
    "sector": "Healthcare",
    "attribute_name_en": "Has Batch Number",
    "business_name": "Batch Number Indicator",
    "bms_id": "2306",
    "url": "https://www.gs1belu.org/en/documentation/healthcare-datamodel-3131",
    "version": "3.1.31"
  },
  {
    "title": "GS1 Healthcare - Serial Number Location Code",
    "content": "GS1 Benelux Healthcare Datamodel - Attribuut: Serial Number Location Code\n\n**Identificatie**\n- Attribuutnaam (EN): Serial Number Location Code\n- Business naam: nan\n- BMS ID: 2315\n\n**Definitie**\nThe location on the item or packaging of a serial number. A serial number is a code, numeric or alphanumeric, assigned to an individual instance of an entity for its lifetime for example a Microscope model AC-2 with serial number 1234568 and microscope model AC-2 with serial number 1234569.\n\n**Invulinstructie**\nIt is advised to use 'UDI Production Identifier Type Code' (BMS ID 6364) as the attribute 'Serial Number Location Code' will be replaced by the attribute 'UDI Production Identifier Type Code' (BMS ID 6364) in the 3.1.33 GDSN release (November 2025). \n\nFor the U.S. FDA and if this attribute is still used in countries during the transition period (e.g. Belgium, Denmark, Finland, Ireland, the Netherlands) indicate the location of the serial number on the item or packaging using a code from the code list 'SerialNumberLocationCode'. Multiple values are possible.\nIf the location of the serial number is not known select (UNKNOWN) - Unknown location of marking. If the product does not have a serial number select (NOT_MARKED) - No serial number marked.\n\n\n**Voorbeeld**\nMARKED_ON_PACKAGING\n\n**ECHO Common Data Set**\nOptional\n\nBron: GS1 Benelux Healthcare Datamodel (ECHO)\nURL: https://www.gs1belu.org/en/documentation/healthcare-datamodel-3131",
    "source_type": "gs1_nl_datamodel",
    "sector": "Healthcare",
    "attribute_name_en": "Serial Number Location Code",
    "business_name": "nan",
    "bms_id": "2315",
    "url": "https://www.gs1belu.org/en/documentation/healthcare-datamodel-3131",
    "version": "3.1.31"
  },
  {
    "title": "GS1 Healthcare - Trade Item Date On Packaging Type Code",
    "content": "GS1 Benelux Healthcare Datamodel - Attribuut: Trade Item Date On Packaging Type Code\n\n**Identificatie**\n- Attribuutnaam (EN): Trade Item Date On Packaging Type Code\n- Business naam: Packaging Date Type Code\n- BMS ID: 2334\n\n**Definitie**\nIndicates the type of date marked on the packaging for example Best Before Date.\n\n**Business Definitie**\nThe code indicating the type of date on the package to the buyer and consumer.\n\n**Invulinstructie**\nIt is advised to use 'UDI Production Identifier Type Code' (BMS ID 6364) as the attribute 'Trade Item Date On Packaging Type Code' will be replaced by the attribute 'UDI Production Identifier Type Code' (BMS ID 6364) in the 3.1.33 GDSN release (November 2025). \n\nFor the U.S. FDA and if this attribute is still used in countries during the transition period (e.g. Belgium, Denmark, Finland, Ireland, the Netherlands) indicate the type of date marked on the packaging using a code from the code list 'TradeItemDateOnPackagingTypeCode'.\nIf there is no date on the package, choose NO_DATE_MARKED.\n\n\n**Voorbeeld**\nEXPIRATION_DATE\n\n**ECHO Common Data Set**\nOptional\n\nBron: GS1 Benelux Healthcare Datamodel (ECHO)\nURL: https://www.gs1belu.org/en/documentation/healthcare-datamodel-3131",
    "source_type": "gs1_nl_datamodel",
    "sector": "Healthcare",
    "attribute_name_en": "Trade Item Date On Packaging Type Code",
    "business_name": "Packaging Date Type Code",
    "bms_id": "2334",
    "url": "https://www.gs1belu.org/en/documentation/healthcare-datamodel-3131",
    "version": "3.1.31"
  },
  {
    "title": "GS1 Healthcare - Temperature Qualifier Code",
    "content": "GS1 Benelux Healthcare Datamodel - Attribuut: Temperature Qualifier Code\n\n**Identificatie**\n- Attribuutnaam (EN): Temperature Qualifier Code\n- Business naam: Temperature Activity Code\n- BMS ID: 3830\n\n**Definitie**\nCode qualifying the type of a temperature requirement for example Storage.\n\n**Business Definitie**\nThe code that indicates the activity for which the maximum and minimum temperatures are applicable.\n\n**Invulinstructie**\nIndicate this attribute for storage temperature information with the code 'STORAGE_HANDLING', together with the attributes 'Minimum Temperature' (BMS ID 3826) and 'Maximum Temperature' (BMS ID 3820).\n\nAlready in use in the Netherlands (available for other countries soon):\nIndicate this attribute (with the code 'STERILISATION') together with the attributes 'Minimum Temperature' (BMS ID 3826), 'Maximum Temperature' (BMS ID 3820), 'Maximum Process Temperature Timespan' (BMS ID 8602) and 'Minimum Process Temperature Timespan' (BMS ID 8599). The information must be indicated when 'Initial Sterilisation Prior to Use Code' (BMS ID 1594) is 'AUTOCLAVE' or 'DRY_HEAT'.\n\nDisclaimer: the label, the IFU and the instructions for cleaning, disinfection and sterilisation are leading. Consult these.\n\n\n**Voorbeeld**\nSTORAGE_HANDLING\n\n**ECHO Common Data Set**\nConditionally Mandatory\n\nBron: GS1 Benelux Healthcare Datamodel (ECHO)\nURL: https://www.gs1belu.org/en/documentation/healthcare-datamodel-3131",
    "source_type": "gs1_nl_datamodel",
    "sector": "Healthcare",
    "attribute_name_en": "Temperature Qualifier Code",
    "business_name": "Temperature Activity Code",
    "bms_id": "3830",
    "url": "https://www.gs1belu.org/en/documentation/healthcare-datamodel-3131",
    "version": "3.1.31"
  },
  {
    "title": "GS1 Healthcare - Maximum Temperature",
    "content": "GS1 Benelux Healthcare Datamodel - Attribuut: Maximum Temperature\n\n**Identificatie**\n- Attribuutnaam (EN): Maximum Temperature\n- Business naam: Maximum Temperature\n- BMS ID: 3820\n\n**Definitie**\nThe maximum temperature that a trade item can not exceed as defined by the manufacturer without affecting product safety or quality.\n\n**Business Definitie**\nThe maximum temperature that a product can not exceed during an activity as defined by the manufacturer without affecting product safety, quality and/or usage.\n\n**Invulinstructie**\nIndicate the maximum temperature for storage handling in Celsius degrees, together with the attributes 'Temperature Qualifier Code' (BMS ID 3830) (with the code 'STORAGE_HANDLING') and 'Minimum Temperature' (BMS ID 3826).\n\nAlready in use in the Netherlands (available for other countries soon):\nIndicate this attribute together with the attributes 'Temperature Qualifier Code' (BMS ID 3830) (with the code 'STERILISATION'), 'Minimum Temperature' (BMS ID 3826), 'Maximum Process Temperature Timespan' (BMS ID 8602) and 'Minimum Process Temperature Timespan' (BMS ID 8599). The information must be indicated when 'Initial Sterilisation Prior to Use Code' (BMS ID 1594) is 'AUTOCLAVE' or 'DRY_HEAT'.\n\nDisclaimer: the label, the IFU and the instructions for cleaning, disinfection and sterilisation are leading. Consult these.\n\n**Voorbeeld**\n70 CEL\n\n**ECHO Common Data Set**\nOptional\n\nBron: GS1 Benelux Healthcare Datamodel (ECHO)\nURL: https://www.gs1belu.org/en/documentation/healthcare-datamodel-3131",
    "source_type": "gs1_nl_datamodel",
    "sector": "Healthcare",
    "attribute_name_en": "Maximum Temperature",
    "business_name": "Maximum Temperature",
    "bms_id": "3820",
    "url": "https://www.gs1belu.org/en/documentation/healthcare-datamodel-3131",
    "version": "3.1.31"
  },
  {
    "title": "GS1 Healthcare - Minimum Temperature",
    "content": "GS1 Benelux Healthcare Datamodel - Attribuut: Minimum Temperature\n\n**Identificatie**\n- Attribuutnaam (EN): Minimum Temperature\n- Business naam: Minimum Temperature\n- BMS ID: 3826\n\n**Definitie**\nThe minimum temperature that a trade item can be held below defined by the manufacturer without affecting product safety or quality.\n\n**Business Definitie**\nThe minimum temperature that a product can not go below during an activity as defined by the manufacturer without affecting product safety, quality and/or usage.\n\n**Invulinstructie**\nIndicate the minimum temperature for storage handling in Celsius degrees, together with the attributes 'Temperature Qualifier Code' (BMS ID 3830) (with the code 'STORAGE_HANDLING') and 'Maximum Temperature' (BMS ID 3820).\n\nAlready in use in the Netherlands (available for other countries soon):\nIndicate this attribute together with the attributes 'Temperature Qualifier Code' (BMS ID 3830) (with the code 'STERILISATION'), 'Maximum Temperature' (BMS ID 3820),  'Maximum Process Temperature Timespan' (BMS ID 8602) and 'Minimum Process Temperature Timespan' (BMS ID 8599). The information must be indicated when 'Initial Sterilisation Prior to Use Code' (BMS ID 1594) is 'AUTOCLAVE' or 'DRY_HEAT'.\n\nDisclaimer: the label, the IFU and the instructions for cleaning, disinfection and sterilisation are leading. Consult these.\n\n**Voorbeeld**\n5 CEL\n\n**ECHO Common Data Set**\nOptional\n\nBron: GS1 Benelux Healthcare Datamodel (ECHO)\nURL: https://www.gs1belu.org/en/documentation/healthcare-datamodel-3131",
    "source_type": "gs1_nl_datamodel",
    "sector": "Healthcare",
    "attribute_name_en": "Minimum Temperature",
    "business_name": "Minimum Temperature",
    "bms_id": "3826",
    "url": "https://www.gs1belu.org/en/documentation/healthcare-datamodel-3131",
    "version": "3.1.31"
  },
  {
    "title": "GS1 Healthcare - Height",
    "content": "GS1 Benelux Healthcare Datamodel - Attribuut: Height\n\n**Identificatie**\n- Attribuutnaam (EN): Height\n- Business naam: Height\n- BMS ID: 3725\n\n**Definitie**\nThe height of the trade item, as measured according to the GDSN Package Measurement Rules.  If the trade item is a unit load, include the shipping platform unless it is excluded according to the Platform Type Code chosen.\n\n**Business Definitie**\nThe vertical measurement, with its unit of measure, of the item (such as product, case, pallet) according to the GS1 Package Measurement Rules. (https://www.gs1.org/docs/gdsn/3.1/GS1_Package_Measurement_Rules.pdf)\n\n**Invulinstructie**\nIndicate the height of the product according to the GS1 Package and Product Measurement Standard, with its unit of measure from the code list 'MeasurementUnitCode_GDSN'.\n\nGS1 Package and Product Measurement Standard: https://www.gs1.org/standards/gs1-package-and-product-measurement-standard/current-standard\n\n**Voorbeeld**\n240 MMT\n\n**ECHO Common Data Set**\nOptional\n\nBron: GS1 Benelux Healthcare Datamodel (ECHO)\nURL: https://www.gs1belu.org/en/documentation/healthcare-datamodel-3131",
    "source_type": "gs1_nl_datamodel",
    "sector": "Healthcare",
    "attribute_name_en": "Height",
    "business_name": "Height",
    "bms_id": "3725",
    "url": "https://www.gs1belu.org/en/documentation/healthcare-datamodel-3131",
    "version": "3.1.31"
  },
  {
    "title": "GS1 Healthcare - Width",
    "content": "GS1 Benelux Healthcare Datamodel - Attribuut: Width\n\n**Identificatie**\n- Attribuutnaam (EN): Width\n- Business naam: Width\n- BMS ID: 3739\n\n**Definitie**\nThe width of the trade item, as measured according to the GDSN Package Measurement Rules.  If the trade item is a unit load, include the shipping platform unless it is excluded according to the Platform Type Code chosen.\n\n**Business Definitie**\nThe horizontal measurement, with its unit of measure, of the item (such as product, case, pallet) according to the GS1 Package Measurement Rules. (https://www.gs1.org/docs/gdsn/3.1/GS1_Package_Measurement_Rules.pdf)\n\n**Invulinstructie**\nIndicate the width of the product according to the GS1 Package and Product Measurement Standard, with its unit of measure from the code list 'MeasurementUnitCode_GDSN'.\n\nGS1 Package and Product Measurement Standard: https://www.gs1.org/standards/gs1-package-and-product-measurement-standard/current-standard\n\n\n**Voorbeeld**\n600 MMT\n\n**ECHO Common Data Set**\nOptional\n\nBron: GS1 Benelux Healthcare Datamodel (ECHO)\nURL: https://www.gs1belu.org/en/documentation/healthcare-datamodel-3131",
    "source_type": "gs1_nl_datamodel",
    "sector": "Healthcare",
    "attribute_name_en": "Width",
    "business_name": "Width",
    "bms_id": "3739",
    "url": "https://www.gs1belu.org/en/documentation/healthcare-datamodel-3131",
    "version": "3.1.31"
  },
  {
    "title": "GS1 Healthcare - Depth",
    "content": "GS1 Benelux Healthcare Datamodel - Attribuut: Depth\n\n**Identificatie**\n- Attribuutnaam (EN): Depth\n- Business naam: Depth/Length\n- BMS ID: 3721\n\n**Definitie**\nThe depth of the unit load, as measured according to the GDSN Package Measurement Rules, including the shipping platform unless it is excluded according to the Pallet Type Code chosen.\n\n**Business Definitie**\nThe depth or length measurement, with its unit of measure, of the item (such as product, case, pallet) according to the GS1 Package Measurement Rules.\n(https://www.gs1.org/docs/gdsn/3.1/GS1_Package_Measurement_Rules.pdf)\n\n**Invulinstructie**\nIndicate the depth (or length) of the product according to the GS1 Package and Product Measurement Standard, with its unit of measure from the code list 'MeasurementUnitCode_GDSN'.\n\nGS1 Package and Product Measurement Standard: https://www.gs1.org/standards/gs1-package-and-product-measurement-standard/current-standard\n\n**Voorbeeld**\n400 MMT\n\n**ECHO Common Data Set**\nOptional\n\nBron: GS1 Benelux Healthcare Datamodel (ECHO)\nURL: https://www.gs1belu.org/en/documentation/healthcare-datamodel-3131",
    "source_type": "gs1_nl_datamodel",
    "sector": "Healthcare",
    "attribute_name_en": "Depth",
    "business_name": "Depth/Length",
    "bms_id": "3721",
    "url": "https://www.gs1belu.org/en/documentation/healthcare-datamodel-3131",
    "version": "3.1.31"
  },
  {
    "title": "GS1 Healthcare - Gross Weight",
    "content": "GS1 Benelux Healthcare Datamodel - Attribuut: Gross Weight\n\n**Identificatie**\n- Attribuutnaam (EN): Gross Weight\n- Business naam: Gross Weight\n- BMS ID: 3777\n\n**Definitie**\nUsed to identify the gross weight of the trade item. The gross weight includes all packaging materials of the trade item. At pallet level the trade item, grossWeight includes the weight of the pallet itself. For example, \"200 GRM\", value - total pounds, total grams, etc. Has to be associated with a valid UOM.\n\n**Business Definitie**\nThe total weight of the product including the weight of all its packaging materials.\n\n**Invulinstructie**\nIndicate the gross weight of the product. The total weight of the product including the weight of all its packaging materials, with its unit of measure from the code list 'MeasurementUnitCode_GDSN'.\n\n**Voorbeeld**\n120 GRM\n\n**ECHO Common Data Set**\nOptional\n\nBron: GS1 Benelux Healthcare Datamodel (ECHO)\nURL: https://www.gs1belu.org/en/documentation/healthcare-datamodel-3131",
    "source_type": "gs1_nl_datamodel",
    "sector": "Healthcare",
    "attribute_name_en": "Gross Weight",
    "business_name": "Gross Weight",
    "bms_id": "3777",
    "url": "https://www.gs1belu.org/en/documentation/healthcare-datamodel-3131",
    "version": "3.1.31"
  },
  {
    "title": "GS1 Healthcare - Minimum Trade Item Lifespan From Time Of Arrival",
    "content": "GS1 Benelux Healthcare Datamodel - Attribuut: Minimum Trade Item Lifespan From Time Of Arrival\n\n**Identificatie**\n- Attribuutnaam (EN): Minimum Trade Item Lifespan From Time Of Arrival\n- Business naam: Minimum Days of Shelf Life at Arrival\n- BMS ID: 3703\n\n**Definitie**\nThe period of days, guaranteed by the manufacturer, before the expiration date of the trade item, based on arrival to a mutually agreed to point in the buyers distribution system. Can be repeatable upon use of GLN.\n\n**Business Definitie**\nThe seller's determination of the minimum number of calendar days of shelf life of the product, based upon the expiration date on the product, upon receipt by the buyer.\n\n**Invulinstructie**\nIndicate the period of days guaranteed by the manufacturer before the respective kind of expiration date stated for the product, based on arrival at a mutually agreed point in the buyer's distribution system.\n\n**Voorbeeld**\n365\n\n**ECHO Common Data Set**\nOptional\n\nBron: GS1 Benelux Healthcare Datamodel (ECHO)\nURL: https://www.gs1belu.org/en/documentation/healthcare-datamodel-3131",
    "source_type": "gs1_nl_datamodel",
    "sector": "Healthcare",
    "attribute_name_en": "Minimum Trade Item Lifespan From Time Of Arrival",
    "business_name": "Minimum Days of Shelf Life at Arrival",
    "bms_id": "3703",
    "url": "https://www.gs1belu.org/en/documentation/healthcare-datamodel-3131",
    "version": "3.1.31"
  },
  {
    "title": "GS1 Healthcare - Net Weight",
    "content": "GS1 Benelux Healthcare Datamodel - Attribuut: Net Weight\n\n**Identificatie**\n- Attribuutnaam (EN): Net Weight\n- Business naam: Net Weight\n- BMS ID: 3779\n\n**Definitie**\nUsed to identify the net weight of the trade item. Net weight excludes any packaging materials. Has to be associated with a valid UoM.\n\n**Business Definitie**\nThe weight of the product excluding the weight of all its packaging materials.\n\n**Invulinstructie**\nIndicate the net weight of the product. The weight of the product excluding the weight of all its packaging materials, with its unit of measure from the code list 'MeasurementUnitCode_GDSN'.\n\n**Voorbeeld**\n100 GRM\n\n**ECHO Common Data Set**\nOptional\n\nBron: GS1 Benelux Healthcare Datamodel (ECHO)\nURL: https://www.gs1belu.org/en/documentation/healthcare-datamodel-3131",
    "source_type": "gs1_nl_datamodel",
    "sector": "Healthcare",
    "attribute_name_en": "Net Weight",
    "business_name": "Net Weight",
    "bms_id": "3779",
    "url": "https://www.gs1belu.org/en/documentation/healthcare-datamodel-3131",
    "version": "3.1.31"
  },
  {
    "title": "GS1 Healthcare - Handling Instructions Code Reference\n",
    "content": "GS1 Benelux Healthcare Datamodel - Attribuut: Handling Instructions Code Reference\n\n\n**Identificatie**\n- Attribuutnaam (EN): Handling Instructions Code Reference\n\n- Business naam: Product Handling Code\n- BMS ID: 3587\n\n**Definitie**\nDefines the information and processes needed to safely handle the trade item.\n\n\n**Business Definitie**\nThe code that defines the information and processes needed to safely handle the product.\n\n**Invulinstructie**\nIndicate one of the following codes: 'SRT' (Store at Room temperature), 'FPC' (Store in freezer) or '11' (Refrigeration Required).\n\nDisclaimer: the label, the IFU and the instructions for cleaning, disinfection and sterilisation are leading. Consult these.\n\n\n**Voorbeeld**\nSRT\n\n**ECHO Common Data Set**\nOptional\n\nBron: GS1 Benelux Healthcare Datamodel (ECHO)\nURL: https://www.gs1belu.org/en/documentation/healthcare-datamodel-3131",
    "source_type": "gs1_nl_datamodel",
    "sector": "Healthcare",
    "attribute_name_en": "Handling Instructions Code Reference\n",
    "business_name": "Product Handling Code",
    "bms_id": "3587",
    "url": "https://www.gs1belu.org/en/documentation/healthcare-datamodel-3131",
    "version": "3.1.31"
  },
  {
    "title": "GS1 Healthcare - Platform Type Code",
    "content": "GS1 Benelux Healthcare Datamodel - Attribuut: Platform Type Code\n\n**Identificatie**\n- Attribuutnaam (EN): Platform Type Code\n- Business naam: Pallet Type Code\n- BMS ID: 2181\n\n**Definitie**\nIndicates whether the described despatch unit is delivered on a pallet/platform and on which type of platform. If the despatch unit is delivered on a platform, the platform type must be given here. The range of the platform types/codes is listed in code sets.\n\n**Business Definitie**\nThe code that indicates the type of pallet that the unit load is delivered on.\n\n**Invulinstructie**\nIndicate the type of pallet on which the described despatch unit is delivered on, by using a code from the code list 'PlatformTypeCode'.\n\n**Voorbeeld**\n12\n\n**ECHO Common Data Set**\nOptional\n\nBron: GS1 Benelux Healthcare Datamodel (ECHO)\nURL: https://www.gs1belu.org/en/documentation/healthcare-datamodel-3131",
    "source_type": "gs1_nl_datamodel",
    "sector": "Healthcare",
    "attribute_name_en": "Platform Type Code",
    "business_name": "Pallet Type Code",
    "bms_id": "2181",
    "url": "https://www.gs1belu.org/en/documentation/healthcare-datamodel-3131",
    "version": "3.1.31"
  },
  {
    "title": "GS1 Healthcare - Platform Terms And Conditions Code",
    "content": "GS1 Benelux Healthcare Datamodel - Attribuut: Platform Terms And Conditions Code\n\n**Identificatie**\n- Attribuutnaam (EN): Platform Terms And Conditions Code\n- Business naam: Pallet Disposition Code\n- BMS ID: 2180\n\n**Definitie**\nIndicates if the pallet in the prescribed pallet configuration is rented, exchangeable, against deposit or one way (not reusable).\n\n**Business Definitie**\nThe code that describes the expected action to be taken with the pallet.\n\n**Invulinstructie**\nIndicate if the pallet is rented, exchangeable, against deposit or one way (not reusable) by using a code from the code list 'PlatformTermsAndConditionsCode'.\n\n**Voorbeeld**\n2\n\n**ECHO Common Data Set**\nConditionally Optional\n\nBron: GS1 Benelux Healthcare Datamodel (ECHO)\nURL: https://www.gs1belu.org/en/documentation/healthcare-datamodel-3131",
    "source_type": "gs1_nl_datamodel",
    "sector": "Healthcare",
    "attribute_name_en": "Platform Terms And Conditions Code",
    "business_name": "Pallet Disposition Code",
    "bms_id": "2180",
    "url": "https://www.gs1belu.org/en/documentation/healthcare-datamodel-3131",
    "version": "3.1.31"
  },
  {
    "title": "GS1 Healthcare - UDI Production Identifier Type Code",
    "content": "GS1 Benelux Healthcare Datamodel - Attribuut: UDI Production Identifier Type Code\n\n**Identificatie**\n- Attribuutnaam (EN): UDI Production Identifier Type Code\n- Business naam: nan\n- BMS ID: 6364\n\n**Definitie**\nThe Production Identifiers which are used to control the product as relevant for Unique Device Identification (UDI) rules. Example: Expiry Date, Manufacturing Date, Serial Number, Lot (or batch) Number, etc.\n\n**Invulinstructie**\nIndicate the applicable production identifiers used, by using a code or codes from the code list 'UDIProductionIdentifierTypeCode'.\n\nPlease note that the attributes 'Has Batch Number', 'Serial Number Location Code' and 'Trade Item Date On Packaging Type Code' will be replaced, for the ECHO countries, by the attribute 'UDI Production Identifier Type Code' in the 3.1.33 GDSN release (November 2025).\n\n**Voorbeeld**\nEXPIRATION_DATE\n\n**ECHO Common Data Set**\nOptional\n\nBron: GS1 Benelux Healthcare Datamodel (ECHO)\nURL: https://www.gs1belu.org/en/documentation/healthcare-datamodel-3131",
    "source_type": "gs1_nl_datamodel",
    "sector": "Healthcare",
    "attribute_name_en": "UDI Production Identifier Type Code",
    "business_name": "nan",
    "bms_id": "6364",
    "url": "https://www.gs1belu.org/en/documentation/healthcare-datamodel-3131",
    "version": "3.1.31"
  },
  {
    "title": "GS1 Healthcare - United Nations Dangerous Goods Number",
    "content": "GS1 Benelux Healthcare Datamodel - Attribuut: United Nations Dangerous Goods Number\n\n**Identificatie**\n- Attribuutnaam (EN): United Nations Dangerous Goods Number\n- Business naam: United Nations Dangerous Goods Number\n- BMS ID: 3894\n\n**Definitie**\nThe four-digit number assigned by the United Nations Committee of Experts on the Transport of Dangerous Goods to classify a substance or a particular groups of substances. Abbreviation: UNDG Number.\n\n**Business Definitie**\nThe four-digit number assigned by the United Nations Committee of Experts on the transport of dangerous goods that identifies dangerous goods, such as explosives, flammable liquids and toxic substances.\n\n**Invulinstructie**\nIndicate the UN number, (substance identification number) of the dangerous goods item according to substance list for transport by road and rail (ADR/RID). This is the four-digit number assigned by the United Nations Committee of Experts on the Transport of Dangerous Goods to classify a substance or a particular groups of substances. Abbreviation: UNDG Number. The information should be indicated when 'Dangerous Goods Regulation Code' (BMS ID 3865) = 'ZCG'.\n\nFor the UN number see the external code list of ADR2017 - UN numbers after the national dangerous goods legislation corresponding to the European risk good agreements.\n\nThe attribute 'United Nations Dangerous Goods Number' is used in combination with 'Dangerous Goods Hazardous Code' (BMS ID 3881) and 'Dangerous Goods Regulation Code' (BMS ID 3865).\n\n\n\n**Voorbeeld**\n1234\n\n**ECHO Common Data Set**\nConditionally Optional\n\nBron: GS1 Benelux Healthcare Datamodel (ECHO)\nURL: https://www.gs1belu.org/en/documentation/healthcare-datamodel-3131",
    "source_type": "gs1_nl_datamodel",
    "sector": "Healthcare",
    "attribute_name_en": "United Nations Dangerous Goods Number",
    "business_name": "United Nations Dangerous Goods Number",
    "bms_id": "3894",
    "url": "https://www.gs1belu.org/en/documentation/healthcare-datamodel-3131",
    "version": "3.1.31"
  },
  {
    "title": "GS1 Healthcare - Dangerous Goods Regulation Code",
    "content": "GS1 Benelux Healthcare Datamodel - Attribuut: Dangerous Goods Regulation Code\n\n**Identificatie**\n- Attribuutnaam (EN): Dangerous Goods Regulation Code\n- Business naam: Dangerous Goods Regulation Code\n- BMS ID: 3865\n\n**Definitie**\nAn indication of the classification system(s) of dangerous goods and/or the Agency(ies) responsible for it.\n\n**Business Definitie**\nThe code indicating the agency responsible for the classification system of dangerous goods or indicating whether the product is dangerous goods.\n\n**Invulinstructie**\nIndicate whether the product and/or at least one of its packaging items – or at least one of its assortment components – because of its properties according to the European dangerous goods agreements (ADR/RID), and the respective national legislation for transport by road and rail – must be classified as a dangerous good, and thus is subject to the respective regulations.\n\nIf the product contains dangerous goods or is a dangerous good indicate 'ZCG'. If the product does not contain or is not a dangerous good indicate 'ZNA'.\n\nIf the attribute 'Dangerous Goods Regulation Code' is indicated using code 'ZCG', then the attribute is used in combination with 'Dangerous Goods Hazardous Code' (BMS ID 3881) and United Nations Dangerous Goods Number' (BMS ID 3894).\n\n**Voorbeeld**\nZCG\n\n**ECHO Common Data Set**\nOptional\n\nBron: GS1 Benelux Healthcare Datamodel (ECHO)\nURL: https://www.gs1belu.org/en/documentation/healthcare-datamodel-3131",
    "source_type": "gs1_nl_datamodel",
    "sector": "Healthcare",
    "attribute_name_en": "Dangerous Goods Regulation Code",
    "business_name": "Dangerous Goods Regulation Code",
    "bms_id": "3865",
    "url": "https://www.gs1belu.org/en/documentation/healthcare-datamodel-3131",
    "version": "3.1.31"
  },
  {
    "title": "GS1 Healthcare - Dangerous Goods Hazardous Code",
    "content": "GS1 Benelux Healthcare Datamodel - Attribuut: Dangerous Goods Hazardous Code\n\n**Identificatie**\n- Attribuutnaam (EN): Dangerous Goods Hazardous Code\n- Business naam: Hazardous Identification Code\n- BMS ID: 3881\n\n**Definitie**\nDangerous goods hazard ID number, which must be applied to the vehicle, when transporting this trade item (dangerous good) by road or rail, to inform the police, the fire brigade and others in case of an accident about the kind of danger caused by the cargo.\n\n**Business Definitie**\nThe code applied to the vehicle transporting dangerous goods by road or rail.\n\n**Invulinstructie**\nIndicate the hazardous code, which must be applied to the vehicle (in the top part of the orange sign), when transporting this trade item (dangerous goods) by road or rail, to inform the police, the fire brigade and others in case of an accident about the kind of danger caused by the cargo. For dangerous goods without a hazardous code, the code 'NONE' should be indicated. The information should be indicated when 'Dangerous Goods Regulation Code' (BMS ID 3865) = 'ZCG'.\n\nFor the hazardous code see the external code list of ADR2017 - Numbers to identify the danger after the national dangerous goods legislation corresponding to the European risk good agreements.\n\nThe attribute 'Dangerous Goods Hazardous Code' is used in combination with 'United Nations Dangerous Goods Number' (BMS ID 3894) and 'Dangerous Goods Regulation Code' (BMS ID 3865).\n\n\n**Voorbeeld**\n80\n\n**ECHO Common Data Set**\nConditionally Optional\n\nBron: GS1 Benelux Healthcare Datamodel (ECHO)\nURL: https://www.gs1belu.org/en/documentation/healthcare-datamodel-3131",
    "source_type": "gs1_nl_datamodel",
    "sector": "Healthcare",
    "attribute_name_en": "Dangerous Goods Hazardous Code",
    "business_name": "Hazardous Identification Code",
    "bms_id": "3881",
    "url": "https://www.gs1belu.org/en/documentation/healthcare-datamodel-3131",
    "version": "3.1.31"
  },
  {
    "title": "GS1 Healthcare - Communication Channel Code",
    "content": "GS1 Benelux Healthcare Datamodel - Attribuut: Communication Channel Code\n\n**Identificatie**\n- Attribuutnaam (EN): Communication Channel Code\n- Business naam: Contact Method Code\n- BMS ID: 134\n\n**Definitie**\nCode specifying the type of communication channel, for example TELEPHONE.\n\n**Business Definitie**\nThe code specifying the method of communication to reach the contact.\n\n**Invulinstructie**\n(See regulatory mapping tab)\n\n**Voorbeeld**\nTELEPHONE\n\nBron: GS1 Benelux Healthcare Datamodel (ECHO)\nURL: https://www.gs1belu.org/en/documentation/healthcare-datamodel-3131",
    "source_type": "gs1_nl_datamodel",
    "sector": "Healthcare",
    "attribute_name_en": "Communication Channel Code",
    "business_name": "Contact Method Code",
    "bms_id": "134",
    "url": "https://www.gs1belu.org/en/documentation/healthcare-datamodel-3131",
    "version": "3.1.31"
  },
  {
    "title": "GS1 Healthcare - Communication Value",
    "content": "GS1 Benelux Healthcare Datamodel - Attribuut: Communication Value\n\n**Identificatie**\n- Attribuutnaam (EN): Communication Value\n- Business naam: Contact Details\n- BMS ID: 135\n\n**Definitie**\nText identifying the endpoint for the communication channel, for example a telephone number or an e-mail address.\n\n**Business Definitie**\nThe detailed information used to communicate with the contact, such as the telephone number, email address or web site address.\n\n**Invulinstructie**\n(See regulatory mapping tab)\n\n**Voorbeeld**\n +31(0)548754214\n\nBron: GS1 Benelux Healthcare Datamodel (ECHO)\nURL: https://www.gs1belu.org/en/documentation/healthcare-datamodel-3131",
    "source_type": "gs1_nl_datamodel",
    "sector": "Healthcare",
    "attribute_name_en": "Communication Value",
    "business_name": "Contact Details",
    "bms_id": "135",
    "url": "https://www.gs1belu.org/en/documentation/healthcare-datamodel-3131",
    "version": "3.1.31"
  },
  {
    "title": "GS1 Healthcare - Component Identification",
    "content": "GS1 Benelux Healthcare Datamodel - Attribuut: Component Identification\n\n**Identificatie**\n- Attribuutnaam (EN): Component Identification\n- Business naam: nan\n- BMS ID: 325\n\n**Definitie**\nAn identifier for a component.\n\n**Invulinstructie**\n(See regulatory mapping tab)\n\n**Voorbeeld**\n05410013107231\n\nBron: GS1 Benelux Healthcare Datamodel (ECHO)\nURL: https://www.gs1belu.org/en/documentation/healthcare-datamodel-3131",
    "source_type": "gs1_nl_datamodel",
    "sector": "Healthcare",
    "attribute_name_en": "Component Identification",
    "business_name": "nan",
    "bms_id": "325",
    "url": "https://www.gs1belu.org/en/documentation/healthcare-datamodel-3131",
    "version": "3.1.31"
  },
  {
    "title": "GS1 Healthcare - UDID Device Count",
    "content": "GS1 Benelux Healthcare Datamodel - Attribuut: UDID Device Count\n\n**Identificatie**\n- Attribuutnaam (EN): UDID Device Count\n- Business naam: nan\n- BMS ID: 1583\n\n**Definitie**\nThe count of medical devices which are contained inside the base item for regulatory purposes.\n\n**Invulinstructie**\nAttribute used by EU EUDAMED and GUDID (US FDA) only.\nIndicate the count of medical devices which are contained inside the base item for regulatory purposes.\n\n**Voorbeeld**\n1\n\nBron: GS1 Benelux Healthcare Datamodel (ECHO)\nURL: https://www.gs1belu.org/en/documentation/healthcare-datamodel-3131",
    "source_type": "gs1_nl_datamodel",
    "sector": "Healthcare",
    "attribute_name_en": "UDID Device Count",
    "business_name": "nan",
    "bms_id": "1583",
    "url": "https://www.gs1belu.org/en/documentation/healthcare-datamodel-3131",
    "version": "3.1.31"
  },
  {
    "title": "GS1 Healthcare - UDID First Publication Date Time",
    "content": "GS1 Benelux Healthcare Datamodel - Attribuut: UDID First Publication Date Time\n\n**Identificatie**\n- Attribuutnaam (EN): UDID First Publication Date Time\n- Business naam: nan\n- BMS ID: 147\n\n**Definitie**\nThe date upon which the Trade Item can be published by the Unique Device Identifier Database (UDID) in their public facing systems. \nUntil this date, the product information may reside in the UDID, but will not be visible to the public.\n\n**Invulinstructie**\n(See regulatory mapping tab)\n\n**Voorbeeld**\n2019-05-13T00:00:00\n\nBron: GS1 Benelux Healthcare Datamodel (ECHO)\nURL: https://www.gs1belu.org/en/documentation/healthcare-datamodel-3131",
    "source_type": "gs1_nl_datamodel",
    "sector": "Healthcare",
    "attribute_name_en": "UDID First Publication Date Time",
    "business_name": "nan",
    "bms_id": "147",
    "url": "https://www.gs1belu.org/en/documentation/healthcare-datamodel-3131",
    "version": "3.1.31"
  },
  {
    "title": "GS1 Healthcare - Is Trade Item Exempt from Direct Part Marking",
    "content": "GS1 Benelux Healthcare Datamodel - Attribuut: Is Trade Item Exempt from Direct Part Marking\n\n**Identificatie**\n- Attribuutnaam (EN): Is Trade Item Exempt from Direct Part Marking\n- Business naam: nan\n- BMS ID: 1582\n\n**Definitie**\nIndicator signifying the trade item is exempt from direct identification marking according to regulation or regulatory filings within the target market.\n\n**Invulinstructie**\n(See regulatory mapping tab)\n\n**Voorbeeld**\nFALSE\n\nBron: GS1 Benelux Healthcare Datamodel (ECHO)\nURL: https://www.gs1belu.org/en/documentation/healthcare-datamodel-3131",
    "source_type": "gs1_nl_datamodel",
    "sector": "Healthcare",
    "attribute_name_en": "Is Trade Item Exempt from Direct Part Marking",
    "business_name": "nan",
    "bms_id": "1582",
    "url": "https://www.gs1belu.org/en/documentation/healthcare-datamodel-3131",
    "version": "3.1.31"
  },
  {
    "title": "GS1 Healthcare - Direct Part Marking Identifier",
    "content": "GS1 Benelux Healthcare Datamodel - Attribuut: Direct Part Marking Identifier\n\n**Identificatie**\n- Attribuutnaam (EN): Direct Part Marking Identifier\n- Business naam: nan\n- BMS ID: 6095\n\n**Definitie**\nA number or marking placed directly on the medical device.\n\n**Invulinstructie**\n(See regulatory mapping tab)\n\n**Voorbeeld**\nDLC-2200\n\nBron: GS1 Benelux Healthcare Datamodel (ECHO)\nURL: https://www.gs1belu.org/en/documentation/healthcare-datamodel-3131",
    "source_type": "gs1_nl_datamodel",
    "sector": "Healthcare",
    "attribute_name_en": "Direct Part Marking Identifier",
    "business_name": "nan",
    "bms_id": "6095",
    "url": "https://www.gs1belu.org/en/documentation/healthcare-datamodel-3131",
    "version": "3.1.31"
  },
  {
    "title": "GS1 Healthcare - Direct Part Marking Identifier - Identification Scheme Agency Code\n",
    "content": "GS1 Benelux Healthcare Datamodel - Attribuut: Direct Part Marking Identifier - Identification Scheme Agency Code\n\n\n**Identificatie**\n- Attribuutnaam (EN): Direct Part Marking Identifier - Identification Scheme Agency Code\n\n- Business naam: nan\n- BMS ID: 6096\n\n**Definitie**\nA number or marking placed directly on the medical device.\n\n**Invulinstructie**\n(See regulatory mapping tab)\n\n**Voorbeeld**\nGS1\n\nBron: GS1 Benelux Healthcare Datamodel (ECHO)\nURL: https://www.gs1belu.org/en/documentation/healthcare-datamodel-3131",
    "source_type": "gs1_nl_datamodel",
    "sector": "Healthcare",
    "attribute_name_en": "Direct Part Marking Identifier - Identification Scheme Agency Code\n",
    "business_name": "nan",
    "bms_id": "6096",
    "url": "https://www.gs1belu.org/en/documentation/healthcare-datamodel-3131",
    "version": "3.1.31"
  },
  {
    "title": "GS1 Healthcare - Is Exempt From Premarket Authorisation",
    "content": "GS1 Benelux Healthcare Datamodel - Attribuut: Is Exempt From Premarket Authorisation\n\n**Identificatie**\n- Attribuutnaam (EN): Is Exempt From Premarket Authorisation\n- Business naam: nan\n- BMS ID: 6100\n\n**Definitie**\nDevice is exempt from FDA Premarket regulations. Premarket approval (PMA) is the FDA process of scientific and regulatory review to evaluate the safety and effectiveness of Class III medical devices. Class IIIdevices are those that support or sustain human life, are of substantial importance in preventing impairment of human health, or which present a potential, unreasonable risk of illness or injury. Due to the level of risk associated with Class III devices, FDA has determined that general and special controls alone are  insufficient to assure the safety and effectiveness of class III devices. Therefore, these devices require a premarket approval (PMA) application under section 515 of the FD&C Act in order to obtain marketing clearance. Please note that some Class III preamendment devices may require a Class III 510(k).\nSee \"Historical Background2\" for additional information.\n\n**Invulinstructie**\n(See regulatory mapping tab)\n\n**Voorbeeld**\nFalse \n\nBron: GS1 Benelux Healthcare Datamodel (ECHO)\nURL: https://www.gs1belu.org/en/documentation/healthcare-datamodel-3131",
    "source_type": "gs1_nl_datamodel",
    "sector": "Healthcare",
    "attribute_name_en": "Is Exempt From Premarket Authorisation",
    "business_name": "nan",
    "bms_id": "6100",
    "url": "https://www.gs1belu.org/en/documentation/healthcare-datamodel-3131",
    "version": "3.1.31"
  },
  {
    "title": "GS1 Healthcare - Trade Item Identification Marking Type Code",
    "content": "GS1 Benelux Healthcare Datamodel - Attribuut: Trade Item Identification Marking Type Code\n\n**Identificatie**\n- Attribuutnaam (EN): Trade Item Identification Marking Type Code\n- Business naam: nan\n- BMS ID: 2319\n\n**Definitie**\nA code determining whether the item and/or its packaging is marked with a specific identification.\n\n**Invulinstructie**\n(See regulatory mapping tab)\n\n**Voorbeeld**\nDONATION_IDENTIFICATION_NUMBER\n\nBron: GS1 Benelux Healthcare Datamodel (ECHO)\nURL: https://www.gs1belu.org/en/documentation/healthcare-datamodel-3131",
    "source_type": "gs1_nl_datamodel",
    "sector": "Healthcare",
    "attribute_name_en": "Trade Item Identification Marking Type Code",
    "business_name": "nan",
    "bms_id": "2319",
    "url": "https://www.gs1belu.org/en/documentation/healthcare-datamodel-3131",
    "version": "3.1.31"
  },
  {
    "title": "GS1 Healthcare - Component Number",
    "content": "GS1 Benelux Healthcare Datamodel - Attribuut: Component Number\n\n**Identificatie**\n- Attribuutnaam (EN): Component Number\n- Business naam: nan\n- BMS ID: 322\n\n**Definitie**\nIndicate a sequence number of a component of a trade item.\n\n**Invulinstructie**\n(See regulatory mapping tab)\n\n**Voorbeeld**\n20\n\nBron: GS1 Benelux Healthcare Datamodel (ECHO)\nURL: https://www.gs1belu.org/en/documentation/healthcare-datamodel-3131",
    "source_type": "gs1_nl_datamodel",
    "sector": "Healthcare",
    "attribute_name_en": "Component Number",
    "business_name": "nan",
    "bms_id": "322",
    "url": "https://www.gs1belu.org/en/documentation/healthcare-datamodel-3131",
    "version": "3.1.31"
  },
  {
    "title": "GS1 Healthcare - Last Ship Date Time",
    "content": "GS1 Benelux Healthcare Datamodel - Attribuut: Last Ship Date Time\n\n**Identificatie**\n- Attribuutnaam (EN): Last Ship Date Time\n- Business naam: nan\n- BMS ID: 1017\n\n**Definitie**\nIndicates the latest date that the trade item can be shipped. This is independent of any specific ship-from location.\n\n**Invulinstructie**\n(See regulatory mapping tab)\n\n**Voorbeeld**\n2025-03-13T00:00:00\n\nBron: GS1 Benelux Healthcare Datamodel (ECHO)\nURL: https://www.gs1belu.org/en/documentation/healthcare-datamodel-3131",
    "source_type": "gs1_nl_datamodel",
    "sector": "Healthcare",
    "attribute_name_en": "Last Ship Date Time",
    "business_name": "nan",
    "bms_id": "1017",
    "url": "https://www.gs1belu.org/en/documentation/healthcare-datamodel-3131",
    "version": "3.1.31"
  },
  {
    "title": "GS1 Healthcare - Packaging Type Description",
    "content": "GS1 Benelux Healthcare Datamodel - Attribuut: Packaging Type Description\n\n**Identificatie**\n- Attribuutnaam (EN): Packaging Type Description\n- Business naam: nan\n- BMS ID: 2187\n\n**Definitie**\nSystem generated text description of the type of packaging used for the trade item.\n\n**Invulinstructie**\n(See regulatory mapping tab)\n\n**Voorbeeld**\nGlass bottle with metal lid. Label is made of paper and attached with glue. \n\nBron: GS1 Benelux Healthcare Datamodel (ECHO)\nURL: https://www.gs1belu.org/en/documentation/healthcare-datamodel-3131",
    "source_type": "gs1_nl_datamodel",
    "sector": "Healthcare",
    "attribute_name_en": "Packaging Type Description",
    "business_name": "nan",
    "bms_id": "2187",
    "url": "https://www.gs1belu.org/en/documentation/healthcare-datamodel-3131",
    "version": "3.1.31"
  },
  {
    "title": "GS1 Healthcare - Healthcare Grouped Product Code",
    "content": "GS1 Benelux Healthcare Datamodel - Attribuut: Healthcare Grouped Product Code\n\n**Identificatie**\n- Attribuutnaam (EN): Healthcare Grouped Product Code\n- Business naam: nan\n- BMS ID: 6090\n\n**Definitie**\nA code representing whether a healthcare item is considered by the manufacturer to be more than a single item or for example: kit or combination for FDA 21CFR 830.\n\n**Invulinstructie**\n(See regulatory mapping tab)\n\n**Voorbeeld**\nKIT_AND_COMBINATION\n\nBron: GS1 Benelux Healthcare Datamodel (ECHO)\nURL: https://www.gs1belu.org/en/documentation/healthcare-datamodel-3131",
    "source_type": "gs1_nl_datamodel",
    "sector": "Healthcare",
    "attribute_name_en": "Healthcare Grouped Product Code",
    "business_name": "nan",
    "bms_id": "6090",
    "url": "https://www.gs1belu.org/en/documentation/healthcare-datamodel-3131",
    "version": "3.1.31"
  },
  {
    "title": "GS1 Healthcare - Consumer Sales Condition Code",
    "content": "GS1 Benelux Healthcare Datamodel - Attribuut: Consumer Sales Condition Code\n\n**Identificatie**\n- Attribuutnaam (EN): Consumer Sales Condition Code\n- Business naam: nan\n- BMS ID: 3325\n\n**Definitie**\nA code depicting restrictions imposed on the Trade Item regarding how it can be sold to the consumer for example age restrictions, selling restrictions.\n\n**Invulinstructie**\n(See regulatory mapping tab)\n\n**Voorbeeld**\nRegulated products controlled and handled by authorized personnel for an authorized user for example prescription pharmaceutical, narcotics, prescription strength acetaminophen. (1)\n\nBron: GS1 Benelux Healthcare Datamodel (ECHO)\nURL: https://www.gs1belu.org/en/documentation/healthcare-datamodel-3131",
    "source_type": "gs1_nl_datamodel",
    "sector": "Healthcare",
    "attribute_name_en": "Consumer Sales Condition Code",
    "business_name": "nan",
    "bms_id": "3325",
    "url": "https://www.gs1belu.org/en/documentation/healthcare-datamodel-3131",
    "version": "3.1.31"
  },
  {
    "title": "GS1 Healthcare - Clinical Size Value",
    "content": "GS1 Benelux Healthcare Datamodel - Attribuut: Clinical Size Value\n\n**Identificatie**\n- Attribuutnaam (EN): Clinical Size Value\n- Business naam: nan\n- BMS ID: 6078\n\n**Definitie**\nThe value to denote the dimensional size which is clinically relevant for the use of the trade item by the clinical user. For example 16 gauge for a needle, or 200 cc for a syringe. \n\n**Invulinstructie**\n(See regulatory mapping tab)\n\n**Voorbeeld**\n200 CLT\n\nBron: GS1 Benelux Healthcare Datamodel (ECHO)\nURL: https://www.gs1belu.org/en/documentation/healthcare-datamodel-3131",
    "source_type": "gs1_nl_datamodel",
    "sector": "Healthcare",
    "attribute_name_en": "Clinical Size Value",
    "business_name": "nan",
    "bms_id": "6078",
    "url": "https://www.gs1belu.org/en/documentation/healthcare-datamodel-3131",
    "version": "3.1.31"
  },
  {
    "title": "GS1 Healthcare - Clinical Size Measurement Precision Code",
    "content": "GS1 Benelux Healthcare Datamodel - Attribuut: Clinical Size Measurement Precision Code\n\n**Identificatie**\n- Attribuutnaam (EN): Clinical Size Measurement Precision Code\n- Business naam: nan\n- BMS ID: 6378\n\n**Definitie**\nThe precision of the clinical size measures.\n\n**Invulinstructie**\n(See regulatory mapping tab)\n\n**Voorbeeld**\nRANGE\n\nBron: GS1 Benelux Healthcare Datamodel (ECHO)\nURL: https://www.gs1belu.org/en/documentation/healthcare-datamodel-3131",
    "source_type": "gs1_nl_datamodel",
    "sector": "Healthcare",
    "attribute_name_en": "Clinical Size Measurement Precision Code",
    "business_name": "nan",
    "bms_id": "6378",
    "url": "https://www.gs1belu.org/en/documentation/healthcare-datamodel-3131",
    "version": "3.1.31"
  },
  {
    "title": "GS1 Healthcare - Clinical Warning Agency Code",
    "content": "GS1 Benelux Healthcare Datamodel - Attribuut: Clinical Warning Agency Code\n\n**Identificatie**\n- Attribuutnaam (EN): Clinical Warning Agency Code\n- Business naam: nan\n- BMS ID: 6143\n\n**Definitie**\nThe agency which manages the clinical warning codings for example FDA.\n\n**Invulinstructie**\n(See regulatory mapping tab)\n\n**Voorbeeld**\nEUDAMED\n\nBron: GS1 Benelux Healthcare Datamodel (ECHO)\nURL: https://www.gs1belu.org/en/documentation/healthcare-datamodel-3131",
    "source_type": "gs1_nl_datamodel",
    "sector": "Healthcare",
    "attribute_name_en": "Clinical Warning Agency Code",
    "business_name": "nan",
    "bms_id": "6143",
    "url": "https://www.gs1belu.org/en/documentation/healthcare-datamodel-3131",
    "version": "3.1.31"
  },
  {
    "title": "GS1 Healthcare - Clinical Warning",
    "content": "GS1 Benelux Healthcare Datamodel - Attribuut: Clinical Warning\n\n**Identificatie**\n- Attribuutnaam (EN): Clinical Warning\n- Business naam: nan\n- BMS ID: 6144\n\n**Definitie**\nClinical warning information is additional information which outlines special requirements, warning and caution information printed on the package.\n\n**Invulinstructie**\n(See regulatory mapping tab)\n\n**Voorbeeld**\nHigh risk when used during pregnancy.\n\nBron: GS1 Benelux Healthcare Datamodel (ECHO)\nURL: https://www.gs1belu.org/en/documentation/healthcare-datamodel-3131",
    "source_type": "gs1_nl_datamodel",
    "sector": "Healthcare",
    "attribute_name_en": "Clinical Warning",
    "business_name": "nan",
    "bms_id": "6144",
    "url": "https://www.gs1belu.org/en/documentation/healthcare-datamodel-3131",
    "version": "3.1.31"
  },
  {
    "title": "GS1 Healthcare - Warnings Or Contra Indication Description",
    "content": "GS1 Benelux Healthcare Datamodel - Attribuut: Warnings Or Contra Indication Description\n\n**Identificatie**\n- Attribuutnaam (EN): Warnings Or Contra Indication Description\n- Business naam: nan\n- BMS ID: 6381\n\n**Definitie**\nDescription of warnings or contra-indications applicable to the product\n\n**Invulinstructie**\n(See regulatory mapping tab)\n\n**Voorbeeld**\nHigh risk when used during pregnancy.\n\nBron: GS1 Benelux Healthcare Datamodel (ECHO)\nURL: https://www.gs1belu.org/en/documentation/healthcare-datamodel-3131",
    "source_type": "gs1_nl_datamodel",
    "sector": "Healthcare",
    "attribute_name_en": "Warnings Or Contra Indication Description",
    "business_name": "nan",
    "bms_id": "6381",
    "url": "https://www.gs1belu.org/en/documentation/healthcare-datamodel-3131",
    "version": "3.1.31"
  },
  {
    "title": "GS1 Healthcare - Clinical Storage Handling Type Code",
    "content": "GS1 Benelux Healthcare Datamodel - Attribuut: Clinical Storage Handling Type Code\n\n**Identificatie**\n- Attribuutnaam (EN): Clinical Storage Handling Type Code\n- Business naam: nan\n- BMS ID: 6377\n\n**Definitie**\nThe type of Clinical Storage Handling of the medical device.\n\n**Invulinstructie**\n(See regulatory mapping tab)\n\n**Voorbeeld**\nSHC08\n\nBron: GS1 Benelux Healthcare Datamodel (ECHO)\nURL: https://www.gs1belu.org/en/documentation/healthcare-datamodel-3131",
    "source_type": "gs1_nl_datamodel",
    "sector": "Healthcare",
    "attribute_name_en": "Clinical Storage Handling Type Code",
    "business_name": "nan",
    "bms_id": "6377",
    "url": "https://www.gs1belu.org/en/documentation/healthcare-datamodel-3131",
    "version": "3.1.31"
  },
  {
    "title": "GS1 Healthcare - Clinical Storage Handling Description",
    "content": "GS1 Benelux Healthcare Datamodel - Attribuut: Clinical Storage Handling Description\n\n**Identificatie**\n- Attribuutnaam (EN): Clinical Storage Handling Description\n- Business naam: nan\n- BMS ID: 6375\n\n**Definitie**\nDescription of the storage or handling conditions or the Critical warnings as clinically relevant for the product\n\n**Invulinstructie**\n(See regulatory mapping tab)\n\n**Voorbeeld**\nDo not place in direct sunlight.\n\nBron: GS1 Benelux Healthcare Datamodel (ECHO)\nURL: https://www.gs1belu.org/en/documentation/healthcare-datamodel-3131",
    "source_type": "gs1_nl_datamodel",
    "sector": "Healthcare",
    "attribute_name_en": "Clinical Storage Handling Description",
    "business_name": "nan",
    "bms_id": "6375",
    "url": "https://www.gs1belu.org/en/documentation/healthcare-datamodel-3131",
    "version": "3.1.31"
  },
  {
    "title": "GS1 Healthcare - Maximum Environment Atmospheric Pressure",
    "content": "GS1 Benelux Healthcare Datamodel - Attribuut: Maximum Environment Atmospheric Pressure\n\n**Identificatie**\n- Attribuutnaam (EN): Maximum Environment Atmospheric Pressure\n- Business naam: nan\n- BMS ID: 6139\n\n**Definitie**\nThe maximum atmospheric pressure in which the item remains usable. This value is the value above which the trade item should not be subjected.\n\n**Invulinstructie**\n(See regulatory mapping tab)\n\n**Voorbeeld**\n20 BAR\n\nBron: GS1 Benelux Healthcare Datamodel (ECHO)\nURL: https://www.gs1belu.org/en/documentation/healthcare-datamodel-3131",
    "source_type": "gs1_nl_datamodel",
    "sector": "Healthcare",
    "attribute_name_en": "Maximum Environment Atmospheric Pressure",
    "business_name": "nan",
    "bms_id": "6139",
    "url": "https://www.gs1belu.org/en/documentation/healthcare-datamodel-3131",
    "version": "3.1.31"
  },
  {
    "title": "GS1 Healthcare - Minimum Environment Atmospheric Pressure",
    "content": "GS1 Benelux Healthcare Datamodel - Attribuut: Minimum Environment Atmospheric Pressure\n\n**Identificatie**\n- Attribuutnaam (EN): Minimum Environment Atmospheric Pressure\n- Business naam: nan\n- BMS ID: 6141\n\n**Definitie**\nThe minimum atmospheric pressure in which the item remains usable. This value is the value below which the trade item should not be subjected.\n\n**Invulinstructie**\n(See regulatory mapping tab)\n\n**Voorbeeld**\n3 BAR\n\nBron: GS1 Benelux Healthcare Datamodel (ECHO)\nURL: https://www.gs1belu.org/en/documentation/healthcare-datamodel-3131",
    "source_type": "gs1_nl_datamodel",
    "sector": "Healthcare",
    "attribute_name_en": "Minimum Environment Atmospheric Pressure",
    "business_name": "nan",
    "bms_id": "6141",
    "url": "https://www.gs1belu.org/en/documentation/healthcare-datamodel-3131",
    "version": "3.1.31"
  },
  {
    "title": "GS1 Healthcare - Humidity Qualifier Code",
    "content": "GS1 Benelux Healthcare Datamodel - Attribuut: Humidity Qualifier Code\n\n**Identificatie**\n- Attribuutnaam (EN): Humidity Qualifier Code\n- Business naam: nan\n- BMS ID: 3640\n\n**Definitie**\nCode qualifying the type of a humidity for example STORAGE.\n\n**Invulinstructie**\n(See regulatory mapping tab)\n\n**Voorbeeld**\nSTORAGE_AFTER_OPENING\n\nBron: GS1 Benelux Healthcare Datamodel (ECHO)\nURL: https://www.gs1belu.org/en/documentation/healthcare-datamodel-3131",
    "source_type": "gs1_nl_datamodel",
    "sector": "Healthcare",
    "attribute_name_en": "Humidity Qualifier Code",
    "business_name": "nan",
    "bms_id": "3640",
    "url": "https://www.gs1belu.org/en/documentation/healthcare-datamodel-3131",
    "version": "3.1.31"
  },
  {
    "title": "GS1 Healthcare - Maximum Humidity Percentage",
    "content": "GS1 Benelux Healthcare Datamodel - Attribuut: Maximum Humidity Percentage\n\n**Identificatie**\n- Attribuutnaam (EN): Maximum Humidity Percentage\n- Business naam: nan\n- BMS ID: 3643\n\n**Definitie**\nThe maximum humidity in percentages that the goods should be stored in.\n\n**Invulinstructie**\n(See regulatory mapping tab)\n\n**Voorbeeld**\n0.7\n\nBron: GS1 Benelux Healthcare Datamodel (ECHO)\nURL: https://www.gs1belu.org/en/documentation/healthcare-datamodel-3131",
    "source_type": "gs1_nl_datamodel",
    "sector": "Healthcare",
    "attribute_name_en": "Maximum Humidity Percentage",
    "business_name": "nan",
    "bms_id": "3643",
    "url": "https://www.gs1belu.org/en/documentation/healthcare-datamodel-3131",
    "version": "3.1.31"
  },
  {
    "title": "GS1 Healthcare - Minimum Humidity Percentage",
    "content": "GS1 Benelux Healthcare Datamodel - Attribuut: Minimum Humidity Percentage\n\n**Identificatie**\n- Attribuutnaam (EN): Minimum Humidity Percentage\n- Business naam: nan\n- BMS ID: 3644\n\n**Definitie**\nThe minimum humidity in percentages that the goods should be stored in.\n\n**Invulinstructie**\n(See regulatory mapping tab)\n\n**Voorbeeld**\n0.2\n\nBron: GS1 Benelux Healthcare Datamodel (ECHO)\nURL: https://www.gs1belu.org/en/documentation/healthcare-datamodel-3131",
    "source_type": "gs1_nl_datamodel",
    "sector": "Healthcare",
    "attribute_name_en": "Minimum Humidity Percentage",
    "business_name": "nan",
    "bms_id": "3644",
    "url": "https://www.gs1belu.org/en/documentation/healthcare-datamodel-3131",
    "version": "3.1.31"
  },
  {
    "title": "GS1 Healthcare - Consumer Storage Instructions",
    "content": "GS1 Benelux Healthcare Datamodel - Attribuut: Consumer Storage Instructions\n\n**Identificatie**\n- Attribuutnaam (EN): Consumer Storage Instructions\n- Business naam: Consumer Storage Instructions\n- BMS ID: 789\n\n**Definitie**\nExpresses in text the consumer storage instructions of a product which are normally held on the label or accompanying the product. This information may or may not be labeled on the pack. Instructions may refer to a suggested storage temperature, a specific storage requirement.\n\n**Business Definitie**\nThe instructions and information provided to the consumer about proper storage for the product.\n\n**Invulinstructie**\n(See regulatory mapping tab)\n\n**Voorbeeld**\nKeep in a dark, cool place. Do not expose to sunlight. \n\nBron: GS1 Benelux Healthcare Datamodel (ECHO)\nURL: https://www.gs1belu.org/en/documentation/healthcare-datamodel-3131",
    "source_type": "gs1_nl_datamodel",
    "sector": "Healthcare",
    "attribute_name_en": "Consumer Storage Instructions",
    "business_name": "Consumer Storage Instructions",
    "bms_id": "789",
    "url": "https://www.gs1belu.org/en/documentation/healthcare-datamodel-3131",
    "version": "3.1.31"
  },
  {
    "title": "GS1 Healthcare - Certification Standard",
    "content": "GS1 Benelux Healthcare Datamodel - Attribuut: Certification Standard\n\n**Identificatie**\n- Attribuutnaam (EN): Certification Standard\n- Business naam: nan\n- BMS ID: 667\n\n**Definitie**\nThe name of the certification standard or the type of certification, e.g. product, process, company, packaging or conformity.\n\n**Invulinstructie**\n(See regulatory mapping tab)\n\n**Voorbeeld**\nCE marking\n\nBron: GS1 Benelux Healthcare Datamodel (ECHO)\nURL: https://www.gs1belu.org/en/documentation/healthcare-datamodel-3131",
    "source_type": "gs1_nl_datamodel",
    "sector": "Healthcare",
    "attribute_name_en": "Certification Standard",
    "business_name": "nan",
    "bms_id": "667",
    "url": "https://www.gs1belu.org/en/documentation/healthcare-datamodel-3131",
    "version": "3.1.31"
  },
  {
    "title": "GS1 Healthcare - Certification Identification",
    "content": "GS1 Benelux Healthcare Datamodel - Attribuut: Certification Identification\n\n**Identificatie**\n- Attribuutnaam (EN): Certification Identification\n- Business naam: nan\n- BMS ID: 684\n\n**Definitie**\nA reference issued to confirm that something has passed certification.\n\n**Invulinstructie**\n(See regulatory mapping tab)\n\n**Voorbeeld**\nContact CertificationAgency for confirmation\n\nBron: GS1 Benelux Healthcare Datamodel (ECHO)\nURL: https://www.gs1belu.org/en/documentation/healthcare-datamodel-3131",
    "source_type": "gs1_nl_datamodel",
    "sector": "Healthcare",
    "attribute_name_en": "Certification Identification",
    "business_name": "nan",
    "bms_id": "684",
    "url": "https://www.gs1belu.org/en/documentation/healthcare-datamodel-3131",
    "version": "3.1.31"
  },
  {
    "title": "GS1 Healthcare - Global Model Number",
    "content": "GS1 Benelux Healthcare Datamodel - Attribuut: Global Model Number\n\n**Identificatie**\n- Attribuutnaam (EN): Global Model Number\n- Business naam: nan\n- BMS ID: 6399\n\n**Definitie**\nThe GS1 Global Model Number (GMN) is the GS1 identification key used to identify a product model or product family based on attributes common to the model or family as defined by industry or regulation. This GS1 identification key, once assigned to one product model or product family, SHALL NOT be reissued to another. The GMN SHALL NOT be used to identify a trade item.\n\n**Invulinstructie**\n(See regulatory mapping tab)\n\n**Voorbeeld**\n872003953HF-236PX6\n\nBron: GS1 Benelux Healthcare Datamodel (ECHO)\nURL: https://www.gs1belu.org/en/documentation/healthcare-datamodel-3131",
    "source_type": "gs1_nl_datamodel",
    "sector": "Healthcare",
    "attribute_name_en": "Global Model Number",
    "business_name": "nan",
    "bms_id": "6399",
    "url": "https://www.gs1belu.org/en/documentation/healthcare-datamodel-3131",
    "version": "3.1.31"
  },
  {
    "title": "GS1 Healthcare - Is Active Device",
    "content": "GS1 Benelux Healthcare Datamodel - Attribuut: Is Active Device\n\n**Identificatie**\n- Attribuutnaam (EN): Is Active Device\n- Business naam: nan\n- BMS ID: 6347\n\n**Definitie**\nIndication if the Basic UDI-DI (Global Model Number) is an Active device. 'Active' means any device, the operation of which depends on a source of energy other than that generated by the human body for that purpose, or by gravity, and which acts by changing the density of or converting that energy.  Devices intended to transmit energy, substances or other elements between an active device and the patient, without any significant change, shall not be deemed to be active devices. Software shall also be deemed to be an active device.\n\n**Invulinstructie**\n(See regulatory mapping tab)\n\n**Voorbeeld**\ntrue\n\nBron: GS1 Benelux Healthcare Datamodel (ECHO)\nURL: https://www.gs1belu.org/en/documentation/healthcare-datamodel-3131",
    "source_type": "gs1_nl_datamodel",
    "sector": "Healthcare",
    "attribute_name_en": "Is Active Device",
    "business_name": "nan",
    "bms_id": "6347",
    "url": "https://www.gs1belu.org/en/documentation/healthcare-datamodel-3131",
    "version": "3.1.31"
  },
  {
    "title": "GS1 Healthcare - Is Device Intended To Administer Or Remove Medicinal Product\n",
    "content": "GS1 Benelux Healthcare Datamodel - Attribuut: Is Device Intended To Administer Or Remove Medicinal Product\n\n\n**Identificatie**\n- Attribuutnaam (EN): Is Device Intended To Administer Or Remove Medicinal Product\n\n- Business naam: nan\n- BMS ID: 6352\n\n**Definitie**\nIndication the device is intended to administer or remove medicinal product.\n\n**Invulinstructie**\n(See regulatory mapping tab)\n\n**Voorbeeld**\nfalse\n\nBron: GS1 Benelux Healthcare Datamodel (ECHO)\nURL: https://www.gs1belu.org/en/documentation/healthcare-datamodel-3131",
    "source_type": "gs1_nl_datamodel",
    "sector": "Healthcare",
    "attribute_name_en": "Is Device Intended To Administer Or Remove Medicinal Product\n",
    "business_name": "nan",
    "bms_id": "6352",
    "url": "https://www.gs1belu.org/en/documentation/healthcare-datamodel-3131",
    "version": "3.1.31"
  },
  {
    "title": "GS1 Healthcare - Does Trade Item Contain Animal Tissue",
    "content": "GS1 Benelux Healthcare Datamodel - Attribuut: Does Trade Item Contain Animal Tissue\n\n**Identificatie**\n- Attribuutnaam (EN): Does Trade Item Contain Animal Tissue\n- Business naam: nan\n- BMS ID: 6384\n\n**Definitie**\nIndication the product has presence of animal tissues or cells or their derivates.\n\n**Invulinstructie**\n(See regulatory mapping tab)\n\n**Voorbeeld**\ntrue\n\nBron: GS1 Benelux Healthcare Datamodel (ECHO)\nURL: https://www.gs1belu.org/en/documentation/healthcare-datamodel-3131",
    "source_type": "gs1_nl_datamodel",
    "sector": "Healthcare",
    "attribute_name_en": "Does Trade Item Contain Animal Tissue",
    "business_name": "nan",
    "bms_id": "6384",
    "url": "https://www.gs1belu.org/en/documentation/healthcare-datamodel-3131",
    "version": "3.1.31"
  },
  {
    "title": "GS1 Healthcare - Does Trade Item Contain Microbial Substance",
    "content": "GS1 Benelux Healthcare Datamodel - Attribuut: Does Trade Item Contain Microbial Substance\n\n**Identificatie**\n- Attribuutnaam (EN): Does Trade Item Contain Microbial Substance\n- Business naam: nan\n- BMS ID: 6383\n\n**Definitie**\nIndication the product contains substances of microbial origin.\n\n**Invulinstructie**\n(See regulatory mapping tab)\n\n**Voorbeeld**\nfalse\n\nBron: GS1 Benelux Healthcare Datamodel (ECHO)\nURL: https://www.gs1belu.org/en/documentation/healthcare-datamodel-3131",
    "source_type": "gs1_nl_datamodel",
    "sector": "Healthcare",
    "attribute_name_en": "Does Trade Item Contain Microbial Substance",
    "business_name": "nan",
    "bms_id": "6383",
    "url": "https://www.gs1belu.org/en/documentation/healthcare-datamodel-3131",
    "version": "3.1.31"
  },
  {
    "title": "GS1 Healthcare - Is Device Medicinal Product",
    "content": "GS1 Benelux Healthcare Datamodel - Attribuut: Is Device Medicinal Product\n\n**Identificatie**\n- Attribuutnaam (EN): Is Device Medicinal Product\n- Business naam: nan\n- BMS ID: 6353\n\n**Definitie**\nIndication the device contains substances which may be considered medicinal product.\n\n\n**Invulinstructie**\n(See regulatory mapping tab)\n\n**Voorbeeld**\ntrue\n\nBron: GS1 Benelux Healthcare Datamodel (ECHO)\nURL: https://www.gs1belu.org/en/documentation/healthcare-datamodel-3131",
    "source_type": "gs1_nl_datamodel",
    "sector": "Healthcare",
    "attribute_name_en": "Is Device Medicinal Product",
    "business_name": "nan",
    "bms_id": "6353",
    "url": "https://www.gs1belu.org/en/documentation/healthcare-datamodel-3131",
    "version": "3.1.31"
  },
  {
    "title": "GS1 Healthcare - Does Trade Item Contain Human Blood Derivative",
    "content": "GS1 Benelux Healthcare Datamodel - Attribuut: Does Trade Item Contain Human Blood Derivative\n\n**Identificatie**\n- Attribuutnaam (EN): Does Trade Item Contain Human Blood Derivative\n- Business naam: nan\n- BMS ID: 1433\n\n**Definitie**\nThe use of this attribute indicates that the trade item is a product that contains blood, blood components or blood products used in the manufacturing.\n\n\n**Invulinstructie**\n(See regulatory mapping tab)\n\n**Voorbeeld**\nFALSE\n\nBron: GS1 Benelux Healthcare Datamodel (ECHO)\nURL: https://www.gs1belu.org/en/documentation/healthcare-datamodel-3131",
    "source_type": "gs1_nl_datamodel",
    "sector": "Healthcare",
    "attribute_name_en": "Does Trade Item Contain Human Blood Derivative",
    "business_name": "nan",
    "bms_id": "1433",
    "url": "https://www.gs1belu.org/en/documentation/healthcare-datamodel-3131",
    "version": "3.1.31"
  },
  {
    "title": "GS1 Healthcare - Is Reprocessed Single Use Device",
    "content": "GS1 Benelux Healthcare Datamodel - Attribuut: Is Reprocessed Single Use Device\n\n**Identificatie**\n- Attribuutnaam (EN): Is Reprocessed Single Use Device\n- Business naam: nan\n- BMS ID: 6358\n\n**Definitie**\nIndication the device is a single use device which has been Reprocessed. Rules for reprocessing are governed by local market regulations.\n\n**Invulinstructie**\n(See regulatory mapping tab)\n\n**Voorbeeld**\ntrue\n\nBron: GS1 Benelux Healthcare Datamodel (ECHO)\nURL: https://www.gs1belu.org/en/documentation/healthcare-datamodel-3131",
    "source_type": "gs1_nl_datamodel",
    "sector": "Healthcare",
    "attribute_name_en": "Is Reprocessed Single Use Device",
    "business_name": "nan",
    "bms_id": "6358",
    "url": "https://www.gs1belu.org/en/documentation/healthcare-datamodel-3131",
    "version": "3.1.31"
  },
  {
    "title": "GS1 Healthcare - Is Device Reagent",
    "content": "GS1 Benelux Healthcare Datamodel - Attribuut: Is Device Reagent\n\n**Identificatie**\n- Attribuutnaam (EN): Is Device Reagent\n- Business naam: nan\n- BMS ID: 6348\n\n**Definitie**\nIndication the device is a reagent.\n\n**Invulinstructie**\n(See regulatory mapping tab)\n\n**Voorbeeld**\ntrue\n\nBron: GS1 Benelux Healthcare Datamodel (ECHO)\nURL: https://www.gs1belu.org/en/documentation/healthcare-datamodel-3131",
    "source_type": "gs1_nl_datamodel",
    "sector": "Healthcare",
    "attribute_name_en": "Is Device Reagent",
    "business_name": "nan",
    "bms_id": "6348",
    "url": "https://www.gs1belu.org/en/documentation/healthcare-datamodel-3131",
    "version": "3.1.31"
  },
  {
    "title": "GS1 Healthcare - Is Device Companion Diagnostic",
    "content": "GS1 Benelux Healthcare Datamodel - Attribuut: Is Device Companion Diagnostic\n\n**Identificatie**\n- Attribuutnaam (EN): Is Device Companion Diagnostic\n- Business naam: nan\n- BMS ID: 6349\n\n**Definitie**\nIndication the device has a role as a Companion Diagnostic.\n'Companion diagnostic’ means a device which is essential for the safe and effective use of a corresponding medicinal product to:\n- identify, before and/or during treatment, patients who are most likely to benefit from the corresponding medicinal product\n- identify, before and/or during treatment, patients likely to be at increased risk of serious adverse reactions as a result of treatment with the corresponding medicinal product.\n\n**Invulinstructie**\n(See regulatory mapping tab)\n\n**Voorbeeld**\ntrue\n\nBron: GS1 Benelux Healthcare Datamodel (ECHO)\nURL: https://www.gs1belu.org/en/documentation/healthcare-datamodel-3131",
    "source_type": "gs1_nl_datamodel",
    "sector": "Healthcare",
    "attribute_name_en": "Is Device Companion Diagnostic",
    "business_name": "nan",
    "bms_id": "6349",
    "url": "https://www.gs1belu.org/en/documentation/healthcare-datamodel-3131",
    "version": "3.1.31"
  },
  {
    "title": "GS1 Healthcare - Is Device Designed For Professional Testing",
    "content": "GS1 Benelux Healthcare Datamodel - Attribuut: Is Device Designed For Professional Testing\n\n**Identificatie**\n- Attribuutnaam (EN): Is Device Designed For Professional Testing\n- Business naam: nan\n- BMS ID: 6350\n\n**Definitie**\nIndication the device is designed to be used for Professional Testing. Professional testing are tests to be conducted by a medical professional and not by a patient themselves.\n\n**Invulinstructie**\n(See regulatory mapping tab)\n\n**Voorbeeld**\ntrue\n\nBron: GS1 Benelux Healthcare Datamodel (ECHO)\nURL: https://www.gs1belu.org/en/documentation/healthcare-datamodel-3131",
    "source_type": "gs1_nl_datamodel",
    "sector": "Healthcare",
    "attribute_name_en": "Is Device Designed For Professional Testing",
    "business_name": "nan",
    "bms_id": "6350",
    "url": "https://www.gs1belu.org/en/documentation/healthcare-datamodel-3131",
    "version": "3.1.31"
  },
  {
    "title": "GS1 Healthcare - Is Device Instrument",
    "content": "GS1 Benelux Healthcare Datamodel - Attribuut: Is Device Instrument\n\n**Identificatie**\n- Attribuutnaam (EN): Is Device Instrument\n- Business naam: nan\n- BMS ID: 6351\n\n**Definitie**\nIndication the device is an Instrument to be used in a procedure.\n\n**Invulinstructie**\n(See regulatory mapping tab)\n\n**Voorbeeld**\ntrue\n\nBron: GS1 Benelux Healthcare Datamodel (ECHO)\nURL: https://www.gs1belu.org/en/documentation/healthcare-datamodel-3131",
    "source_type": "gs1_nl_datamodel",
    "sector": "Healthcare",
    "attribute_name_en": "Is Device Instrument",
    "business_name": "nan",
    "bms_id": "6351",
    "url": "https://www.gs1belu.org/en/documentation/healthcare-datamodel-3131",
    "version": "3.1.31"
  },
  {
    "title": "GS1 Healthcare - Is Device Near Patient Testing",
    "content": "GS1 Benelux Healthcare Datamodel - Attribuut: Is Device Near Patient Testing\n\n**Identificatie**\n- Attribuutnaam (EN): Is Device Near Patient Testing\n- Business naam: nan\n- BMS ID: 6354\n\n**Definitie**\nIndication the device is for Near Patient testing. 'Device for near-patient testing’ means the device is not intended for self-testing but is intended to perform testing outside a laboratory environment, generally near to, or at the side of, the patient by a health professional.\n\n**Invulinstructie**\n(See regulatory mapping tab)\n\n**Voorbeeld**\ntrue\n\nBron: GS1 Benelux Healthcare Datamodel (ECHO)\nURL: https://www.gs1belu.org/en/documentation/healthcare-datamodel-3131",
    "source_type": "gs1_nl_datamodel",
    "sector": "Healthcare",
    "attribute_name_en": "Is Device Near Patient Testing",
    "business_name": "nan",
    "bms_id": "6354",
    "url": "https://www.gs1belu.org/en/documentation/healthcare-datamodel-3131",
    "version": "3.1.31"
  },
  {
    "title": "GS1 Healthcare - Is Device Patient Self Testing",
    "content": "GS1 Benelux Healthcare Datamodel - Attribuut: Is Device Patient Self Testing\n\n**Identificatie**\n- Attribuutnaam (EN): Is Device Patient Self Testing\n- Business naam: nan\n- BMS ID: 6355\n\n**Definitie**\nIndication the device is for self patient testing. 'Device for self-testing’ means any device intended by the manufacturer to be used by lay persons, including devices used for testing services offered to lay persons by means of information society services.\n\n**Invulinstructie**\n(See regulatory mapping tab)\n\n**Voorbeeld**\ntrue\n\nBron: GS1 Benelux Healthcare Datamodel (ECHO)\nURL: https://www.gs1belu.org/en/documentation/healthcare-datamodel-3131",
    "source_type": "gs1_nl_datamodel",
    "sector": "Healthcare",
    "attribute_name_en": "Is Device Patient Self Testing",
    "business_name": "nan",
    "bms_id": "6355",
    "url": "https://www.gs1belu.org/en/documentation/healthcare-datamodel-3131",
    "version": "3.1.31"
  },
  {
    "title": "GS1 Healthcare - Is New Device",
    "content": "GS1 Benelux Healthcare Datamodel - Attribuut: Is New Device\n\n**Identificatie**\n- Attribuutnaam (EN): Is New Device\n- Business naam: nan\n- BMS ID: 6357\n\n**Definitie**\nIndication that the product is considered a new device in the European Union market. A device shall be considered to be ‘new’ if: (a) there has been no such device continuously available on the EU market during the previous three years for the relevant analyte or other parameter; (b) the procedure involves analytical technology not continuously used in connection with a given analyte or other parameter on the Union market during the previous three years. EU IVDR Annex VI a 2.13 \n\n**Invulinstructie**\n(See regulatory mapping tab)\n\n**Voorbeeld**\ntrue\n\nBron: GS1 Benelux Healthcare Datamodel (ECHO)\nURL: https://www.gs1belu.org/en/documentation/healthcare-datamodel-3131",
    "source_type": "gs1_nl_datamodel",
    "sector": "Healthcare",
    "attribute_name_en": "Is New Device",
    "business_name": "nan",
    "bms_id": "6357",
    "url": "https://www.gs1belu.org/en/documentation/healthcare-datamodel-3131",
    "version": "3.1.31"
  },
  {
    "title": "GS1 Healthcare - System Or Procedure Pack Medical Purpose Description",
    "content": "GS1 Benelux Healthcare Datamodel - Attribuut: System Or Procedure Pack Medical Purpose Description\n\n**Identificatie**\n- Attribuutnaam (EN): System Or Procedure Pack Medical Purpose Description\n- Business naam: nan\n- BMS ID: 6365\n\n**Definitie**\nDescriptive terms to denote the Medical Purpose of the System or Procedure Pack. Applicable for System and Procedure Packs and refers to the indication of the specific medical purpose of the System or Procedure Pack.\n\n**Invulinstructie**\n(See regulatory mapping tab)\n\n**Voorbeeld**\nThe medical purpose of the procedure pack is to (…)\n\nBron: GS1 Benelux Healthcare Datamodel (ECHO)\nURL: https://www.gs1belu.org/en/documentation/healthcare-datamodel-3131",
    "source_type": "gs1_nl_datamodel",
    "sector": "Healthcare",
    "attribute_name_en": "System Or Procedure Pack Medical Purpose Description",
    "business_name": "nan",
    "bms_id": "6365",
    "url": "https://www.gs1belu.org/en/documentation/healthcare-datamodel-3131",
    "version": "3.1.31"
  },
  {
    "title": "GS1 Healthcare - System Or Procedure Pack Type Code",
    "content": "GS1 Benelux Healthcare Datamodel - Attribuut: System Or Procedure Pack Type Code\n\n**Identificatie**\n- Attribuutnaam (EN): System Or Procedure Pack Type Code\n- Business naam: nan\n- BMS ID: 6362\n\n**Definitie**\nThe Medical Device is a System or Procedure Pack as defined by Target Market rules. \n\n**Invulinstructie**\n(See regulatory mapping tab)\n\n**Voorbeeld**\nSYSTEM\n\nBron: GS1 Benelux Healthcare Datamodel (ECHO)\nURL: https://www.gs1belu.org/en/documentation/healthcare-datamodel-3131",
    "source_type": "gs1_nl_datamodel",
    "sector": "Healthcare",
    "attribute_name_en": "System Or Procedure Pack Type Code",
    "business_name": "nan",
    "bms_id": "6362",
    "url": "https://www.gs1belu.org/en/documentation/healthcare-datamodel-3131",
    "version": "3.1.31"
  },
  {
    "title": "GS1 Healthcare - Multi Component Device Type Code",
    "content": "GS1 Benelux Healthcare Datamodel - Attribuut: Multi Component Device Type Code\n\n**Identificatie**\n- Attribuutnaam (EN): Multi Component Device Type Code\n- Business naam: nan\n- BMS ID: 6360\n\n**Definitie**\nThe device is either a system which is a device in itself, a procedure pack which is a device in itself or kit (only applicable in case of IVDR Devices). This is a applicable for standard devices (not systems or procedure packs). For example in the EU (in accordance with the Art. 22(4) MDR).\n\n**Invulinstructie**\n(See regulatory mapping tab)\n\n**Voorbeeld**\nPROCEDURE_PACK\n\nBron: GS1 Benelux Healthcare Datamodel (ECHO)\nURL: https://www.gs1belu.org/en/documentation/healthcare-datamodel-3131",
    "source_type": "gs1_nl_datamodel",
    "sector": "Healthcare",
    "attribute_name_en": "Multi Component Device Type Code",
    "business_name": "nan",
    "bms_id": "6360",
    "url": "https://www.gs1belu.org/en/documentation/healthcare-datamodel-3131",
    "version": "3.1.31"
  },
  {
    "title": "GS1 Healthcare - Special Device Type Code",
    "content": "GS1 Benelux Healthcare Datamodel - Attribuut: Special Device Type Code\n\n**Identificatie**\n- Attribuutnaam (EN): Special Device Type Code\n- Business naam: nan\n- BMS ID: 6361\n\n**Definitie**\nThe type of special medical device the product is. Example: Orthopaedic, Rigid Gas Permeable (RGP) & Made-to-Order Soft Contact Lenses, Software\n\n**Invulinstructie**\n(See regulatory mapping tab)\n\n**Voorbeeld**\nORTHOPAEDIC\n\nBron: GS1 Benelux Healthcare Datamodel (ECHO)\nURL: https://www.gs1belu.org/en/documentation/healthcare-datamodel-3131",
    "source_type": "gs1_nl_datamodel",
    "sector": "Healthcare",
    "attribute_name_en": "Special Device Type Code",
    "business_name": "nan",
    "bms_id": "6361",
    "url": "https://www.gs1belu.org/en/documentation/healthcare-datamodel-3131",
    "version": "3.1.31"
  },
  {
    "title": "GS1 Healthcare - Annex X V I Intended Purpose Type Code",
    "content": "GS1 Benelux Healthcare Datamodel - Attribuut: Annex X V I Intended Purpose Type Code\n\n**Identificatie**\n- Attribuutnaam (EN): Annex X V I Intended Purpose Type Code\n- Business naam: nan\n- BMS ID: 6345\n\n**Definitie**\nAll intended purposes other than for medical uses which apply to the product (EUDAMED Annex XVI).\n\n**Invulinstructie**\n(See regulatory mapping tab)\n\n**Voorbeeld**\nPRODUCT_IN_BODY\n\nBron: GS1 Benelux Healthcare Datamodel (ECHO)\nURL: https://www.gs1belu.org/en/documentation/healthcare-datamodel-3131",
    "source_type": "gs1_nl_datamodel",
    "sector": "Healthcare",
    "attribute_name_en": "Annex X V I Intended Purpose Type Code",
    "business_name": "nan",
    "bms_id": "6345",
    "url": "https://www.gs1belu.org/en/documentation/healthcare-datamodel-3131",
    "version": "3.1.31"
  },
  {
    "title": "GS1 Healthcare - EU Medical Device Status Code",
    "content": "GS1 Benelux Healthcare Datamodel - Attribuut: EU Medical Device Status Code\n\n**Identificatie**\n- Attribuutnaam (EN): EU Medical Device Status Code\n- Business naam: nan\n- BMS ID: 6363\n\n**Definitie**\nThe market status of the medical device for the EU Market. Example: On the Market, No Longer Placed on the Market.\n\n**Invulinstructie**\n(See regulatory mapping tab)\n\n**Voorbeeld**\nNO_LONGER_PLACED_ON_MARKET\n\nBron: GS1 Benelux Healthcare Datamodel (ECHO)\nURL: https://www.gs1belu.org/en/documentation/healthcare-datamodel-3131",
    "source_type": "gs1_nl_datamodel",
    "sector": "Healthcare",
    "attribute_name_en": "EU Medical Device Status Code",
    "business_name": "nan",
    "bms_id": "6363",
    "url": "https://www.gs1belu.org/en/documentation/healthcare-datamodel-3131",
    "version": "3.1.31"
  },
  {
    "title": "GS1 Healthcare - EU Medical Device Sub Status Code",
    "content": "GS1 Benelux Healthcare Datamodel - Attribuut: EU Medical Device Sub Status Code\n\n**Identificatie**\n- Attribuutnaam (EN): EU Medical Device Sub Status Code\n- Business naam: nan\n- BMS ID: 6370\n\n**Definitie**\nThe market sub-status of the medical device for the EU Market. Example:  Field Safety Corrective Action (FSCA), Recall.\n\n**Invulinstructie**\n(See regulatory mapping tab)\n\n**Voorbeeld**\nRECALLED\n\nBron: GS1 Benelux Healthcare Datamodel (ECHO)\nURL: https://www.gs1belu.org/en/documentation/healthcare-datamodel-3131",
    "source_type": "gs1_nl_datamodel",
    "sector": "Healthcare",
    "attribute_name_en": "EU Medical Device Sub Status Code",
    "business_name": "nan",
    "bms_id": "6370",
    "url": "https://www.gs1belu.org/en/documentation/healthcare-datamodel-3131",
    "version": "3.1.31"
  },
  {
    "title": "GS1 Healthcare - Device Sub Status End Date Time",
    "content": "GS1 Benelux Healthcare Datamodel - Attribuut: Device Sub Status End Date Time\n\n**Identificatie**\n- Attribuutnaam (EN): Device Sub Status End Date Time\n- Business naam: nan\n- BMS ID: 6368\n\n**Definitie**\nThe date time when the sub-status of the medical device ends for the EU Market.\n\n**Invulinstructie**\n(See regulatory mapping tab)\n\n**Voorbeeld**\n2025-03-13T00:00:00\n\nBron: GS1 Benelux Healthcare Datamodel (ECHO)\nURL: https://www.gs1belu.org/en/documentation/healthcare-datamodel-3131",
    "source_type": "gs1_nl_datamodel",
    "sector": "Healthcare",
    "attribute_name_en": "Device Sub Status End Date Time",
    "business_name": "nan",
    "bms_id": "6368",
    "url": "https://www.gs1belu.org/en/documentation/healthcare-datamodel-3131",
    "version": "3.1.31"
  },
  {
    "title": "GS1 Healthcare - Device Sub Status Start Date Time",
    "content": "GS1 Benelux Healthcare Datamodel - Attribuut: Device Sub Status Start Date Time\n\n**Identificatie**\n- Attribuutnaam (EN): Device Sub Status Start Date Time\n- Business naam: nan\n- BMS ID: 6369\n\n**Definitie**\nThe date time when the sub-status of the medical device begins for the EU Market.\n\n**Invulinstructie**\n(See regulatory mapping tab)\n\n**Voorbeeld**\n2023-05-13T00:00:00\n\nBron: GS1 Benelux Healthcare Datamodel (ECHO)\nURL: https://www.gs1belu.org/en/documentation/healthcare-datamodel-3131",
    "source_type": "gs1_nl_datamodel",
    "sector": "Healthcare",
    "attribute_name_en": "Device Sub Status Start Date Time",
    "business_name": "nan",
    "bms_id": "6369",
    "url": "https://www.gs1belu.org/en/documentation/healthcare-datamodel-3131",
    "version": "3.1.31"
  },
  {
    "title": "GS1 Healthcare - Referenced Trade Item Type Code",
    "content": "GS1 Benelux Healthcare Datamodel - Attribuut: Referenced Trade Item Type Code\n\n**Identificatie**\n- Attribuutnaam (EN): Referenced Trade Item Type Code\n- Business naam: nan\n- BMS ID: 6162\n\n**Definitie**\nA code depicting the type of trade item that is referenced for a specific purpose for example substitute, replaced by, equivalent trade items.\n\n**Invulinstructie**\n(See regulatory mapping tab)\n\n**Voorbeeld**\nREPLACED\n\nBron: GS1 Benelux Healthcare Datamodel (ECHO)\nURL: https://www.gs1belu.org/en/documentation/healthcare-datamodel-3131",
    "source_type": "gs1_nl_datamodel",
    "sector": "Healthcare",
    "attribute_name_en": "Referenced Trade Item Type Code",
    "business_name": "nan",
    "bms_id": "6162",
    "url": "https://www.gs1belu.org/en/documentation/healthcare-datamodel-3131",
    "version": "3.1.31"
  },
  {
    "title": "GS1 Healthcare - Additional Trade Item Identification",
    "content": "GS1 Benelux Healthcare Datamodel - Attribuut: Additional Trade Item Identification\n\n**Identificatie**\n- Attribuutnaam (EN): Additional Trade Item Identification\n- Business naam: nan\n- BMS ID: 6163\n\n**Definitie**\nAlternative means to the Global Trade Item Number to identify a trade item.\n\n**Invulinstructie**\n(See regulatory mapping tab)\n\n**Voorbeeld**\n+H123AC-L12345#1234\n\nBron: GS1 Benelux Healthcare Datamodel (ECHO)\nURL: https://www.gs1belu.org/en/documentation/healthcare-datamodel-3131",
    "source_type": "gs1_nl_datamodel",
    "sector": "Healthcare",
    "attribute_name_en": "Additional Trade Item Identification",
    "business_name": "nan",
    "bms_id": "6163",
    "url": "https://www.gs1belu.org/en/documentation/healthcare-datamodel-3131",
    "version": "3.1.31"
  },
  {
    "title": "GS1 Healthcare - Additional Trade Item Identification Type Code",
    "content": "GS1 Benelux Healthcare Datamodel - Attribuut: Additional Trade Item Identification Type Code\n\n**Identificatie**\n- Attribuutnaam (EN): Additional Trade Item Identification Type Code\n- Business naam: nan\n- BMS ID: 6164\n\n**Definitie**\nThis code will be used to cross-reference the Vendors internal trade item number to the GTIN in a one to one relationship.\n\n**Invulinstructie**\n(See regulatory mapping tab)\n\n**Voorbeeld**\nHIBC\n\nBron: GS1 Benelux Healthcare Datamodel (ECHO)\nURL: https://www.gs1belu.org/en/documentation/healthcare-datamodel-3131",
    "source_type": "gs1_nl_datamodel",
    "sector": "Healthcare",
    "attribute_name_en": "Additional Trade Item Identification Type Code",
    "business_name": "nan",
    "bms_id": "6164",
    "url": "https://www.gs1belu.org/en/documentation/healthcare-datamodel-3131",
    "version": "3.1.31"
  },
  {
    "title": "GS1 Healthcare - Regulated Chemical Description",
    "content": "GS1 Benelux Healthcare Datamodel - Attribuut: Regulated Chemical Description\n\n**Identificatie**\n- Attribuutnaam (EN): Regulated Chemical Description\n- Business naam: nan\n- BMS ID: 727\n\n**Definitie**\nA text description of the regulated chemical or formula.\n\n**Invulinstructie**\n(See regulatory mapping tab)\n\n**Voorbeeld**\nChlorobenzene\n\nBron: GS1 Benelux Healthcare Datamodel (ECHO)\nURL: https://www.gs1belu.org/en/documentation/healthcare-datamodel-3131",
    "source_type": "gs1_nl_datamodel",
    "sector": "Healthcare",
    "attribute_name_en": "Regulated Chemical Description",
    "business_name": "nan",
    "bms_id": "727",
    "url": "https://www.gs1belu.org/en/documentation/healthcare-datamodel-3131",
    "version": "3.1.31"
  },
  {
    "title": "GS1 Healthcare - Regulated Chemical Name",
    "content": "GS1 Benelux Healthcare Datamodel - Attribuut: Regulated Chemical Name\n\n**Identificatie**\n- Attribuutnaam (EN): Regulated Chemical Name\n- Business naam: nan\n- BMS ID: 729\n\n**Definitie**\nThe name of a chemical regulated by a chemical regulation or agency.\n\n**Invulinstructie**\n(See regulatory mapping tab)\n\n**Voorbeeld**\nChlorobenzene\n\nBron: GS1 Benelux Healthcare Datamodel (ECHO)\nURL: https://www.gs1belu.org/en/documentation/healthcare-datamodel-3131",
    "source_type": "gs1_nl_datamodel",
    "sector": "Healthcare",
    "attribute_name_en": "Regulated Chemical Name",
    "business_name": "nan",
    "bms_id": "729",
    "url": "https://www.gs1belu.org/en/documentation/healthcare-datamodel-3131",
    "version": "3.1.31"
  },
  {
    "title": "GS1 Healthcare - Regulated Chemical Identifier Code Reference",
    "content": "GS1 Benelux Healthcare Datamodel - Attribuut: Regulated Chemical Identifier Code Reference\n\n**Identificatie**\n- Attribuutnaam (EN): Regulated Chemical Identifier Code Reference\n- Business naam: nan\n- BMS ID: 734\n\n**Definitie**\nAn identifier for a regulated chemical for example a CAS number.\n\n**Invulinstructie**\n(See regulatory mapping tab)\n\n**Voorbeeld**\n108-90-7\n\nBron: GS1 Benelux Healthcare Datamodel (ECHO)\nURL: https://www.gs1belu.org/en/documentation/healthcare-datamodel-3131",
    "source_type": "gs1_nl_datamodel",
    "sector": "Healthcare",
    "attribute_name_en": "Regulated Chemical Identifier Code Reference",
    "business_name": "nan",
    "bms_id": "734",
    "url": "https://www.gs1belu.org/en/documentation/healthcare-datamodel-3131",
    "version": "3.1.31"
  },
  {
    "title": "GS1 Healthcare - Regulated Chemical Type Code",
    "content": "GS1 Benelux Healthcare Datamodel - Attribuut: Regulated Chemical Type Code\n\n**Identificatie**\n- Attribuutnaam (EN): Regulated Chemical Type Code\n- Business naam: nan\n- BMS ID: 6386\n\n**Definitie**\nThe type of regulated chemical as defined by the regulatory agency. Example Endocrine Substance, Human Product, Medicine Product.\n\n**Invulinstructie**\n(See regulatory mapping tab)\n\n**Voorbeeld**\nHUMAN_PRODUCT\n\nBron: GS1 Benelux Healthcare Datamodel (ECHO)\nURL: https://www.gs1belu.org/en/documentation/healthcare-datamodel-3131",
    "source_type": "gs1_nl_datamodel",
    "sector": "Healthcare",
    "attribute_name_en": "Regulated Chemical Type Code",
    "business_name": "nan",
    "bms_id": "6386",
    "url": "https://www.gs1belu.org/en/documentation/healthcare-datamodel-3131",
    "version": "3.1.31"
  },
  {
    "title": "GS1 Healthcare - Chemical Code List Agency Name",
    "content": "GS1 Benelux Healthcare Datamodel - Attribuut: Chemical Code List Agency Name\n\n**Identificatie**\n- Attribuutnaam (EN): Chemical Code List Agency Name\n- Business naam: nan\n- BMS ID: 738\n\n**Definitie**\nA name of the agency which manages the code list for example ISO.\n\n**Invulinstructie**\n(See regulatory mapping tab)\n\n**Voorbeeld**\n-\n\nBron: GS1 Benelux Healthcare Datamodel (ECHO)\nURL: https://www.gs1belu.org/en/documentation/healthcare-datamodel-3131",
    "source_type": "gs1_nl_datamodel",
    "sector": "Healthcare",
    "attribute_name_en": "Chemical Code List Agency Name",
    "business_name": "nan",
    "bms_id": "738",
    "url": "https://www.gs1belu.org/en/documentation/healthcare-datamodel-3131",
    "version": "3.1.31"
  },
  {
    "title": "GS1 Healthcare - Street Address",
    "content": "GS1 Benelux Healthcare Datamodel - Attribuut: Street Address\n\n**Identificatie**\n- Attribuutnaam (EN): Street Address\n- Business naam: nan\n- BMS ID: 5964\n\n**Definitie**\nThe street address expressed as free form text. The street address is printed on paper as the first lines below the name. For example, the name of the street and the number in the street or the name of a building.\n\n**Invulinstructie**\n(See regulatory mapping tab)\n\n**Voorbeeld**\nAmsterdamseweg\n\nBron: GS1 Benelux Healthcare Datamodel (ECHO)\nURL: https://www.gs1belu.org/en/documentation/healthcare-datamodel-3131",
    "source_type": "gs1_nl_datamodel",
    "sector": "Healthcare",
    "attribute_name_en": "Street Address",
    "business_name": "nan",
    "bms_id": "5964",
    "url": "https://www.gs1belu.org/en/documentation/healthcare-datamodel-3131",
    "version": "3.1.31"
  },
  {
    "title": "GS1 Healthcare - Street Number",
    "content": "GS1 Benelux Healthcare Datamodel - Attribuut: Street Number\n\n**Identificatie**\n- Attribuutnaam (EN): Street Number\n- Business naam: nan\n- BMS ID: 6509\n\n**Definitie**\nThe street number portion of the street address for the contact. \n\n**Invulinstructie**\n(See regulatory mapping tab)\n\n**Voorbeeld**\n206\n\nBron: GS1 Benelux Healthcare Datamodel (ECHO)\nURL: https://www.gs1belu.org/en/documentation/healthcare-datamodel-3131",
    "source_type": "gs1_nl_datamodel",
    "sector": "Healthcare",
    "attribute_name_en": "Street Number",
    "business_name": "nan",
    "bms_id": "6509",
    "url": "https://www.gs1belu.org/en/documentation/healthcare-datamodel-3131",
    "version": "3.1.31"
  },
  {
    "title": "GS1 Healthcare - City Name",
    "content": "GS1 Benelux Healthcare Datamodel - Attribuut: City Name\n\n**Identificatie**\n- Attribuutnaam (EN): City Name\n- Business naam: nan\n- BMS ID: 5960\n\n**Definitie**\nText specifying the name of the city.\n\n**Invulinstructie**\n(See regulatory mapping tab)\n\n**Voorbeeld**\nAmstelveen\n\nBron: GS1 Benelux Healthcare Datamodel (ECHO)\nURL: https://www.gs1belu.org/en/documentation/healthcare-datamodel-3131",
    "source_type": "gs1_nl_datamodel",
    "sector": "Healthcare",
    "attribute_name_en": "City Name",
    "business_name": "nan",
    "bms_id": "5960",
    "url": "https://www.gs1belu.org/en/documentation/healthcare-datamodel-3131",
    "version": "3.1.31"
  },
  {
    "title": "GS1 Healthcare - Postal Code",
    "content": "GS1 Benelux Healthcare Datamodel - Attribuut: Postal Code\n\n**Identificatie**\n- Attribuutnaam (EN): Postal Code\n- Business naam: nan\n- BMS ID: 5962\n\n**Definitie**\nText specifying the postal code for an address.\n\n**Invulinstructie**\n(See regulatory mapping tab)\n\n**Voorbeeld**\n1182 HL\n\nBron: GS1 Benelux Healthcare Datamodel (ECHO)\nURL: https://www.gs1belu.org/en/documentation/healthcare-datamodel-3131",
    "source_type": "gs1_nl_datamodel",
    "sector": "Healthcare",
    "attribute_name_en": "Postal Code",
    "business_name": "nan",
    "bms_id": "5962",
    "url": "https://www.gs1belu.org/en/documentation/healthcare-datamodel-3131",
    "version": "3.1.31"
  },
  {
    "title": "GS1 Healthcare - Complement Address",
    "content": "GS1 Benelux Healthcare Datamodel - Attribuut: Complement Address\n\n**Identificatie**\n- Attribuutnaam (EN): Complement Address\n- Business naam: nan\n- BMS ID: 6434\n\n**Definitie**\nThe complement address expressed as a free form text. The complement address is printed on paper as additional lines below the street address. For example, an industrial zone or apartment number. Required in case the PD Organisation link is provided (Product Designer Link relates to an Organisation)\n\n**Invulinstructie**\n(See regulatory mapping tab)\n\n**Voorbeeld**\nSecond floor\n\nBron: GS1 Benelux Healthcare Datamodel (ECHO)\nURL: https://www.gs1belu.org/en/documentation/healthcare-datamodel-3131",
    "source_type": "gs1_nl_datamodel",
    "sector": "Healthcare",
    "attribute_name_en": "Complement Address",
    "business_name": "nan",
    "bms_id": "6434",
    "url": "https://www.gs1belu.org/en/documentation/healthcare-datamodel-3131",
    "version": "3.1.31"
  },
  {
    "title": "GS1 Healthcare - Po Box",
    "content": "GS1 Benelux Healthcare Datamodel - Attribuut: Po Box\n\n**Identificatie**\n- Attribuutnaam (EN): Po Box\n- Business naam: nan\n- BMS ID: 6493\n\n**Definitie**\nThe post office box for the contact. \n\n**Invulinstructie**\n(See regulatory mapping tab)\n\n**Voorbeeld**\nPost office box 247\n\nBron: GS1 Benelux Healthcare Datamodel (ECHO)\nURL: https://www.gs1belu.org/en/documentation/healthcare-datamodel-3131",
    "source_type": "gs1_nl_datamodel",
    "sector": "Healthcare",
    "attribute_name_en": "Po Box",
    "business_name": "nan",
    "bms_id": "6493",
    "url": "https://www.gs1belu.org/en/documentation/healthcare-datamodel-3131",
    "version": "3.1.31"
  },
  {
    "title": "GS1 Healthcare - Country Code",
    "content": "GS1 Benelux Healthcare Datamodel - Attribuut: Country Code\n\n**Identificatie**\n- Attribuutnaam (EN): Country Code\n- Business naam: nan\n- BMS ID: 5961\n\n**Definitie**\nCode specifying the country for the address.\n\n**Invulinstructie**\n(See regulatory mapping tab)\n\n**Voorbeeld**\n250\n\nBron: GS1 Benelux Healthcare Datamodel (ECHO)\nURL: https://www.gs1belu.org/en/documentation/healthcare-datamodel-3131",
    "source_type": "gs1_nl_datamodel",
    "sector": "Healthcare",
    "attribute_name_en": "Country Code",
    "business_name": "nan",
    "bms_id": "5961",
    "url": "https://www.gs1belu.org/en/documentation/healthcare-datamodel-3131",
    "version": "3.1.31"
  },
  {
    "title": "GS1 Healthcare - Country Specific: End Availability Date Time",
    "content": "GS1 Benelux Healthcare Datamodel - Attribuut: Country Specific: End Availability Date Time\n\n**Identificatie**\n- Attribuutnaam (EN): Country Specific: End Availability Date Time\n- Business naam: nan\n- BMS ID: 6343\n\n**Definitie**\nThe date from which the trade item is no longer available from the information provider, including seasonal or temporary trade item and services.\n\n**Invulinstructie**\n(See regulatory mapping tab)\n\n**Voorbeeld**\n2023-03-13T00:00:00\n\nBron: GS1 Benelux Healthcare Datamodel (ECHO)\nURL: https://www.gs1belu.org/en/documentation/healthcare-datamodel-3131",
    "source_type": "gs1_nl_datamodel",
    "sector": "Healthcare",
    "attribute_name_en": "Country Specific: End Availability Date Time",
    "business_name": "nan",
    "bms_id": "6343",
    "url": "https://www.gs1belu.org/en/documentation/healthcare-datamodel-3131",
    "version": "3.1.31"
  },
  {
    "title": "GS1 Healthcare - Country Specific: Start Availability Date Time",
    "content": "GS1 Benelux Healthcare Datamodel - Attribuut: Country Specific: Start Availability Date Time\n\n**Identificatie**\n- Attribuutnaam (EN): Country Specific: Start Availability Date Time\n- Business naam: nan\n- BMS ID: 6344\n\n**Definitie**\nThe date from which the trade item becomes available from the supplier, including seasonal or temporary trade item and services.\n\n**Invulinstructie**\n(See regulatory mapping tab)\n\n**Voorbeeld**\n2017-03-13T00:00:00\n\nBron: GS1 Benelux Healthcare Datamodel (ECHO)\nURL: https://www.gs1belu.org/en/documentation/healthcare-datamodel-3131",
    "source_type": "gs1_nl_datamodel",
    "sector": "Healthcare",
    "attribute_name_en": "Country Specific: Start Availability Date Time",
    "business_name": "nan",
    "bms_id": "6344",
    "url": "https://www.gs1belu.org/en/documentation/healthcare-datamodel-3131",
    "version": "3.1.31"
  },
  {
    "title": "GS1 Healthcare - Carcinogenic Mutagenic Reprotoxic Type Code",
    "content": "GS1 Benelux Healthcare Datamodel - Attribuut: Carcinogenic Mutagenic Reprotoxic Type Code\n\n**Identificatie**\n- Attribuutnaam (EN): Carcinogenic Mutagenic Reprotoxic Type Code\n- Business naam: nan\n- BMS ID: 6385\n\n**Definitie**\nThe type of Carcinogenic, mutagenic, reprotoxic (CMR) substance which is contained in the medical device.\n\n**Invulinstructie**\n(See regulatory mapping tab)\n\n**Voorbeeld**\n1A\n\nBron: GS1 Benelux Healthcare Datamodel (ECHO)\nURL: https://www.gs1belu.org/en/documentation/healthcare-datamodel-3131",
    "source_type": "gs1_nl_datamodel",
    "sector": "Healthcare",
    "attribute_name_en": "Carcinogenic Mutagenic Reprotoxic Type Code",
    "business_name": "nan",
    "bms_id": "6385",
    "url": "https://www.gs1belu.org/en/documentation/healthcare-datamodel-3131",
    "version": "3.1.31"
  },
  {
    "title": "GS1 Healthcare - Global Model Description ",
    "content": "GS1 Benelux Healthcare Datamodel - Attribuut: Global Model Description \n\n**Identificatie**\n- Attribuutnaam (EN): Global Model Description \n- Business naam: nan\n- BMS ID: 6400\n\n**Definitie**\nThe description of the base model. May deviate from the description of Trade Items derived from this model.\n\n**Invulinstructie**\n(See regulatory mapping tab)\n\n**Voorbeeld**\nHealthchoice Needle Holders 22cm\n\nBron: GS1 Benelux Healthcare Datamodel (ECHO)\nURL: https://www.gs1belu.org/en/documentation/healthcare-datamodel-3131",
    "source_type": "gs1_nl_datamodel",
    "sector": "Healthcare",
    "attribute_name_en": "Global Model Description ",
    "business_name": "nan",
    "bms_id": "6400",
    "url": "https://www.gs1belu.org/en/documentation/healthcare-datamodel-3131",
    "version": "3.1.31"
  },
  {
    "title": "GS1 Healthcare - Certification Execution Country Code ",
    "content": "GS1 Benelux Healthcare Datamodel - Attribuut: Certification Execution Country Code \n\n**Identificatie**\n- Attribuutnaam (EN): Certification Execution Country Code \n- Business naam: nan\n- BMS ID: 6387\n\n**Definitie**\nThe country where the certification is performed.\n\n**Invulinstructie**\n(See regulatory mapping tab)\n\n**Voorbeeld**\n250\n\nBron: GS1 Benelux Healthcare Datamodel (ECHO)\nURL: https://www.gs1belu.org/en/documentation/healthcare-datamodel-3131",
    "source_type": "gs1_nl_datamodel",
    "sector": "Healthcare",
    "attribute_name_en": "Certification Execution Country Code ",
    "business_name": "nan",
    "bms_id": "6387",
    "url": "https://www.gs1belu.org/en/documentation/healthcare-datamodel-3131",
    "version": "3.1.31"
  },
  {
    "title": "GS1 Healthcare - Clinical Warning Code",
    "content": "GS1 Benelux Healthcare Datamodel - Attribuut: Clinical Warning Code\n\n**Identificatie**\n- Attribuutnaam (EN): Clinical Warning Code\n- Business naam: nan\n- BMS ID: 6081\n\n**Definitie**\nClinical warning information is additional information which outlines special requirements, warning and caution information printed on the package.\n\n**Invulinstructie**\n(See regulatory mapping tab)\n\n**Voorbeeld**\n-\n\nBron: GS1 Benelux Healthcare Datamodel (ECHO)\nURL: https://www.gs1belu.org/en/documentation/healthcare-datamodel-3131",
    "source_type": "gs1_nl_datamodel",
    "sector": "Healthcare",
    "attribute_name_en": "Clinical Warning Code",
    "business_name": "nan",
    "bms_id": "6081",
    "url": "https://www.gs1belu.org/en/documentation/healthcare-datamodel-3131",
    "version": "3.1.31"
  },
  {
    "title": "GS1 Healthcare - Global Model Regulatory Act",
    "content": "GS1 Benelux Healthcare Datamodel - Attribuut: Global Model Regulatory Act\n\n**Identificatie**\n- Attribuutnaam (EN): Global Model Regulatory Act\n- Business naam: nan\n- BMS ID: 6403\n\n**Definitie**\nApplicable Legislation\n\n**Invulinstructie**\n(See regulatory mapping tab)\n\n**Voorbeeld**\nMDR\n\nBron: GS1 Benelux Healthcare Datamodel (ECHO)\nURL: https://www.gs1belu.org/en/documentation/healthcare-datamodel-3131",
    "source_type": "gs1_nl_datamodel",
    "sector": "Healthcare",
    "attribute_name_en": "Global Model Regulatory Act",
    "business_name": "nan",
    "bms_id": "6403",
    "url": "https://www.gs1belu.org/en/documentation/healthcare-datamodel-3131",
    "version": "3.1.31"
  },
  {
    "title": "GS1 Healthcare - Country Code",
    "content": "GS1 Benelux Healthcare Datamodel - Attribuut: Country Code\n\n**Identificatie**\n- Attribuutnaam (EN): Country Code\n- Business naam: nan\n- BMS ID: 6341\n\n**Definitie**\nThe country in which a processing or other activity has been performed for example processing, bottling, manufacturing.\n\n**Invulinstructie**\n(See regulatory mapping tab)\n\n**Voorbeeld**\n250\n\nBron: GS1 Benelux Healthcare Datamodel (ECHO)\nURL: https://www.gs1belu.org/en/documentation/healthcare-datamodel-3131",
    "source_type": "gs1_nl_datamodel",
    "sector": "Healthcare",
    "attribute_name_en": "Country Code",
    "business_name": "nan",
    "bms_id": "6341",
    "url": "https://www.gs1belu.org/en/documentation/healthcare-datamodel-3131",
    "version": "3.1.31"
  },
  {
    "title": "GS1 Healthcare - Target Market Sales Condition Code ",
    "content": "GS1 Benelux Healthcare Datamodel - Attribuut: Target Market Sales Condition Code \n\n**Identificatie**\n- Attribuutnaam (EN): Target Market Sales Condition Code \n- Business naam: nan\n- BMS ID: 5832\n\n**Definitie**\nA code depicting restrictions imposed on the Trade Item regarding how it can be sold to the consumer for example age restrictions, selling restrictions.\n\n**Invulinstructie**\n(See regulatory mapping tab)\n\n**Voorbeeld**\nORIGINAL_PLACED\n\nBron: GS1 Benelux Healthcare Datamodel (ECHO)\nURL: https://www.gs1belu.org/en/documentation/healthcare-datamodel-3131",
    "source_type": "gs1_nl_datamodel",
    "sector": "Healthcare",
    "attribute_name_en": "Target Market Sales Condition Code ",
    "business_name": "nan",
    "bms_id": "5832",
    "url": "https://www.gs1belu.org/en/documentation/healthcare-datamodel-3131",
    "version": "3.1.31"
  }
]